id,text,anger,disgust,fear,joy,sadness,surprise
amh_train_track_b_00915,ጥር 4፤2015ቻይና የፈጠረችዉን ስጋት ለመቀነስ ጃፓንና አሜሪካ የመከላከያ ትብብራቸዉን ለማጠናከር ተስማሙ BisratNews BisratFm China USA,0,0,0,0,0,0
amh_train_track_b_00916,እግዚአብሔር ያፅናናችሁየተከሰተው ነገር በጣም ልብ ሰባሪ ክስተት ነው የሰው ልጅ ክቡር ነው ግን ለምን ጥንቃቄና ሀላፊነት በጎደለ ተግባር የሰው ልጅ ይሞታል  አፍራሽና የዕለቱ ስራ አሰሪዎች መጠየቅ አለባቸው ፍትህ ለጌትነት,0,0,0,0,3,0
amh_train_track_b_00917,መተባበራቸዉ ደስ ይላል ?,0,0,0,2,0,0
amh_train_track_b_00918,በአማራ እና በትግራይ ክልሎች አዋሳኝ ቦታዎች በድርቅ ምክንያት ሰዎች መሞታቸው ተነገረ,0,0,0,0,1,0
amh_train_track_b_00919,ምንው የኦርቶዶክስን ልጆች ስታስገድል ልብህ አልተሰበረም ውይስ እንዲት ጨርሰን ሌላ drone እንዲሰጡክ የልመና ዛዴ ነው ምንም ይስጡቅ ምንም እኛ ጋ ያለው ይበልጣል ስላ አባቶች እንባ ስላ ንፁሃን ደም ስላ ንፅት በታክርስቲያን እግዚአብሔር ይፈረዳሃል,2,0,0,0,2,0
amh_train_track_b_00920,የማናት ፀጋዬ አራርሳ? እሱ ብሔርተኛ የሆነው አንዷ ታጠብ ብላ ጥላው ሄዳ ነው አሉ በእሷ ቂም የሚጠላን?,0,1,0,0,0,0
amh_train_track_b_00921,በአለማችን ተጽኖ ፈጣሪ ሰው እግዚአብሔርን የሚፈራ ትእዛዙንም እጅግ የሚወድድ ሰው ነው፡፡ እርሱም ዘሩ በምድር ላይ ኃያል ይሆናል፡፡,0,0,0,0,0,0
amh_train_track_b_00922,ኢትዮጵያ ውስጥ በሰሜኑ ጦርነት ብቻ ከ1 milllion በላይ ሰዎች ሞተዋል እና ጦርነቱ አሁንም እንደቀጠለ ነው ግን የሚዲያ ሽፋን እራሱ አይሰጠውም 😐,0,0,0,0,1,0
amh_train_track_b_00923,በጣም ያሳዝናል ልጅቷንም ቤተሰቦቿንም አቃቸዋለው አንድ ሰፈር ነበርን ሰፈራችን ተክለሀይማኖት በተለምዶ ሱማሌ ተራ ወይም ጌሾ ጊቢ ይባል ነበር ሰፈሩ ሲፈርስ አቅም ያለው ኮዶሚኒየም አቅም የሌለው ቅያሪ የቀበሌ ቤት ሲሰጥ አቅም ስለሌላቸው የቀበሌ ቤት አቶቢስ ተራ ተሰቷቸው ነው እናቷ በምን አይነት ስቃይና መከራ የሰው ልብስ እያጠበች ልጆቿን ያሳደገችው በማረፊያዋ ልጇ እንዲ መሆኗ ያሳዝናል,0,0,0,0,3,0
amh_train_track_b_00924,ልክ ብለሃል አቶ ኤፍሬም። ዘግይተህም ቢሆን እንዲህ ማሰብህ ኣደንቃለሁ። ያኔ በትግራይ የዘር ማጥፋት ጦርነት ወቅት ይህን ቅዱስ ሃሳብ የት ተደበቀብህ? ኣንተም መርጠ,0,0,0,1,0,0
amh_train_track_b_00925,ስለወደብ ኣሰብ ተውትና ኢትዮጵያን ተፈረካክሳ እንደሶሪያ ና ሊብያ ሁና ኣገር ኣልባ እንዳትሆኑ መደንገጥ ኣለባቹ እኛ ኤ ር ት ራ ው ያ ን ግን የናንተ ጉረኝነት ኣይገርመንም ስለዚ ያልተመለሰ ችግር ካላቹ ግን ላያታቹ ሃይለስላሴና ላባታቹ ደርግ መ ሃይለማሮያም ጠይቁና መልስ ታገኛላቹ እኛ ኤርትራውያን ግን ከጎረቤት ኣገር በፍቅር ና በስላም መኖር ነው ምርጫችን በሃይል በጉራ ለመጣ ደሞ ጥሩ ኣርገን ማጉረስና ማስተናገድ እንገደዳለን,2,2,0,0,0,0
amh_train_track_b_00926,😭😭😭የኔ እህት ኡፍፍፍ ምን አይነት ጭካኔ ነው እውነት እናትሽ ናት ግን እናቴ የምትያት ሴት እሷንም ነፍሷን ይማር,0,0,0,0,2,0
amh_train_track_b_00927,ኧረ እንደዚህ አይነት ፕራንክ የለም እኔ የምወዳትን (የማፈቅራትን) ስታነባ ማየት አልፈልግም !,0,1,0,0,1,0
amh_train_track_b_00928,? ሞት ወደቀ ሲኦል ድል ሆነ !,0,0,0,1,0,0
amh_train_track_b_00929,What about 🇪🇹🇪🇹🇪🇹🇪🇹🇪🇹🇪🇹🇪🇹 ብልፅግና የሀገር ሸክምና የህዝቦቿ እራስ ምታት ከሆነ ውሎ አድሯል።ህዝቦቿን በርሃብ እና በጦርነት ከቆላቸው አመታት ተቆጥረዋል።እሚገርመው የውጭ ጠላት አይደለም የአብይ ሰይጣናዊ አሰራር ወንድሙን በወንድሙ ላይ እንዲነሳ የጦርነት ነጋሪት በመጎሰም ለግሉ ጥቅም ሲል ይኸው ሚሊዮኖች በጦርነት ወድ ህይወታቸውን ፣እና አካላቸውን አጥተዋል ።አሁንም እያጡ ነው።መቶ ሺዎች በርሃብ እና በድርቅ እየማቀቁ ነው።ይኸ,1,1,0,0,0,0
amh_train_track_b_00930,ጋዜጠኛ ተብለህ ስሜታዊ አትሁን ኤርትራ ኤርትራ አትበል የሚልህን ስማ ከቻልክ ተማር ከኢሳያስ አናት ላይ መቼ ነው የምትወርዱት ያው የወያኔ ጭንቅላት ትማራላህ ምነው ደግሞ አንተ ነህ መሬት ሰጥቶ ብለህ የጀመርከው ፌር ሲል ፌር ብለህ ደነገጥከደገምከው,1,0,0,0,0,0
amh_train_track_b_00931,እነኝህ ሰዎች አንዳንዴ ለፕሮግራማቸው የሚሰጡት አርእስት በጣም ያስቀኛል? ከኦሮሞኦነግ በስተቀር ኦህዴድን የሚያስፈራ አንዳች ነገር የለም,0,0,1,1,0,0
amh_train_track_b_00932,ዝምብሎ በይሆናል ከመባዘን የነገር መስማት መልካም ነው። እኔ ወይም እኛ ወስጥ ገብተህ መረደትህ ይገርማል ፣ ይሄ ቀርቶ እራስህን ማወቅህን እጠራጠራለሁ። መ,0,1,0,0,0,1
amh_train_track_b_00933,ጉድ አያልቅ ይከ ሁሉ ደረፋቀና ፈጣሪን ለማመስገን ቢሆን እንዴት ደስ ይል ነበር ምድሪቷም ሰላም ትሆን ነበር አባቴ በመበሻሸቅ ውስጥ ሆነክ የፈጣሪ ምስጋ ሊሆን አይችልም እራስን ዝቅ ማድረግ ይጠይቃል ይልቁንስ ንሰሀ ግቡ,0,0,0,0,0,0
amh_train_track_b_00934,እደ እሥራኤል ፈሪና አረመኔ በአለም የለም አላህ ያሥምጣቸው,1,2,0,0,0,0
amh_train_track_b_00935,ሰው እንዲያይልህ ሻማ ታበራለህግን ኢትዮጵያ ውስጥ ግድያ የእለት ኑሮ ሆንዋል ሆዳም አድርባይ ነህ ነህ መቼም,1,1,0,0,0,0
amh_train_track_b_00936,ኧረ ይሄን ደግሞ ከየት አምጥተው ጣሉብን ወይ ዘድሮ ስቱን እሰማለን እናያለን ስት ወገን እያለቀ አድቀን እንኳን ድምፅህ ያልተሰማ አውሬ ዛሬ ለጣወት አምላኪወች መልካም ምኞት ገላጭ ሆክ የሆንክ አስመሳይ ከርሳም ነህ ጠብቅ ዋጋህን ጀግኖቻችን ያጎነፅፋሀል,1,2,0,0,0,0
amh_train_track_b_00937,ነግ አንድ ነገር ብታገኙባቸው የስድብ አፋችሁን ትከፍታላችሁ አስመሳይ ሁላ,1,1,0,0,0,0
amh_train_track_b_00938,እጅግ አስደንጋጭ ነው ። ያልተጠበቀ ነው ። በህመም ነው ? ነፍስ ይማር ።,0,0,0,0,1,1
amh_train_track_b_00939,የኦሮሞን ጉዳይ ሚፈታው እግዚአብሔር ብቻ ነው ምን አልባት መሬት ተከፍታ ልትውጣቸውም ትችላለች ብዙ የንፁሃን ደም ፈሶባታል የምር በጣም ያስፈራል ፍፃሞው,0,2,0,0,1,0
amh_train_track_b_00940,100ውሸት ውሸት የሚታይበት,1,0,0,0,0,0
amh_train_track_b_00941,ያንሣታል ለማሚ ይገባታል ከዚህ በላይ በምድር ላይ ያለ ጥሩ ነገር በሙሉ ለሧ ቢሆን ቅር አይልም,0,0,0,2,0,0
amh_train_track_b_00942,ፈጣሪ ኢትዮጵያ ካሉት ከተሞች በተፈጥሮ ውብ አድርጎ የፈጠራት ምድርና ከተማ ባህርዳር ኑ ከእኛ ጋር ኑሩባት ጎብኟት!,0,0,0,3,0,0
amh_train_track_b_00943,ትላትና በጉጉት ስትጠብቅ ነበር ዛሬ ዬት ነች ቅማሞች ኑ ተለቆወል,0,0,0,1,0,0
amh_train_track_b_00944,እንዴት መሰለህ ሽ በተለይ ጀዋር መሐመድ  Ethiopia out of oromia  ብሎ ከተነሳ ወዲህ በሀገራችን አይተነዉም ሆነ ሰምተነዉ የማናዉቀዉን ግፍና መከራ አየን  የጀዋር ግብረ አበሮች እና ጀዋር ይዞት የተነሳዉ አላማ  በቃ ሐገራችንን ወደማይበርድ እልቂት ይዘዋት እየሄዱ ነዉ አለቀልን እያልን  እስካሁን ድረስ በመከራና በግፍ መካከል እያለፍን በስቃይ ዉስጥ እያለን  ትልቁና ዋናዉ የዲያብሎስ አለቃ በቅድስት ሐገራችን በዘር ፖለቲካ ህዝ,0,2,0,0,0,0
amh_train_track_b_00945,እዝች ምድር ላይ ለነፃነቱ የተታገለ ሁሉ አሸባሪ ነው ስለዚህ እስራኤልና ግብረሰዶም አጋሮቿ አያሸንፉም,1,1,0,0,0,0
amh_train_track_b_00946,እኔን የኔ እህት እኔ ልከራታታታትልሽ ዉይ በጣም ያማል ለካ የእናት ጨካኝም አለች አቤት ፈጣራ ሆይ ምንአሰማህኝ አይዞሽ 😭😭😭,0,0,0,0,3,0
amh_train_track_b_00947,“አንዳንድ ጊዜ ከካሜራ ጀርባ ቆሜ አለቅሳለሁ” የጋዛው ጋዜጠኛ,0,0,0,0,1,0
amh_train_track_b_00948,የሃንጋሪዋ ፕሬዝዳንት ለእስረኛ በሰጡት ምህረት ምክንያት ሥልጣን ለቀቁ,0,0,0,0,0,0
amh_train_track_b_00949,የዚምባብዌ ዜጎች የገንዘብ ሚኒስትራቸው 'የአፍሪካ ምርጥ' ተብለው መሰየማቸው አስገርሟቸዋል,0,0,0,0,0,1
amh_train_track_b_00950,አወይ AA ከጽልመት ተስፋ! ለሯጩ ሕዝብ ልብ ሰባሪ መንማይ ተስፋ ጋባዥ አዝማሪ አልሽ ኮተት ድበቃ ከእንግዳ እስከ መቼ ለነገው እዳ? AA እንዴ ስምሽ አበባ መሆን ደስታ ባይ,0,0,0,0,1,0
amh_train_track_b_00951,አዎ ኢሰራኢል ማለት በጣም አረመኔ ገዳይ ቆሻሾች ያውዳ ውሾች ናቸው ምን ታመጣላቹ ኢሰራኢል ደጋፍዎች,1,2,0,0,0,0
amh_train_track_b_00952,መቼ ነው ድንቅ የኢትዮጵይ ልጆች ከጦርነት ስደት ረሀብ እርዛት መንከራተት ወጥተው ወዛቸው ተመልሶ ያለ ፍርሀት መብታችው ተጠብቆ ሀላፊነታቸውን እየተወጡ በተሻለ ሁኔት የሚኖሩት? ምነ,0,0,0,0,3,0
amh_train_track_b_00953,የኢትዮጵያ ባለስልጣናት መቼ ይሆን እውነትን የሚናገሩትን እንደጦር መፍራት የሚያቆሙት? 50 አመት እውነት የተሳደደባት ሀገር !,2,0,0,0,0,0
amh_train_track_b_00954,ጦርነት ሆነ እንጂ ለምንድነው የሩሲያና የዩክሬን ጦርነት ጆሮ ለመስማት የሚፈልገው ከጦርነትም አቅም እንደትልቅ ነገር እድል የሚባል ጣኦት አይቶታል ማለት ነው አለም,0,0,0,0,0,0
amh_train_track_b_00955,አቶ ሰይፉ ድንገት ላልገባቸዉ ሰዎች ለማሰረዳት ምሳሌ ልሰጥ አንድ አባት ዘጠኝ ክፍል ቤቱን ለዘጠኝ ልጆቹ አዉርሶ ሞተ አንደኛዉ ልጅ ሰሙን እርሰቴ እንበለዉ ሁሉም ክፍሎች ለኔ ነዉ የሚገባኝ ሲል ሁለተኛዉ ልጅ ወርቃማዉ እንበለዉ አቶ እርሰቴን ቅጥቅጥ አርጓ አይቀጡ ቅጣት ቀጥቶ አንተም እንደኛዉ ወንድማችን አንድ ክፍል ታገኛለህ ዘጠኞቻችንም አንዳንድ ክፍል ይደርሰናል ብለህ ፈርም ብሎት አቶ ወርቅነህ አቶ እርሰቴ ፈረመ ከዚያ አቶ እርሰቴ ባታና,0,0,0,0,0,0
amh_train_track_b_00956,ጥጋብ የሰው ችግር አላሳይህ ብሏል፣ በዚህ ልክ በሰው ስቃይ መደሰት ምን ይሉታል? ይሄ ልጅ ብቻ እኮ አይደለም ስለ ሰራችሁት ግፍ የነገራችሁ፣ እናቶቻቸውን ከፊታቸው,1,0,0,0,2,0
amh_train_track_b_00957,ይገልብጥህ ! ደንቆሮ ካድሬ ! ተንኮል ብታቆሙ ይሄኔ ብዙ ነገር ትሰሩ ነበር፡፡ እብሪት እና ነውጠኝነት የት እንደሚያደርሳችሁ እናያለን፡፡,1,1,0,0,0,0
amh_train_track_b_00958,ጋሽ አብራር እስከ አሁን በብልፅግኒ ኤሊቶች ያሎት ተስፋ የሚገርም ነው። ኢሀዲግ የሚባል ካንሰር ስሙን እየቀያየረ ህዝብ እየፈጀ፣የሀገር ህልውናን አደጋ ላይ እ,1,1,0,0,0,1
amh_train_track_b_00959,ጥንካሬሽ የሚገረም ነው በእባ ጨረስኩት የሰው ጭካኔ ግን😭,0,0,0,0,2,0
amh_train_track_b_00960,ዋው እግዚአብሔር አብዝቶ ይባርክ ይሄ ሁሉ የአንተ የጭንቂላትህ ውጤት ነው ና ተባረክልን የሚቀጥል ትውልድ እጅግ በጣም ያመሰግንሃል በርታልን,0,0,0,3,0,0
amh_train_track_b_00961,ናፍቆህ ከሆነ ጥሩ ነው ፣ግን የሳምከው ታዘህ ስለሆነ ይከብዳል፣በድለውናል እንዋጋ አላችሁ አምነን ተዋጋን ህይወት አዋጣን፣ አሁን ደግሞ ታርቀናል አላችሁ ሰማን,1,0,0,0,1,0
amh_train_track_b_00962,ጁጁ እሚባል ሰው ጉልፈምን ምስ ምሷን ሲነግራት ደስ ሲል,0,0,0,2,0,0
amh_train_track_b_00963,አናንተን መሰሎች ደሞ ያለምንም ስስት ለህዝቡ ሞት እና ስደትን ታከፋፍላላችሁ,1,0,0,0,1,0
amh_train_track_b_00964,የሚጠየቀው ሌላ የሚመልሰው ሌላ በትግራይ ህዝብ ጥላቻ የሰከረ ሽማግሌ,0,2,0,0,0,0
amh_train_track_b_00965,እኔ ማን ነኝ ፆታየ ስራየ ምንድነዉ ክልል እና ሃይማኖቴ ያወቀ የ100ካርድ ሽልማት ኣለዉከ ቢኒሄድ ይሻላል እንዉጣ ብየ ነዉ,0,0,0,0,0,0
amh_train_track_b_00966,በጣም ደግ ከሆነ ኮ ታዲያ በመቅደምህ ኩራት ቢገባህም ልትታበይ አይገባም ። ያልካቸው ግለሰቦች ወደ አንተ ጎራ መምጣት እንደ ምርጥ አጋጣሚ ልናብራቸው ስንችል እንዲህ ያ,0,0,0,0,1,0
amh_train_track_b_00967,የተባበሩት መንግሥታት ለኢትዮጵያ የሚያደርገውን የምግብ እርዳታ አቋረጠ,0,0,0,0,0,0
amh_train_track_b_00968,መፈራት ያለበት የዳቦ ሰሙ ሳይሆን እኩይ የአሸባሪነት ተግባሩ ነው። እብሪተኛና ግፈኛ የቱንም ማስመሰያ ተግባር ቢፈፅም መቀጣቱ አይቀርም። ድንገት ይሰበራል!,2,0,0,0,0,0
amh_train_track_b_00969,ጃዋር ህውህትም ይለውጡ ክፍል ነው ይላል በለውጡ ስአት ግን ያዙኝ ልቀቁኝ ባይ ከእር በታች እሱና ቄሮ የከፈለው መስዋዕትነት ነው እያለ ነበር የተናገረው እናማ አሁን ላይ የሚናገረው ንግግር ባዶ ነው ምንም ነገር እርባና ያለው ውይይት አላገኘውበትም ድንገት ሁለተኛው ክፍል ይሻል ይሆን ያ የድሮው ጃዋር የለም,1,0,0,0,0,0
amh_train_track_b_00970,ህ ግ ፊት ቅርብ ፍርዱን ቢቀበል መልካም ነው,0,0,0,0,0,0
amh_train_track_b_00971,እህቴ! እንደአሸን የፈሉ አስመሳይ ፓስተሮች በበበዙበት ዘመን አንቺ እንዲህ መበደልሽሀ ሁሉ ነገር ለበጎ ነውና አይዞሽ!!! እንዲያው አሰመሳዮቹ እነእዩ ጩፋ ዮናታን እስራኤል ዳንሣ ምን ትላላላችሁ😂😂😂,0,1,0,0,1,0
amh_train_track_b_00972,እንደ ኢትዮጵያ ላሉ ድሃ አገሮች ላይ አይሆንም አይሰራም መንግስት የወሰደው እርምጃ ነው አደገኛ ቁማር ነው,0,1,0,0,0,0
amh_train_track_b_00973,ለዚህ እኮ ነው የሀገሪቱ መከራ የበዛው ግብራችሁ ሴጣን የሚቀናበት የታይታ ሀይማኖተኝነትቅድስት አገር ምናምን እያሉ መቀላመድ ከዛ ሲጨንቃችሁ ደግሞ ጥቅስ መ,2,2,0,0,0,0
amh_train_track_b_00974,እስኪገባን አትታክት ) በትንሹ ስሜታዊ ሆኖ፤ ደካማ ግለሰቦች ያለ በቂ ምክንያት ማወደስ ተገቢ አልነበረም። Hopefully he got a lesson by now,1,0,0,0,0,0
amh_train_track_b_00975,ምንም ማስተንቀቂያ ክስተት አያስፊልግም በእግ መተየቅ አለበትበተቸማሪ ታቢያው መዘጋት አለበትየእያ አገሪ መሪወች ደካሞች ናቸው በአደባባይ ወንጀል የሚሰራን ማተንቀቂያ ይሰታልይኤ የሰፈር እግር ክስ ሜዳ አይደለምእግ ነው የታሱት,2,0,0,0,0,0
amh_train_track_b_00976,ሰው ብቻ በመሆንህ እድለኛ ነህ ግን አላማህን ስትዘነጋ የተዋረድክ ትሆናለህ።ሺ አመት የኖረ ከኖህ በስተቀር እንጃ አልሰማሁም።ስለዚ ለፈጣሪ ኑር ብሄር ለመተዋወቅ ብቻ።,1,0,0,0,0,0
amh_train_track_b_00977,Gashe Neamin አንዳንዴ በምትለው ባልስማም በጣም አከብረዋለው ስሜታዊ ሆኖ ሳይሆን የተስማውን በሚመስለው መንገድ የሚናገር ለህአገሩ ይጠቅማል የሚለውን,0,0,0,0,0,0
amh_train_track_b_00978,እዴ ሳራየን ልቤ እስኪወልቅ ተጣድፌ እንደዚ ታደርጉኝ እ ጥሩ ነው ግን ይሄ ስራ,0,0,0,0,0,0
amh_train_track_b_00979,የሚኒሊክ ስም ሲነሳ የሚከፋው ስላለ ለጊዜው የሚኒሊክን ስም አናነሳም የምትሉ መስሎኝ ነበር። ጥሩ ላይ ናቹ።,0,0,0,1,0,0
amh_train_track_b_00980,ራስህ ከሰይጣን የከፋህ ሥርዓት አምላኪ ከዚህ ውጣ,1,2,0,0,0,0
amh_train_track_b_00981,ለንፁሀን የማይጨነቅ ጨካኝ አረመኔ ነው ጥጋብ ለፍርኦንም አልሆነ በግፍ ያሰራቸውን ፍልስጤሞች ከለቀቀ ታጋቾቹ ይስጠዋል ከዛ መቀጠል ይችላል ጦርነቱን  ሀማስ አይጠፋም ገና ገፍርስራሽ የወጡት ሀማሶች ናቸው  ዩክሬን እርምሺን አውጭ ሌላ ሀገር የሚጣላ ብታገኝ አሜሪካ እስራኤልንም ትታ ወደ አድሱ ጦር ትረዳለች,0,1,0,0,0,0
amh_train_track_b_00982,ናና ተዋጋ አተላ ነህ ይሄን ያህል የበከተ የበታችነት ስቃይ የማንነት ቀውስ እሚያሰቃይህ ሰው እማትመስል አስቀያሚ ሴጣን እከክ ነህ,1,2,0,0,0,0
amh_train_track_b_00983,የአማራን ሞት ና መፈናቀል ለመረዳት ሰው መሆን በቂ ነው ።,1,0,0,0,0,0
amh_train_track_b_00984,ብራዘር ነገ ተነስተሽ የኔ አባት ሉሲፈር ነው ትያለሽ ለነገሩ እዛም ፕራንክ ነው የምሰሩት ብሮ,0,1,0,0,0,0
amh_train_track_b_00985,አንድ አለመሆናቸው እና ጦርነት ውስጥ ገብተው ህዝባቸውን ስቃይውስጥ ላለማስገባት እንጅ አንዷ ሀማስ መሳሪ ቢኖረው ብቻ ይበቃቸዋል አሜሪካና እስራኤልን  ደግሞ ሂዝቦላ ባለፈው ጦርነት ገጥሞ እስራኢልን ደህና አድርጎ ስለገረፋት ትፈራዋለች,1,1,0,0,0,0
amh_train_track_b_00986,ታከለ ትዉልድ እንደማረሳህ እወቅ እንዲህ ሀገርና ሕዝብን መከራ ላይ ጥለህ በህዝብ ደም ነግደህ የግል ሀብትህን አካብተህ ል,1,1,0,0,0,0
amh_train_track_b_00987,ትላንት ሀገሪቱ ጭንቀት ውስጥ በገባች ጊዜ ሁሉም ኢትዮጵያዊያን የየራሳቸው አስተዋፅኦ አድርገዋል።ደሞ የአማራ ህዝብ እንጂ ፋኖ አደለም ዋጋ የከፈለው,1,0,0,0,0,0
amh_train_track_b_00988,ኑሮ እራሱ ጥቁርቁር ያለብን ለዚ ነዋ የሚገርም ትርጉም ነዉ,0,0,0,0,0,1
amh_train_track_b_00989,ሀቀኛ ነች። እንግዲህ የድፍረቱ መጨረሻ እማይነካውን፣ በዚህ ቅጽበት በዚህ ድፍረት ነክቷል። ከእንግዲህ ምንም የቀረን ነገር የለም። በህብረት ቆመን ፈርኦንና ጅ,1,0,0,0,0,0
amh_train_track_b_00990,መልካም ነገር ሥሩ ጥሩ ነው ግን እየሱስ እያድንም ውሸት ነው ከምን ለምን ያድነናል,0,1,0,0,0,0
amh_train_track_b_00991,ይድረስ ለመላ የ ሃገሬ ሰወች ለሁሉም እንዲደርስ ሸር በማረግ ይተባበሩን ከሁሉም አስቀድሜ ፈጣሩን እሄርን አመሰግናለሁ ይሄ በምስል የምታየው ወንድማቹ አንጎሶም ፍትዊ እባላለሁ እንየ ወንድማቹ 2010 ዓም ጀምሬ የአንጀት ቲቪ ተብሎ ሆደን ኦፕረሽን ተደርጌ ከባድ ስቃይ በ 2 ዓመት ውስጥ 4 ከባድ ቀዶ ጥገና እና 3 ቀላል ጥገና በመቀሌ ኣይደር ሆስቢታል አርጌ ተሽሎን ለ 6 ወር የ ትቪ መድሃንት ተሰጥቶን 2012 ዓም መድሃንቱን ጨርሼ በደንብ,0,0,0,0,3,0
amh_train_track_b_00992,የውሸት ሚዲያ ይበጠረቃል ፅንፈኛው ፋኖ ልክ እየገባ ነው ባሐርዳር ሰላም ነው ወሎም ሰላም ነው ጂላንፎ,1,2,0,0,0,0
amh_train_track_b_00993,ስለ ጦርነት ምትሰብኩ ሰዎች ምትፀፀፀቱበት ጊዜ ይመጣል።ጀዋር መሀመድ,0,0,0,0,0,0
amh_train_track_b_00994,በጣም ያሳዝናል ለበተሰቦቻቸዉ መጽናናናትን ለሞቱት ህጻናት ደግሞ እ/ር አምላክ ነፊሳቸዉን በአጸደ ገነት ያኑርሊን,0,0,0,0,3,0
amh_train_track_b_00995,እግዚአብሔርን መፈለግ ትታችሁ ጥንቆላ ግርግር የሚፈልግ ትውልድ ተመለሱ በግዜ በእግዚአብሐር ስም አትነግዱ ይህ ሰው ትልቅ ወንጀለኛ ነው በውሸት የእግዚአብሔር ሰው አትበሉ አታስቱ ትውልድ,1,1,0,0,0,0
amh_train_track_b_00996,አንድም ጳጳስ አያስፈልግም። በተለይ በእነርሱ ጦስ የሞቱት አካላቸውን፣ንብረታቸውን ቤተሰቦቻቸውን፣ሥራቸውን ያጡት ወገኖች እንባ እንዴይፋረድ።,1,0,0,0,1,0
amh_train_track_b_00997,በጣም ያስደነግጣል ያሳዝናል ምን አገኘው ፈጣሪ ነፍሱን ከቅዱሳን አጠገብ ያኑረው ወንድሜ ሞትክ መራራራ ነው,0,0,0,0,3,0
amh_train_track_b_00998,ዳኒየ እንኳን ደስ አለህ ዴጄ ይመችሽ ያራድየ ልጅ👍🥳🤯👍,0,0,0,3,0,0
amh_train_track_b_00999,የኢኳቶሪያል ጊኒ ፕሬዝዳንት ልጅ የመንግሥት አውሮፕላን በመሸጥ ተጠርጥረው ታሰሩ,0,0,0,0,1,0
amh_train_track_b_01000,እየሆነ ያለውን ማሰብ ያሳምማል ከሁሉም በላይ ግን ምንም ማድርግ እንደማትችል ማወቅ ስቃዩን ያበረታዋል ለዚህ ነው የደከመኝ ለዚህ ነው መራቅን ምርጫ ማድረጌ,0,0,0,0,2,0
amh_train_track_b_01001,ላከባቢው ሰላም ሃላፊነት ኣላት ክክ የገዛ ህዝቧ በድሮም የምትደበድብ እንዴት ላከባቢው ሰላም ጠባቂ ትሆናለች ውሸት የማይፈሩ ደደብ ሽማግሌዎች እየጠራህ ህዝብ ማደንቆር ይቁም ውሸት ይብቃ,2,1,0,0,0,0
amh_train_track_b_01002,እጅግ በጣም ያሳዝናል በእድሜ ስንታይ ትልቅ ነን ፓ/ር ቢኒያም ሽታዬ የህፃን ስራ ነው የምትሰራው የትኛውም ሰው የፈለገውን ማመንና መከተል ይችላል የመዳን ብቸኛው አማራጭ የሌለው መንገድ የናዝሬቱ ኢየሱስ ነው ሚዲያ ላይ የምታሳየው ባህሪ ፈጽሞ ተገቢ አይደለም,0,0,0,0,2,0
amh_train_track_b_01003,ኤርትራ እና አማራ አንድ ናቸው ። በሌላው ኪሳራ ፥ መስዋእትነት ፥ ሀብት ፥ እውቀት ፥ ጉልበት መኖር የዘወትር ህልማቸው ነው ።,0,2,0,0,0,0
amh_train_track_b_01004,አማን የኔ ውድ ወንድም ይሄ የዋህነትህ በፍፁም እንዳይቀየርብን እንዴት አድርገህ ሀገርህንና ህዝብህን የምትወድ ልዩ ሰው ነህ ሁላችምሁም መልካም ሰዎች ናችሁ በርቱ,0,0,0,2,0,0
amh_train_track_b_01005,ምን ማለት ነው የለመደ የከተማ ሽፍታ ማለት እኛ የሰማነው በደርግ ግዜ ከተማ ውስጥ ሰው መገደሉን ነው አሁን ልክ እንደተለመደ ሆኖ አርእስት ሲሆን ያሳዝናል ህግ ቢኖር ኖሮ ይሄ ሁሉ አይሄንም ትንሽ ቆይቶ ይሄ ወንድማችን ቁጥር ብቻ ይሆናል,1,0,0,0,2,0
amh_train_track_b_01006,የእናትነት ጥግ ደሞ የለውም! ግን አንቺ ለ feminist የሚሆን ነገር የለሽም! ሽብር ትወጃለሽ,0,2,0,0,0,0
