id,text,anger,disgust,fear,joy,sadness,surprise
amh_train_track_b_02533,የተወካዮች ምክር ቤት በህወሓት ላይ አሳልፎት የነበረውን የሽብርተኛነት ፍረጃ አነሳ,0,0,0,0,0,0
amh_train_track_b_02534,Ethio360 ባይኖር አማራ ብቻ አደለም ኢትዮጵያ ምን እደሚዉጣት አየይ ብልጽግና ብልግና ነዉ እጅ,0,1,0,0,0,0
amh_train_track_b_02535,ትንሽ አታፍርም የአማራ ኦርቶዶክስ ስትል ዘረኛ ኦርቶዶክስ መቼም ዘር አትቆጥርም ዘረኛ ሁላ ትንሽ ቆይታችሁ ክርስቶስ አማራ ነው በሉና ዳሩ ምን ታደረግ እምነት ዘር ይመስልሀል ነውረኛ ሁላ,2,2,0,0,0,0
amh_train_track_b_02536,ደህንነታቸው ለተጠበቀ መጸዳጃ ቤቶች መጨነቅ ያለብዎት ለምንድነው? ምክንያቱም ከንፅህና አጠባበቅ ጉድለት ጋር የተያያዙ በሽታዎች በጣም ተላላፊ ናቸው። 14,0,0,0,0,0,0
amh_train_track_b_02537,እንደምትንቀው አይደለም፣ በተግባር ክንዱን የቀመሱትን ጠይቅ መጀመሪያ፣ ስለምትፈራው ነው፣አንተም ምናልባት ትቀምስ ይሆናል፣ ስድብ ባዶነት መገለጫ እንደሆነ ብታውቅ መልካም ነበር፣,2,0,0,0,0,0
amh_train_track_b_02538,በዚህ አለም ትልቁ ጦርነት የቴክኖሎጂ ጦርነት ነው ትልቁ የሳይበር ጥቃት ነው,0,0,0,0,0,0
amh_train_track_b_02539,67ተኛ ነኝ የመዳም ቅመምች ሳወድችህ የግሉፊም ዉሪደት በጣም ደስ ይላል,0,0,0,2,0,0
amh_train_track_b_02540,እንዳንተ የሚያስቀኝ ሰው የለም ራስታው።እረ እንደው ጉዴ ደግሞ የምን ዲቃላ ነው ምትለው የተመታህ እኛ ኢትዮጵያውያን ጥርት ያልን እንጅ የተዳቀልን አይደለንም ያንተን አናውቅም ደግሞ እንስሳት ነው ያሳደጓቸው እረ ጉዴ ምኑ ነህ ውይይይ እረ ወዲያ,0,2,0,0,0,0
amh_train_track_b_02541,Nur Nur ዘላን ምኑን ታውቀዋለህ ከብት የከብት ልጅ,0,2,0,0,0,0
amh_train_track_b_02542,እንደውም እድለኛ ነው በሂወት መኖሩ ቢገደል ኖሮ የኢትዮጵያ ሕዝብ ሰላም ያገኛል,0,2,0,0,0,0
amh_train_track_b_02543,TIYANEWSNETWORK ከጉራጌ ለጉራጌ ጭቆናና በደል የተቋቋመ የዩቱብ ቻለናል ነው ሁሉም ጉራጌ በመግባት ሰብስክራይብ በማረግ አጋርነቱን ያሳይ!?,0,0,0,0,0,0
amh_train_track_b_02544,ናሪንዬ ስንት መከራ አይተሽ ነው እዚህ የደረሽው,0,0,0,0,1,0
amh_train_track_b_02545,ሱሌ በውንነት !ግን የወያነ መሪዋች ሊያዙ 2 ወይ 3 ቀን ነበር ግን ድንገት ጦርነቱ ይቁም ተባለ ።ምክንያቱም ቅራጥነቱ በ ምዕራባውያን ስልክ ጥሪ ምላሽ ተ,0,0,0,0,0,0
amh_train_track_b_02546,ህብረበሄር የሚጠላ ጌታህ እንጂ እኛ አይደለንም አንተ ህሊናቢስ ከርሳም የኦሮሙማ ገረድ አንተ ቆሻሻ ሰገራ,0,3,0,0,0,0
amh_train_track_b_02547,ወንድሜ ሬድዋን በጣም የሚያሳዝን ነገር ነው የገጠመህ እግዚአብሔር ላንተና ለቤተሰቡ ሁሉ መፅናናትን ይስጣችሁ,0,0,0,0,3,0
amh_train_track_b_02548,ሩሲያ የቡርኪና ፋሶ ኤምባሲዋን ከ30 ዓመታት በኋላ ከፍተች,0,0,0,0,0,0
amh_train_track_b_02549,አይዞሽ ፍቅር መች እንሚዝሽ አይታወቅም ብቻ አንቺ ስሜትሽን ተቆጣጣሪው በራሱ ጊዜ ይለቅሻል,0,0,0,0,1,0
amh_train_track_b_02550,ሀይማኖት ወይንም እምነት ከሁሉም በላይ መሆኑን የማታውቁ ብልጽግናዎች አለማወቃችሁ ምን አልባት የማይመለስ ኪሳራ ውስጥ እንዳያስገባችሁ ስጋት አለብኝ።,0,0,1,0,0,0
amh_train_track_b_02551,ጋለሞታ ሀዱሽ ገኪዳን አንዳንዴማ አቅምህን ማዎቅ ግድ ይላል እንዳ አንተአይነቱን ማህይም ቢጤህን ብትፈልግ ይሻላል ይህ ሰው በብዙ መመዘኛ እጅግ በተጋነነ ይበልጠሀል,1,2,0,0,0,0
amh_train_track_b_02552,ታዲያ እውነት አይደለም እንዴ ኤርትራ የኢትዮጵያ አካል አልነበረችም  ይሄን መናገር ደግሞ ሻእቢያ መሆን አያስፈልገውም  ተስፋዬ እኮ ኤርትራዊ ነው ለኤርትራ ማድረግ መስራት ግዴታውም ሀላፊነትም ነው መሰለል አይደለም ሞትም ሊያስከፍለው ይችላል ይሔ የማንም ኤርትራዊም ግዴታ ነው አለቀ  ተስፋዬ ድንቅ ሰው ነበር አመለጠን,0,0,0,0,1,0
amh_train_track_b_02553,የኦሮሞ ነገር ያበቃነው አለም ሳቀ ሀገር አፈረ በእውነቱ ሱውን ሰው ሲበላው እግዚኦ ይብላይ ለቀጣይ ትውልድ አገት መድፊያ የማይሺር ጠባሳ ወራሪ አውዳሚ ገዳይ መሆኑ የነበረ ታሪክ በሆንም ዛሬ አለምሰልጥኖ ከሀገር ፊት የተጠራች አገርም አረከሳችሁ አግማማችሁ,1,2,0,0,0,0
amh_train_track_b_02554,አይደለም አማራ ማንም ኢትዮጵያዊ መሞት የለበትም ስሜታዊ አንሁን።,0,0,0,0,0,0
amh_train_track_b_02555,ልዩ ዞን ጠይቀን አማራን ከግድያ እናድናለን ማለት ዘበት ነው። እስካለ ድረስ መጠየቁ፤ ማንነት ኮሚቴዎችን በየቦታው እንዲቋቋሙ ማድረግ ሁሉ ጥሩ ሃሳብ ነው፤ ነገር,1,0,0,0,0,0
amh_train_track_b_02556,መጅሊሱ በሙስሊም ማህበረሰቡ የሚገርም ስራ እየሰራልህ ከመሰለህ እንደሱ ማመን መብትህ ነው,0,0,0,0,0,0
amh_train_track_b_02557,እግዚአብሔርን መፍራት የዕውቀት መጀመሪያ ነው፤ ተላሎች ግን ጥበብንና ተግሣጽን ይንቃሉ። ምሳሌ 17,0,0,0,0,0,0
amh_train_track_b_02558,አለምነህ ዋሴ ምርጥ ይሁዳዊ ጋዜጠኛ በርታልን እኔ የኛ ሰው መሆንክን ባወቅሁበት ወቅት ከዛሬ 22 ዓመት በፊት የተሰማኝ ደሰታ ቃላቶች አይገጡትም,0,0,0,3,0,0
amh_train_track_b_02559,አሜሪካ ዜጎቿ ወደ ሜክሲኮ እንዳይጓዙ ማሳሰቢያ ሰጠች,0,0,0,0,0,0
amh_train_track_b_02560,Peace4Ethiopia ሆያ ሆየ ሁኖ ነገራችን ሁሉ ስቀን ሳንጨርስ ልቅሶ ነው መባሉ።,0,0,0,0,2,0
amh_train_track_b_02561,እንዳንተ አይነት ሰው ሰላም አይፈልግም እማትረባ ቆሻሻ ንዴታም,1,2,0,0,0,0
amh_train_track_b_02562,እለም ያገሬ ድንቅ ጋዜጠኛ አንተ ልትሸለም የሚገባህ ሰው ነህ አንድ ነገር ግን ልነግርህ ፈልጋለው ሶሻል ሚዲያ ላይ የሰፈረው ግሪሳ 90 በላይ ጤንነቱ አሳሳቢ ደረጃ ላይ ደርሳል ስለዚህ ኮሜንት አታንብብ ማንንም አትስማ እኔንም ቢሆን,0,0,0,2,0,0
amh_train_track_b_02563,የሴቷ ጥላሁን ድንቅ ነው ትልቅ ውጤት እንጠብቃለንሪታ,0,0,0,2,0,0
amh_train_track_b_02564,ሚኒሊክ ባንተ አፍ ይቀፋል አንተ ጉማማ ቀፋፊ ነገር አሁን ለራስህ እንደ አዋቂ ነህ ትቦ,0,2,0,0,0,0
amh_train_track_b_02565,ከዚ ቡሃላ ግን ያሳዝናል ቢያቋሩጡት ጥሩ ነበር,0,0,0,0,2,0
amh_train_track_b_02566,የመንጋው አብይ አህመድ ቡድን በፋኖ ግስጋሴ ጭንቅ ውስጥ ስለገባ እንደ ታየ ደንደአ አይነቱን አዲስና ሌላ በፊት አንጋሳ ከተወነው ለየት ያለ አዲስ ድራማ መስራት አስፈልጎታል ድራማው ለአማራው ህዝብ የህልውና ተጋድሎ ምኑም አይደለም ከሚጃጃሉት ጥቂት አማራወችና ሆዳም በአደኖች በስተቀር ትወናው በራሱ አማራውን አይበርደውም አይሞቀውም ምኑም አይደለማ ወደፊት ብቻ,1,1,0,0,0,0
amh_train_track_b_02567,አንቴ ፀረ ሰላም የህዝቦች ጠላት ይህ የሰይጣጠናዊ ሃሳብህ አንተንኑ ያጠፋሃል RIP,0,2,0,0,0,0
amh_train_track_b_02568,የኛ ጀግና አቡኪ እግር ኳስ ስትጫወት እራስህን ጠብቀህ ተጫወት አለበለዛ ጉዳት ህልምህን እንዳያጨልመው እፈራለሁ እና በዱአ እናግዝሀለን,0,0,1,1,0,0
amh_train_track_b_02569,አባ ስርቅ ኢትዮጵያ መገባቱ አልነበራቸውም የኢትዮጵያውያን ጠላት ናቸው,0,1,0,0,0,0
amh_train_track_b_02570,የሚገርመኝ ነገር ደሞ የፖሊሶቹ ነገር ምን እደሚፈልጉ  እራሳችሁን ጠይቃቹ ታቃላቹ ግን እኔ በበኩሌ አንድ ነገር አይቻለዉ አንድ ወንድማችን ድንገት ወድቆ ህይወቱን ያልፋል ፖሊሶች ይወስዱና ሬሳው ሲመለስ ግን ቆዳው እና ደም እየፈሠሠ ነው የቀበርነውነብስ ይማር ፍትህ ፍትህ ለወንድማችን,0,0,0,0,2,1
amh_train_track_b_02571,1515 የተደጋገሙት ዕኩይ የሆኑ ተደራራቢ ግፎች፣ ጥቃቶች፣ ጉዳቶች፣ በደሎች፣ ውድመቶች፣ ወዘተ ሁሉ፤ በተጨማሪም፣ ለሁለት ዓመታት የዘለቀስ የሰሜን ኢትዮጵያ ጦርነት ደግሞ,0,0,0,0,2,0
amh_train_track_b_02572,አሰላም አለይኩም ወረቱላሂ ወበረካቱ ማሻአ አላህ ጥሩ ትሰረራለህ ግን ሺው የለህም ዜና ሰትሰራ ቃላት አትደገጋግም የጻፍከውን ቀልጠፍ ባለ መልኩ አንብብ አስተያየት አታብዛ ቆፍጠን ቆምጨጨጭ ብታደርግ እነደ ግል አሰተያየት በርታ,0,0,0,1,0,0
amh_train_track_b_02573,ነገ በዋሰ ይለቀቃል ብዙ ገዳዮች ታሰሩ ተብሎ የዋሰ መብታቸውን አሰጠብቀው ወተዋልን ዜና እንሰማለን አይ መለስ አንተ ባለክ ግዜ እንኳን ሸጉጥ ተራ ጩቤ ይዞ የተገኘ መጨረሻው አይታወቅም ነበር ዛሬ ግን ታንክ ይዞ ቢገኝና ሰው ቢገል ይታሰራል ነገ በዋሰ ይወጣል ያሳዝናል,0,0,0,0,2,0
amh_train_track_b_02574,ዴሬ እንኳን ደህና መጣህ ደስ የሚል ፕሮግራም ነው ከዚህ ሰው በላ ከሆነ ያጋንት ልጅ ምን እንደምሰማ ባላውቅም ሐይማኖት እና የብሔር ፕለቲካ ቀላቅሎ ያንን ምስኪን ወጣት ያባላ የሞት ቅጣት የሚጠብቀው ወንጀለኛ ነው  አይቀርም አንድቀን እውነት እጅ ላይ መውደቅህ,0,2,0,1,0,0
amh_train_track_b_02575,አይይ አቺ ብደና ቀን ኢትዮጲያ ተሰደሺ ተጠግተሺ ተመሞት ስለዳንሺ በ1400 ፍልስጤማውያን ሞትና ውድመት ሶቆቃ ችግር እርሀብና ጥማት ህመምና ስቃይ መፀለያ ማጣት ትቀልጂባቸው አለሺ ቆይ እስራኤል እጃ እረጂም ነው ጋዛን አፅድታ እደጨረሰቺ ዎደ እናተ ትዞርና ትለቃቅማችሁ አለቺ ከዛ በሃላ ምናልባት ጋዛ ውስጥ ሰው ተተረፈ ያኔ እነሱም በናታላይ  የደስታ ሳቅ ይስቃሉ,0,1,0,0,1,0
amh_train_track_b_02576,ባልሽን የፈታሽዉ እኮ ሴሰኛ ስለሆንሽ ነዉ ፓስተሩም ሴሰኛ ስለሆነ ነዉ,0,2,0,0,0,0
amh_train_track_b_02577,እኔ በበበኩሌ የምንም ሀይማኖት ተከተይ ሁን ችግር የለብኝም ግን ፕራንክ እንዳይሆን,0,0,1,0,0,0
amh_train_track_b_02578,ደረጀ መረጃ በደንብ አጣራ ዞብል ተራራራ መከላከያ ተጠግቷን ብለሀን ነበር ግን ውሸት ነው,1,0,0,0,0,0
amh_train_track_b_02579,እሺ ሀይማኖት ዘር የለውም እስማማለሁ ነገር ግን ለአማራ እታገላለሁ የሚለውን ፋኖ የሚደግፋ የሲኖዶሱ አባላትንስ ምን እንበላቸው አትግደል የሚለውን ከአሥርቱ ትዕዛዛት የተፃፈበትን ታቦት አቁመው ግንባር ግንባሩን በለው የሞት አዋጅ ያወጁትን በተክነቱም  የአያታችን ርስት ቤተመንግሥቱም በኛ ላይ ያምራል እያሉን ያሉትንስ ምነው ዝም ኣላችኃቸው እየሆነ ያለው መከፋፈል አስደስቶኝ አይደለም ምነው ሲኖዶሱ ይሄ ሁሉ ጥፋት ሲካሄድ አርምሞን መረጠ ታቦት,2,0,0,0,0,0
amh_train_track_b_02580,ጃን ከድምጹ ጋራ ጠባዩም ተቀይርዋል ልጅትዋ ኢየቀየረቸው ነው ፍቅር ኢየጀመረው ነው,0,0,0,0,0,0
amh_train_track_b_02581,ፐ ሚገርም ነው ሐይቁን አዝንቦ ነው የሰራው? ተራራውን ከየት አመጣው የሚገርም ነው?,0,0,0,0,0,3
amh_train_track_b_02582,ለትግራይ ዝም፥ የኛ ሲሆን ጩሀት (የበታችነትተረኝነት ስሜት) መንግሥቴን ልታፈርሱ ነው (ፓራኖያፍርሃት) ምንፈልገው ካልተፈጸመ ምላሹ ከኢህአፓ ግዜ 3 እጥፍ የከፋ ይሆናል (,1,1,0,0,0,0
amh_train_track_b_02583,ጠ/ሚኒስትሩ ባለፈው ታህሳስ ወር ከጋሸና ግንባር ሆነው ባስተላለፉት መልዕክት  የትግራይ ህዝብ አላማ በሌለው ጦርነት በዕውር ድንብር ወጣቱን እያስጨረሱት ያሉትን የህወሃት አመራሮችን ልጆቻችን የት ናቸው ብሎ ሊጠይቃቸው ይገባል  ብለው ነበር ። በኢትዮጵያዊያን ዘንድ የማይሽር ጠባሳ ባሳረፈው ጦርነት ሀገርና ህዝብ ብዙ ዋጋ ከከከፈሉ በኋላ ነፍሰ በላዎቹን ከእስር እየለቀቀቀ ቅስምን የሚሰብር ስህተት እየፈጸመ ያለው መንግስታችንንንስ,1,0,0,0,1,0
amh_train_track_b_02584,ሰበር አሳዛኝ ዜናሼር ይደረግ! ከደሴ አቅጣጫ በአውቶብስ ተጭነው ወደ ደብረብርሃን በማቅናት ላይ የነበሩ የአማራ ልዮ ኃይል አባላት ጀዋሃ ሲደርሱ ድንገት በኦሮሞማ መንግስት ሽ,0,0,0,0,1,0
amh_train_track_b_02585,በጣም የሚገርም ነው። እንደ አንተ አይነቱ አጋስስ በአገሪቱ በየቦታው ተሰግስጎ ነው ሕይወታችንን ያከበደው። እንደዚህ አይነቱ ዜና እዉነት ቢሆን ኖሮ አንተም በዚህ ሰአት ሲኦል ነበረክ።,0,2,0,0,0,0
amh_train_track_b_02586,ኤርሚያስ ለገሰ ሀብታሙ አያሌው አገር ሁሌ በመቃወም አትገነባም መሪ ጥሩ ሲሰራ መደገፍ ሲሰሳት ትክክክል አይደለህም ብሎ መተቸት ተገቢ ነው ግን ዝም ብሎ በድፍን ጥላቻ አብይን መሳደብ ፕሮግራማችሁ የተቋቋቋመው አገር ለመገንባት እንጅ አብይን ለመሳደብ አይመስለኝም ነበር ቆይ ትግራይ ቲቪ DW ቲቪ አብይን ሲሳደቡ ነው የሚውሉት እናተ ደግሞ እንደነሱ መሆናችሁ አሳዝኖኛል ሁሌ መተቸት ለውጥ አያመጣም መፍትሔ መሥጠት ነው ለውጥ የሚ,1,0,0,0,0,0
amh_train_track_b_02587,የጌቲሽ አዲሱ ሙዚቃ በ 5 ደቂቃ ፓርላማው ደፍሮ ያልተናገራቸውን ሰፊ የፍትህ የሙስና እና የተረኝነት ችግሮች ዳሶበታለ። ከቃሉ የበለጠ ቪዲዮውን ላስተዋለው የሚገርም መልክት ይታይበታ።,0,0,0,2,0,0
amh_train_track_b_02588,Please ፕራንክ ነው እንዳትለን😂😀,0,0,1,0,0,0
amh_train_track_b_02589,ቴክሳስ ስደተኞችን ወደ ምክትል ፕሬዚዳንት ካማላ መኖሪያ ቤት ላከች,0,0,0,0,0,0
amh_train_track_b_02590,በጣም የማከብረውና የምወደው መሪያችን ኢትዮጲያዬን ዳግም አስደነገጣት ... እኔ ም በጣም ፍርሀት ውስጥ ነኝ... ግን ለምን???😢😢😢😞😞😞🇪🇹🇪🇹🇪🇹,0,0,3,0,0,0
amh_train_track_b_02591,ኤርትራ እኮ በነጻ መጠቀም ወደቡ መቼ እምቢ ኣለች ያ እብድ ኣቢ እኮ ነው የኣሜሪካ እና የምእራባውያን ኣጀንዳ ለማስፈጸም ባህር በር መተንፈሻ ምናምን ብሎ ብቅ ያለዉ ለወያኔ ስግብግብ ጁንታ ኣላቸዉ ኣሁን ደሞ ይህች ፓራላይዝድ የሆነች ወያኔ ስም ታውጥለት እንግዲህ ካገኘችለት,1,2,0,0,0,0
amh_train_track_b_02592,ስለማያውቁት ቤተ ክርስትያን ለምን ያወራል ነብይ ጉተማ ከመጽሐፍ ቅዱስ እውቀት የፀዳ ደደብ ነው ትክክለኛ የአጋንንት ተላላኪ መሆኑን ቨቅርብ ስለማቅ ነው ከሻሸመኔ,0,2,0,0,0,0
amh_train_track_b_02593,ለዚህ ተራ ሰው በእውነት እንኳን ደስ አለሽ ኢትዮጵያ ይባላል ? በጣም ያሳዝናል የዚህን እምነት ነቢያት ከጊዜ ወደ ጊዜ የሚሉት ነገር እንኳን ለሰው ቀርቶ ለሰይጣንም ይከብዳል እያየነው አሳፋሪ የሆነ የሰዎች መጫዎቻ ሆነ ገና ብዙ እና ያለን,0,1,0,0,2,0
amh_train_track_b_02594,? ሀይ ክብርሽ ግራ ተጋብተን አለቅን እኮ። Seriously literally ወያኔ ከዚህ የከፋ ምን አደረገች (ከጦርነቱ በስተቀር)? እንዳውም,1,0,0,0,1,0
amh_train_track_b_02595,አምላክ ሆይ እንደ ጂሃን አይነት አፍቃሪ ይስጠንኡመር ደነዝ አስጠላኝ,0,2,0,0,0,0
amh_train_track_b_02596,ማንም አለ ምንም ቅዱሱን ትልቁን መፀሐፍ የሚያነብ እንደሌለ ተረዳሁ። መልስ ያለው ኮሽ ይበል። ስናነብ መረደት ከሌለን ማንበባችን የፈረንጅ ተረት ሊህንብን ነዋ። አንብቦ የገባዉ ብቻ ያዋራኝ።,0,0,0,0,0,0
amh_train_track_b_02597,ቤተ ክርስቲያን ፀብ አልተፈጠረም። ነገር ግን ጥቂት ሰዎችን ቀኖና ጥሰዋል ክህደት ፈጽመዋል።ቀሪው (አብዛኛዎቹ) የሲኖዶስ አባላቱ እና መላው ኦርቶዶክሳውያን ያለት ህግ ይከበር ነው።,1,0,0,0,0,0
amh_train_track_b_02598,ወይኔ በጣም ነው የምታሳዝን እጅግ በጣም አቤቱ ማርን,0,0,0,0,2,0
amh_train_track_b_02599,እህህ ያማል እጅግ ፈጣሪ መፅናናትን ይስጣቹህ እንኳን ለቤተሰቡ ለኢትዮጵያውያንም የእግር እሳት ነው የሆነው። ምንም ይሁን ምን እርሱን እንዲህ አይነት የጭካኔ ጥግ ውግዝ ነው።,0,0,0,0,3,0
amh_train_track_b_02600,ኦሮምያ ላይ ቤት እሜያፈሱትን እዳትረሷቸዉ,1,0,0,0,0,0
amh_train_track_b_02601,የዚህ ተከታታይ ድራማ ደራሲ ግን የሚገርም ነው። ከ4 አመት በፊት ዛሬን አይተውት ነበር።,0,0,0,1,0,2
amh_train_track_b_02602,በርግጥ ምንም ቢሆን በሰው ህይወት ማለፍ ማዘን ያለ ነው ግን ያ ሁሉ ህዝብ ሲያልቅ ዝም ብለሽ አሁን እንዲ መሆን አያስተዛዝብም?,0,0,0,0,2,0
amh_train_track_b_02603,አሏህ ሆይ አንተ አግዘልን ፍልስጤሞችን ሞት ለአይኩኮሁዶች ይሁን,0,1,0,0,2,0
amh_train_track_b_02604,እነዚህ ነውረኞች ናቸው የተፈጠረውን ክስተት በይቅርታ እንዝጋው እና እኛ አንድ ሆነን መበቀል አለብን ሰሜናዊያንን አድቅቀው አይቀሩም መፈጠራቸውን እስኪጠሉ ድረስ መበቀል የግድ ይለናል እነዚሀ በበታችነት ስሜት ያበዱ ናቸው,1,2,0,0,0,0
amh_train_track_b_02605,“በቤተ ክርስቲያኗ እና በምዕመኖቿ ላይ የሚፈጸመው በምድርም ሆነ በሰማይ የሚያስጠይቅ ነው” ፡ ሲኖዶስ,0,0,0,0,0,0
amh_train_track_b_02606,እንደዛ ናቸው ። ዘረኝነት ጭንቅላቱ ውስጥ እንደ ጣና እምቦጭ በቅሎ የቡዳዋን ባንዲራ ኣድርጎ ዘረኛ ይላል ። ተራራማው ማህበረሰብ ተበክሏል,0,2,0,0,0,0
amh_train_track_b_02607,አማራነት ወይ ሞት ጨፍጫፊው የኦነግ መከላከያ ህፃናትን ሊገል ሴት ሊደፍር ነዉ እሚመጣው ለዚህም ተገቢውን አፀፋ በመስጠት ገለን እንነጠቃለንደ ድል ለአማራ ህዘብ ድል ለፋኖ።,2,2,0,0,0,0
amh_train_track_b_02608,ድሮም መንጌ ደንቆሮ የሚተነብይላት ሃገር ኤጭ። መንጌ ረጅም እድሜ የቆየው ግን ደደደብ ስለሆነ ነው። ኣሁንም 80 ዓመት ሊጨምር ይችላል,0,2,0,0,0,0
amh_train_track_b_02609,እንደ ዩቲዩበር ጭንቀት ለአብይ መመኘት እስካሁን ሞቶ ነበር ግን ጭንቀቱ ለአንተ ና ለአንተን መሰሎች ይሁን,0,1,0,0,0,0
amh_train_track_b_02610,በሱዳን ተይዞብናል የምትሉትን መሬት ማስመለስ ያልቻለ መከላከያ አሁን አንተ የምትደሰኩርለትን ያህል ጠንካራ አይደለም ከአፍሪካ አስፈሪው የጦር ሃይል ብለህ ስትበጠረቅ ትንሽ አፍህን ያዝ ልብህን ስቅ አላደረገህም ጉራችሁ ሰለቸን,1,1,0,0,0,0
amh_train_track_b_02611,ምን አይነት ቀውስ ውስጥ ነው ያላችሁት እግዚአብሔር ይማራችሁ ሌላ ምን ይባላል ገና ከመንጋቱ ወደ ሊላ አጀንዳ የናተ ደሞ ይለያል,1,0,0,0,0,0
amh_train_track_b_02612,hamas የወሰደው እርምጃ እጅግ በጣም ትንሹ እንጂ የበዛ አይደለም 75 አመት ሙሉ የበላችሁት የፍልስጤም ወጣት ሴቶች ህፃናት ከዛ በላይ ሽብር አለ ??? እስር ላይ ያለ ከአመፀ የሚመልሰው የለም,1,0,0,0,0,0
amh_train_track_b_02613,የተወገዘ ያወግዛል እዴ እንዴትአንተምአልተወገክም ጠቁመህ ስታሳስርየነበርክ ጦር ግባር ድረስ ሰታዋጋ የነበርክ አጭበርባሪ ሌባ ነህ የትግራይ አባቶች ባንተ አፍ አይሰነሱምአንተ ሴይጣን,1,2,0,0,0,0
amh_train_track_b_02614,ከመልካም ሰው ጎን መቀመጥ መልካም አያደርግም።,0,0,0,0,0,0
amh_train_track_b_02615,ትናትና መቼ ነው የምትሄደው ቻልረስ እያልኩኝ ዛሬ ተሰናበተ መልካም ሲኦል,0,1,0,0,0,0
amh_train_track_b_02616,የታባታቸው እነዚህ ተላላኪ ሆዳም አድርባይ ካድሬዎች ከሃጂዎች የዲያቢሎስ አገልጋዮች የሆኑ መምህር ተብዬ ጳጳስ ተብዬ ፓትርያርክ ተብዬ ዲያቆን ተብዬዎች ፓስተር ተብዬ ሼካ ገረመሌ ተብዬዎች በሙሉ ገና ትጠረጋላቹሁ አትጠራጠሩ አሟሟታቹሁም በጣም የከፋ ይሆናል ሬሣቹሁም የአውሬና የአሞራ መጫዎቻ ሆኖ ይቀራል አትጠራጠሩ የዘራቹሁትን የምታጭዱበት ቀን ደርሷል አንዳቹሁም አትተርፉም እመኑኝ የእግዚአብሔር ሠይፍ ሊጠርጋቹሁ ተመዟልና ታዩታላቹሁ በቅርቡ,2,2,0,0,0,0
amh_train_track_b_02617,በቀደም የጳጳሱን ንግግር ካላወገዝችሁ ብሎ አልሳክ ሲለው መንግሥት ነው ይህን እንዲያደርጉ ያዘዘው ሆን ብሎ ጥምቀት እስኪያልፍ ጠብቆ ምእመን በዛ አጋጣሚ ይቃወማሉ ብሎ ፈርቶ ምንም ያድርግ አሁንም በአንድ ሆነን እንወጣዋለን ኦርቶዶክሳውያን በተጠንቀቅ መጠበቅ አለብን አባቶቻችንን,1,0,0,0,0,0
amh_train_track_b_02618,ስለ ሥጋ ማሰብ ሞት ነውና፥ ስለ መንፈስ ማሰብ ግን ሕይወትና ሰላም ነው። ሮሜ 8፥6,0,0,0,0,0,0
amh_train_track_b_02619,ምን ይመስላሉ በእግዚአብሔር ሲያያቸው ራሱ እኮ የዲያቢሎስ መፈንጫ ነው የሚመስሉት ሶስቱም እግዚአብሔር ይመልሳችሁ ካበደ ጋር ሰው እንዴት ያብዳል እሷ የእንግሊዝ ፓውድ ነው ያሳብዳት,0,2,0,0,0,0
amh_train_track_b_02620,በገዛህ ሚስትህ የልጅህ እናት ፕራንክ ብሎ ፈልጥ ምን ይሉታል???,1,0,0,0,0,0
amh_train_track_b_02621,ጠያቂው ግን በጣም ዝቃጭ ነው! እሷን (ማርያምን) ወንፊት አላውስም እንዳለችው ጎረቤቱ እኮ ነው የጠመዳት። ምን አንገበገበው?,0,2,0,0,0,0
amh_train_track_b_02622,መርጦ አልቃሸ ቆሻሻሻ ጣቢያ! ሞትና ውርደት ከየትም ተለቃቅመው መጥተው የሰው መሬት ለወረሩት አረመኔዎቹና ጨካኝ ለሆኑት አይሁዶች ይሁን! አሚን!!!ድልና ነፃነት በመሬታቸው ለሚገደሉትና የጭካኔ ጥግ ለሚፈፀምባቸው ሚሰኪን የፊሊሰጢን ህዝቦች ይሁን! አሚን!!!,0,2,0,0,0,0
