id,text,anger,disgust,fear,joy,sadness,surprise
amh_train_track_b_01729,ብሌን በምን ሞራልሽ ነው ትዕግስቲን ምትወነጅይው ? አታፍሪም ከወራቶች በፊት አንቺና አንቺን የመሰሉ ድኩማን ያላችሁትን በተግባር የደገፋችሁትን የተጋሩን ጭፍጨፋ የ,0,2,0,0,0,0
amh_train_track_b_01730,But they already know ! የሚያሳዝነው ትላንት ስለማዕቀብ መጥፎነት እየተነተኑ ሲያስረዱ የነበሩት አሁን ያሳፍራል !,1,0,0,0,1,0
amh_train_track_b_01731,የፌደራል መንግስትን ነው የፈንጂና የመልሶ መቋቋም የሚመለከተው በማለት ማህበረሠቡ በፌደራል መንግስት ላይ አደገኛ አመለካከት እንዲያድርበት በትጋት እየሠራ ይገኛል። ለዚህ ነው አፋር,0,1,0,0,0,0
amh_train_track_b_01732,ዉስኪ ቢጠጣ አይነኩትም ነበር ከቤተሰቡ ነበር ሚጀምሩት,0,0,0,0,0,0
amh_train_track_b_01733,የኦሮሞ ክፉና ጠማማ ምሁር ተብዬዎች በሸውራራ አመለካከታቸው ኩራት የሆነውን የግዕዝ ፊደል ለማጥፋት የሄዱት ወራዳነት በታሪክ አይረሳም፣ በአዲሱ ሥር ትምህርት ኦሮሚኛ ለመማር በግዕዝ,1,2,0,0,0,0
amh_train_track_b_01734,አላህ ይሄን የመሰለ እውቀት እስከዛሬ ድረስ ለኢትዮጵያ ሙስሊሞች ተደራሽ ባለማድረግህ እንዳይጠይቅህ እፈራለሁ አሁን ተደራሽነትህን እንድታስፋፋው ስል በወንድማዊ ፍቅር እጠይቅሃለሁ አላህ የተሻለ እና በሳል የሆነ አመክንዮአዊ አመለካከትና ጥልቅ የእስልምና እውቀት ሰጥቶሀል ህዝቦችህን ጥቀምበት አላህ ይውደድህ በርታልን,0,0,1,2,0,0
amh_train_track_b_01735,በጦርነት የባህር በር ለመያዝ እየቋመጥክ ነው እንዴ? አንድ ሽፍታ መምታት ያልቻለ ሰራዊት ይዘህ ታሽቋልጣለህ እንዴ???🤔🤔🤔,1,1,0,0,0,0
amh_train_track_b_01736,ብልፅግና ኢትዮጵያ ውስጥ ሽብር ወይም የእርስ በርስ ግጭት ለማስነሳት ከትንሹም ከትልቁም ከሊቁም ከደቂቁም ጋር እንደ እብድ ውሻ እየተናከሰ ይገኛል ።ይህ ማለ,1,2,0,0,0,0
amh_train_track_b_01737,የቻይናን የለውጥ ሂደት ለ40 ዓመታት በካሜራው የሰነደው ግለሰብ,0,0,0,0,0,0
amh_train_track_b_01738,ይሄን ድንቅ መሬ ፈጣሪ ወስዶት ለናተ የሚመጥናቹሁን መሪ ስለሰጣቹ ልትኮሪ ይገባል ለነገሩ ይሄኛውም ሲበዛባቹ ነው k,0,1,0,1,0,0
amh_train_track_b_01739,አሜሪካንን ያአላህ ቁጣ ይዉረድባት የአለም ፊትና የሆነዉ የአሜሪካን ጦርነዉ በየ አለሙላይ ከበዳዮችነዉ የሚቆሙት አላህ ያጥፋልን,1,1,0,0,0,0
amh_train_track_b_01740,እኔ በድሃ አገር ውስጥ ብገኝም ከፊላዳውያንየበለጠ ደስተኛ ነኝ። የእግዚአብሔር መንግሥት ጽድቅና ሰላም በመንፈስ ቅዱስም የሆነ ደስታ ናት እንጂ መብልና መጠ,0,0,0,2,0,0
amh_train_track_b_01741,አማራ ክልል ያየሁት አሪፍ መፈክር! ትጥቅ ፍቱ ሳይሆን ትጥቅ እንፍታ ነው የሚባል ።WarOnAmhara Ethiopian Ethiopia EthiopiaPrevails,0,0,0,1,0,0
amh_train_track_b_01742,ኢቲቪ የህዳር አህያ ሆኖ አረፈው,0,2,0,0,0,0
amh_train_track_b_01743,ሟች ነው ሞት የሚፈርድ ተስፋቢስ ሰው ነህ፣ በሰሩ ሞት ትመኛለህ፣ ሟች አንተ ነህ።,1,2,0,0,0,0
amh_train_track_b_01744,ገጣጣጣ ጥርስ ምን ትመስላለች እንኳንም መልክ አይኖረሽ,0,2,0,0,0,0
amh_train_track_b_01745,በማያገባን ባንገባ ማስረጃ በማንሠጥበት ነገር ላይ ባንዘባርቅ ጥሩ ነው,0,1,0,0,0,0
amh_train_track_b_01746,አላማችው እሱ ነው ይሰውን ሞት እንዳስለመዱን የቤተክርስቲያንን አብዩዝመንት ሊያስለምዱንነው አልማቸው ?I cant wait አባቶች እንደገና ልጆቼ ተነሱ እስኪሉ,1,0,1,0,0,0
amh_train_track_b_01747,አንችን ብሎ ጋዜጠኛ የአንድ አረመኔ ፋሽት መግስቱ የፈጸመው ፋሽታዊ የደም ማፍሰስን መደበቅ እና ስለመግስቱ ማቀንቀን በጣም ያሳዝናል ያሳፍራል ሌላው አንቺ እራስሽ የፈረሳይ ወድን ይዘሽ ያገርሽን ወድ ወደቁልቁል የወረወሽ መሆንሽምን እናውቃለን,1,2,0,0,0,0
amh_train_track_b_01748,ጠሚሩ በህዝብ እንዲጠሉ ያደረጋቸው ጀብደኛ ውሸታም አታላይ ጨካኝ አስመሳይ መሰሪ የዜጎች ስቃይና መከራ እንግልት ፍጹም የማይሰማው ኢትዮጲያን በኦነግ ፕላን የመተካት,1,2,0,0,0,0
amh_train_track_b_01749,አቶ ተፈራ የአንተ እንባ,0,0,0,0,1,0
amh_train_track_b_01750,ይደመጥ በጣም የሚገርም ነዉ ።,0,0,0,1,0,1
amh_train_track_b_01751,በጣም የሚገርም ስብሰብ እኮ ነው ብአዴን በእንደዚህ አይነት አሽቋላጮች ነው ህይወቱን የሚቀጥለው።,1,1,0,0,0,1
amh_train_track_b_01752,አያስፈልግም ደግሞ ለእስራኢል ለየውዳ የዓለም ፀር ኢ/ያ አይመለከታትም ንፅዋን ገዳይ አረመነዎች ከዓለም ገፅ መወገድ አለባቸው 75 አመሜት ጨፍጭፋ ዛሬም እየገደለች ??? እንት ሆኖ ትደገፋለች ይቺ አረመነ የስው ልጅ ጠላት ... ህፃናትን ሴትን ሽማግሌን እየጨፈጨፈች ... ኦስፒታል እየመታች ቤቴ ህምነት እየመታች የስራዋን ይስጣት የሱ ይበልጣልና ...,2,2,0,0,0,0
amh_train_track_b_01753,የኢትዮጵያ ንግድ ባንክ ሽፍታ ነዉ እኔ በ ETM ማሽን 4000 አጭበርብረዋል እናም ከዚያን ጊዜ ጀምሮ ወደ ግል ባንክ አዙሪያለሁ የተበላሁትን ብር ግን ለ2ወራት ያህል ተመላልሼ ሳይመለሥ ቀርቷል,2,0,0,0,0,0
amh_train_track_b_01754,እነሆ ለሕዝቡ ሁሉ የሚሆን ታላቅ ደስታ የምስራች እነግራችኋለሁና አትፍሩ ዛሬ በዳዊት ከተማ ክርስቶስ ጌታ የሆነ ተወልዶላችኋልና። እንኳን ለብርሃነ ልደቱ በሰላም አደረሰን።,0,0,0,2,0,0
amh_train_track_b_01755,በንደናተ አይነት የላም ካካካ ክቡሩ የሰዉ ልጅ መጫወቻ ሲሆን ማየት ያማል ወደሽ ከተደፋሽ ቢሆንም ቅሉ ግን ያማል የሰዉየዉ ታዳሚዎች ጭንቅላታችሁን ከቀፀጉር ማብቀያነት አለፍ አርጋቹ ለማሰብ ሞክሩ እንዲጫወቱባቹ እድል አትስጡ ሚራክል የሚባል ነገር የለም መፅሀፉም የሚለዉ የማይሰሩ እጆች አይብሉ ነዉ ንቃ ባክህ ዝምብለህ ማገዶ አትፍጅ,0,3,0,0,0,0
amh_train_track_b_01756,የውሸት ዶክተር ገጸባህሪው አስፎገረበት,0,0,0,0,0,0
amh_train_track_b_01757,እንዴት ናቹ የመዳም ቅመሞች እወዳችሃለው ደሞ እስከ ሰኞ ትናፍቁኛላቹ መልካም ቀናት ይሁንልን ደሞ በስደት ያላቹ እህት ወንድሞቼ ጽዮን ማርያም ከኛ ጋ ትሁን በርቱልኝ ነገ ሌላ ቀን ነው እንዳትጨናነቁ,0,0,0,1,0,0
amh_train_track_b_01758,ደህና ነኝ በደምብ ኤዲት ስላልተደረገና ትንሽስሜታዊ ስለነበርኩ ነውአመሠግናለሁወ,0,0,0,0,1,0
amh_train_track_b_01759,እውነት የሰው ችግር የሚያሳስብህ ከሆነ የደሃ እንባ አስቁም Check out እፁብ ድንቅs video! TikTok,1,0,0,0,1,0
amh_train_track_b_01760,ህጉ የሚፀናው ኤርትራውያን ስለሆኑ ብቻ ነው ኢትዮጵያውያኖች ከዚህ የበለጠ አሰቃቂና ዘግናኝ ወንጀሎች እየፈፁሙ አይደል እንዴ  ከዝርፊያ ባሻገር ዝርፊያው ከግድያ ጋር አደል እንዴ ድርጊቱ እየተባባሰ አይደል  የኢትዮጵያና ኤርትራውያኖች ፍርድ የተለያየ የሆነበት ምክንያት ምንድነው ኧረ እግዚኦ መሀረነ ክርስቶስ ግፍና በደል በዛ እስቲ ሁሉም አስቦበት ሞቱ ቀርቶ በእድሜ ልክ ተቀይሮ ወንጀለኞቹ የመፀፀቻና ንስሀ መግቢያ ዘመን አግኝተው የመተንፈሻ,2,1,0,0,0,0
amh_train_track_b_01761,Benayas Azahel እኛ የምናከብረው እምነቱን ሳይሆን ባህሉን ነው። ፈጣሪ ውስጥ አዋቂ ነው:ሰው እዛ የሚሄደው እንደ ባህላዊ ፌስታቫል fun ለማድረግ እንጂ ለሆነ ግብር ወይም አምልኮ ለማካሄድ አይደለም። ይሄን ደሞ እዛ ሄደህ በማየት እንጂ ጥላቻ ስላለብህ ከሩቅ ሆነህ በመንቀፍ አይደለም: Let's go and seee! ከዛ ውጭ አታለቃቅሱብን።,1,0,0,0,0,0
amh_train_track_b_01762,ምሽትህ አታስደግጣት በጣም ጥሩ አይደለም እኔ ውሸት ይሁን ብየ ነው የጦለትሁት ይቅርታ ብቻ,0,0,0,0,0,0
amh_train_track_b_01763,እና ወዳጄ ምነዉሳ ከሚከፈልህ ቆጥበህ የጉድጓድ ዉሃ ብታስቆፍርላቸዉ ምን ነበረበት? የወገን ፍቅር በቀላሉ እርዳታ ቢሆን መልካም አይሆንም?,1,0,0,0,0,0
amh_train_track_b_01764,መቲ ከባድ ሚዛን ስርአት ሳይለወጥ ትግሬው በ ኦሮሞ ተረኞች ስለተተካ ብቻ ለሀገር ይበጃል ብሎ የሚያስብ ካለ ወይ ዘረኛ ነው ወይ የለየለት አላዋቂ ነው ባንክ ጠቀም ያለ ገንዘብ ያላቸው ሰዎች በግልፅ እየታገቱ ህዝብ በማንነቱ ተፈርጆ እየተጨፈጨፈ ከ አዲስ አበባ ናዝሬት መሄድ የህይወት ዋጋ በሚያሰከፍልበት እገተታ እና ዝርፊያ መንግስታዊ በሆነበት ሀገር የዘር ፖለቲካ ከ መንግስት ቤት ተጠራረጎ ወጣ ይለናል  የደነበረው መንግስት ብዙ ጥፋት ያደ,2,0,0,0,0,0
amh_train_track_b_01765,ብዙዎች ስለ ሰዎች ደግም ክፉም ጎንአበርክቶቸው ማውራት በሚወዱበት ጊዜ ጃ ግን ታማኝነቱ ሀቀኛነቱን አስተዋይነቱን ግሩም ድንቅ ስለሆነ ኣላወራም ጃ የ ኢትዮጲያ ህዝብ ባለውለታ ኢር ስመኘው ቋንቋውን ለማናውቀው ጭምር በዜማው የማረከ ሀጩን ጄነራል ሰአረና ገዛኸኝ አበራ ያስገደለ ዶር አንባቸውን ምግባሩን እዘዝ ብጄነራል አሳምነው ጋር እንዲጋጩ እንዲገዳደሉ ያደረገ ለስልጣኑ ስጋት ስለሆኑበት ሴረኛው ኣሪወስ ክፉ ሰው መሳይ ሰይጣን አብይ ብቻ ነዉ,0,2,0,0,0,0
amh_train_track_b_01766,አንጀው በእስራኤልና በፍልስጤም መሀል የሚደረገው ግጭት ንጽሀን ሞት ያሳዝናል,0,0,0,0,3,0
amh_train_track_b_01767,Suleymn Love ጦርነት የጀመረው ማ ወለጋ የታረደው ወላሂ አማራ አሎንም ያለው ቤት ንብረቱን ትቶ የተፈናቀለው ዋና ከተማው ላይ ሰፋሪ ነህ ተብሎ አትገባም የተባለው ለዚ ሁሉ ጥያቄ በሰላም ሲጠይቅ ፓርላማ ላይ የተሳቀበት ሞቱ እንደ ሀገር ልማት የታየበት ነው የጀመረው ወንድሜ እንደማታቅ አቱን,2,0,0,0,1,0
amh_train_track_b_01768,አይ ያሳፍራል ደግሞ ሪፓርት ቀድሞ አልተሰጠንም ብሎ ማሳጣቱ መስሎታል ንግግሩ ማንነቱን ዘረረው ቶሎ ሄዶ ፓርላማው ፊት ንሰሐ ቢገባ ምናልባት ጥሩ ይሆንለታ,0,2,0,0,0,0
amh_train_track_b_01769,Ethiopiaእርሶ ኦሮሞ ሚስቶት አማራ ልጆቻቹ ምንድናቸው ከምክር ቤቱ አባል የተነሳው ያልተጠበቀ ጥያቄ via,0,0,0,0,0,0
amh_train_track_b_01770,እስኪ ዱአ አደርጉልኝ ጭንቅ ውስጥ ነኝ,0,0,1,0,1,0
amh_train_track_b_01771,አንች ሆዳም ባይበላ ለምን አይቅርም እየሞተ ያለው ንፁህ አማራ ኦየሞተ ነው,2,1,0,0,0,0
amh_train_track_b_01772,አብይ እራሱ አሸባሪኮ ነው። ኢትዮጵያ ያረረችው በዚህ አረመኔ ጨካኝ ነው። እንዲያውም ሰውየው ከምስራቅ አፍሪካ ፖለቲካ ውስጥ እግዚአብሄር ቢያስወግድልን ነበር መልካሙ!,1,2,0,0,0,0
amh_train_track_b_01773,አደራህን እነሱንም ፕራንክ ነው እንዳትላቸው,0,0,0,0,0,0
amh_train_track_b_01774,ትንሹ በሚስከፋበት በዚ ጊዜ እንዲ አየነት ሀዘን መሸከም ከባድ ነው ግን የሰው ልጅ እንዲም ሆኖ ይኖራል አየ የሰው ልጅ,0,0,0,0,2,0
amh_train_track_b_01775,በርቱ ጊዜው የኢትዮጵያ ነውየኢትዮጵያን ታላቅነት የተረዳ ውድ መሪ ስላለን የተወስደብንን ሁሉ ያስመልስልናል ኢትዮጵያን ለማስከበር እየስራችሁ ለምትደክሙ ሁሉ ምስጋና ይገባችሃልሴራ እየከሽፈ ስራ እያሽነፈ ኢትዮጵያ ትገስግሳለች ኢትዮጵያ ካንድም ሁለት የባህር በር የነበራት አገር ነበረች ኢትዮጵያን ከቀይ ባህር መለየት አይቻልም,0,0,0,2,0,0
amh_train_track_b_01776,አንድን ህዝብ በጅምላ እየሰደብክ ነገ ጉራጌን እንደማትሰድብ ምን ማስተማመኛ አለ?ጉራጌ እጅግ ከሚጠላቸው ነገሮች አንዱ ዘረኝነት ነው።የኦሮሞንም ሆነ የአማራን ህዝብ እኩል ህዝቤ ብሎ,2,0,0,0,0,0
amh_train_track_b_01777,የአዲስ አበባን እና ኦሮሚያን መሬት አዳነች አበቤ እና ሽመልስ እጅ ለእጅ ተያይዘው ነው ተከፋፈልን ብለው ድንገት ዜናላይ በጣም ላጭር ጊዜ የታዩት በዛ ሰአት,0,1,0,0,0,0
amh_train_track_b_01778,ማን ነው እንደኔ ኡማር ሚስጥሩን በማወቁ ደስ ያለው,0,0,0,2,0,0
amh_train_track_b_01779,ወገንስ አላችህ በኢትዮጵያ አንድ ሀገር አንድ ኦርቶዶክስ ሀይማኖት አንድ ቆንቃ አሱም አማርኛ ስልጣኑም የአማራ አንዲሆን ሁሉ ነገርክ የምትሰጥ የጋዜጠኛ ፖለቲከኛ ነክ በትግራይ ጦርነት አብይ ደግፈክ ቁመክ ነበር ላደረከው ጥፋትም ይቅርታ አልጠየክም አሁን ስለፍልስጤም አስራኤል ሞት ያሳዝናል ብትሉ ከልብ ሳይሆን ቢዝነስ ነው ለተጋሩ ኢትዮጵያን ሳታዝኑ ሌላ ማ ሰብአዊነት ሊሰማችህ አይችሉም የጋዜጠኛ መርህም አናንተ የለም,1,1,0,0,0,0
amh_train_track_b_01780,ወረኛ ሁላ በእዚህ ዘመን የሰላም መጥፋቱ ለነገረኛ ጋዜጠኞች ሆድ መሙሊያ ሆነ ታዳ ለምን እንዴምታወሩት ከሆነ ተኩሰው ድራሿን አያጠፏትም ዝም ብላችሁ ወሬ አመላልሱ ይህን የማይረባ ወሬ ከማውራት ቁርአን ብትቀሪ ይሻላል ታዳ አውዳሚ መሳሪያ ይዘው ነው እንዴ የፍልስጤም ዜጎች የሚያልቁት ጋዛ እንዳልነበረች የሆነችው ነው ለአይሁድ ነፍስ አዝነው ነው ለምን እንዴናተው ያለ ሰው ይታዘበናል አትሉም እኛ በፍልስጤም ህዝብ ሞት ልቤ በሃዘን ቆስሎ መተንፈ,1,1,0,0,1,0
amh_train_track_b_01781,አፈራባታቸው ይብሉና ሀማሥን አውግዙ ከማለት እነሱ በህፃናትላይ የፈፀሙትን ክህደት ያውግዙ ድል ለተበደለው ፍልሥጤም,1,2,0,0,0,0
amh_train_track_b_01782,ይሄ ፕራንክ የምትሉት ነገር ግን በጣም ነው ሚደብረኝ ለምንድነው ፕራንክ ምናምን እያላቹ የሰው ስሜት የምትጎዱት ግን 🤔🤔🤔,0,1,0,0,0,0
amh_train_track_b_01783,ኦማር እንደዚህ ደደብ ይሆናል ብዬ አልገመትኩም ነበር,0,2,0,0,0,0
amh_train_track_b_01784,እግዚአብሔር ከተገፉት ጎን ነው የተበደለ ያሸንፍ ጦርነት ውስጥ ባይገቡ ጥሩ ነው ።,0,0,0,0,1,0
amh_train_track_b_01785,"አመረም ይሁን ኦሮሞ የዘሩትን እንደሚየጭዱነ እጥፍ እንደሚተፉ የለንበት ነበረዊ ሁኔተ ምስክርነዉ። ኦሮሞ አይደለሁም አመረ ትግሬም እንደዘዉ, መጥፎ አሎድም። በበበለይ በበበተችም አለምንም ሰዎች ነገየቸዉን በመሰብ በደል በይሰሩ እለለለዉ። ሰለም ለሀገረችን ኢቲዮጲየ",0,0,0,0,0,0
amh_train_track_b_01786,የግብርና ስራው የሚገርም ነው ነገር ግን የአሁኑን እያየን የምትፈርስ ኢጵያ አትፍጠር ጀግና በየቀኑ እየተወለደ ነው የሚድረው የኦሮሞ ምድር የሚባል የለም።,0,0,0,1,0,1
amh_train_track_b_01787,ሃይሌ ገሪማ ፕሮፌስር በአንድ ወቅት በወያኔ ዘመን ፖለቲካን አልወድም ብለው ከተናገሩ በኆላ የሳቸው ነገር በቃኝመማር ከንቱ ያኔ ም አሁንም አማራው የመከራ ገፈት እየተሽከመ ነው,0,0,0,0,1,0
amh_train_track_b_01788,እኔስ ስራ ስሩ አይደለም እንዴ ያልኩት,0,0,0,0,0,0
amh_train_track_b_01789,አባቴ ለምን ጭንቅ ጥብብ ይልሀል በምታቀው ቋንቋ ብትጽፍኮ ላንተም እረፍት ነው እኔም ምን እያወራህ እንደሆነ የገባኝ ነበር። ሙከራሽን ግን ሳላደንቅ አላልፍም?,0,0,0,0,0,0
amh_train_track_b_01790,አብይ ለራሱ ስልጣን ሲል ነው ጦርነት ውስጥ የገባው ። ወያኔ 4ኪሎ መጥታ ትሰቅለው ነበር ኦነግን በሽግግር ጊዜ ጨፍጭፈው እንዳባረሩት።,0,2,0,0,0,0
amh_train_track_b_01791,የሱዳን ቀውስ ለኛ ያለው እንድምታ ምንድነው? ከእርስ በርሱ ጦርነት ጀርባ ያለው አጫዋች ማን ነው?,0,0,0,0,0,0
amh_train_track_b_01792,መሀይምነትህን ተጠቅሞ አሜሪካ ተቀምጠህ በነጻነት ሽብር መምራት ትችላለህ ብሎ የመከረህ ክፉ ወዳጅ ነው ጠላትህ የጋሽ አያሌው ልጅ ስም ጠርተህ ያስገደልከ,1,1,0,0,0,0
amh_train_track_b_01793,በጣም ያሳዝናል ነብስህ በገንት ያኑርልን ለመላው ቤተሰብ በሙሉ መጽናናቱን ይስጣቸው,0,0,0,0,2,0
amh_train_track_b_01794,በረከታቸው ይደርብን ? በተለይ ኮቪድ 19 በሀገራችን ስጋት በነበረበት ወቅት፣ የብፁዕ አባታችን ጠንካራ አገልግሎት የቅርብ ጊዜ ትውስታችን ነው።,0,0,0,1,0,0
amh_train_track_b_01795,የአማራ ደጀን የኢትዮጵያ ህዝብ እንጂ ፋኖ አይደለም።ፋኖና የአማራ ልዩ ኃይል እያለ እኮ የኢትዮ ህዝብ አብሮት የተዋጋው ።ሠላም ሲሆን ደስ የማይላችሁ ለምንድነው?,2,0,0,0,0,0
amh_train_track_b_01796,ምድረ አውሬ ውጭ የተቀመጠ ጥይት እየገዛ ጥይት መግዣ እየላኩ የሰው ልጅን እርስ በእርስ ያገዳድሉ እንጂ እነዚህ አውሬዎች ተመልከቱ ቢገባችሁ,2,1,0,0,0,0
amh_train_track_b_01797,የአብይ ጥበቃ አራዊት ከብልፅግና በላይ ፅንፈኛ ከብልፅግና በላይ የኢትዮጵያ ጠላት ከብልፅግና በላይ ባንዳ እና ቅጥረኛ የለም,1,2,0,0,0,0
amh_train_track_b_01798,ዉይ ቅናት እንዲህ እርር ድብን ያደርጋል የሚገርም ነው ስትስርቁ ስታሰርቁ ነውጥ ለማስነሳት አንዴ በዘር አንዴ በባንዲራ አንዴ በሃይማኖት ስትተራመሱ,2,1,0,0,0,1
amh_train_track_b_01799,የተወካዮች ምክር ቤት የዶ/ር ጫላ ዋታን ያለመከሰስ መብት አነሳ,0,0,0,0,0,0
amh_train_track_b_01800,የእስራኤል ወታደር አንደ ወንድ በእግር ከተዋጋ ሐማስ ከበቂው በላይ ነው ሌላ አያስፈልግም በምናውቀው መንገድ ከመጣ ግን የአለም ሀፃናቶች እራሳቸውን ለመከላከል ሰልጠና ላይ ናቸው,1,0,0,0,0,0
amh_train_track_b_01801,ነፂ የገብርኤል ልጅ ሆንሽም አልሆንሽም ዋናው መናገር የፈለግኩት ነገር የሌላውን ባህል እና እምነት አክብሪ! ጥላቻ እና ንቀት ነው ዛሬ ሀገራችንንን እና ህዝባችንንን ዋጋ እያስከፈላት ያለው!,1,0,0,0,0,0
amh_train_track_b_01802,ሚድያ ኣገኘው ብለህ የመንደር ወሬ ኣታውራ ውሸት ጥሩ ኣይደለም ሻዕቢያ ማለት ህዝብ ማለት ነው ቱልቱላ ወሬ ብቻ,0,2,0,0,0,0
amh_train_track_b_01803,ሕዝብን ለማማማለልና የሥልጣን ዕድሜውን ለማራዘም የማይወራ ውሸት የለም።,0,1,0,0,0,0
amh_train_track_b_01804,አዎ ባለተራ ስትሆን ህዝብ አያስፈራህም የበላይ ነሃ! ህግም አያስፈራህም ህግ አንተ ነሃ! ይሄንን ማየት ያሳፍራል እንጂ አያኮራም እሺ!,1,1,0,0,0,0
amh_train_track_b_01805,ወይኔ ስታሳዝን #ሰውዬ እንዴት አስቻለው! አዬ ፕራንክ Curse to Prank,0,0,0,0,1,0
amh_train_track_b_01806,የኔ ዉድ አረመኔ እናት ናት አይዞሽ,0,0,0,0,2,0
amh_train_track_b_01807,ያኔ በጥዋቱ እንደአሁኑ በዘርና በጎሣ ከመሰከሩ በፊት ጀግናውና አገር ወዳዱ ቆራጡ መሪ ፕሬዝዳንት ኮል መንግስቱ ኃማሪያም ኤርትራ ተገነጠለች ማለት ሰው አንገቱ ተቆርጦ መኖር ያለመቻሉን ያህል ነው ጠንክሩና ወንበዴና ገንጣዩን ተላላኪ ቡድን ሻዕቢያና ወያኔን በውጊያ አሸንፉአገራችን ታፍራና ተከብራ ትኖር ዘንድ ብሎ ነበር ምን ዋጋ አለው ሰሚ አጣ ኢትዮጵያ የባንዳዎች መፈንጫ ሆና አርባ ዓመት ሊሞላት ነው ያው በአርባ ዓመት ልብ ይሏል ይባላል እ,0,1,0,0,0,0
amh_train_track_b_01808,አምቡላንሱ ውስጥ የተገደለው የጋዛው ነፍስ አድን ፈጥኖ ደራሽ,0,0,0,0,1,0
amh_train_track_b_01809,ትግራይና ጎንደር የተፈትሮ ድንበራቸው የተከዜ ወንዝ ነውጎንደሬ በወልቃይትና በተለምት ትግሬ በትግራይ ኖረዋል ይኖራሉ,1,0,0,0,0,0
amh_train_track_b_01810,በውዱ መሪ አብያችን የሚመራው የዲፕሎማሲ ሥራ እጅግ በጣም አመርቂ ውጤቶችን እያጎናፀፈን ስለሆነ ተጠናክሮ ይቀጥል  የኢትዮጵያ ተባይ የነበሩ ጋዜጠኞች ሄዱም አልሄዱም ፋይዳ የላቸውም ምክንያቱም ከሀዲዎች ናቸውና  የቀይባህር ዲፕሎማሲያችን ተጠናክሮ መቀጠል አለበት ጌቾ በርታ ደም የጠማቸውን አስወግድ,0,1,0,2,0,0
amh_train_track_b_01811,እናመሰግናለን እንኳን ደስ አለሽ,0,0,0,2,0,0
amh_train_track_b_01812,ቆሻሻሻ የገፁን ስም ቀይር ለማኝ ወራሪ የወሎን ህዝብ የማይወክል ሚዳያ ነው,0,2,0,0,0,0
amh_train_track_b_01813,ፖለቲካ እናውቃለን የምንል ሰዎች ወጥ የሆነ አቋም ቢኖረን ጥሩ ነው አንዴ ወዲህ አንዴ ወድያ እያላችሁ ሕዝቡን ግራ እያጋባችሁት ነው አንዴ የባህር በር ነው የምንፈልገው ትላላችሁ አንዴ ደግሞ የኛ ነው ትላላችሁ ወንድሜ ዛሬስ የምትለውን እስከመጨረሻው ለመስማት አልቻልኩም ሆዴን ነፋኝ አቋረጥኩት ምነው ምሁር አጣን,2,0,0,0,0,0
amh_train_track_b_01814,ሰው በድገት ይሞታል ታሞ ብቻ አይደለም ፈጣሪ በወደደው መንገድ ይወስዳል ሁሉን ነገር በሰው ነው ባንል ጥሩ ነው,0,0,0,0,1,0
amh_train_track_b_01815,ፈላሻ ነው ወይስ የፈልስጤም ሙስሊም ና ክሪስቲያን ነዋሪ ነው የሀገር ባለቤት??? አንቺ ኣያቶችሽ የዛሬ 3000 አመት ነው ወደ ኢትዮጵያ የመጣቹህት ምን ልታ ደርጊ እዛ ሄደሽ ትቃጣያለሽ???!!! ኢስራኤል ሽብር ደጋፊም ቀስቃሽም እሷ ናት።,1,1,0,0,0,0
amh_train_track_b_01816,የፋሽስቱ አብይ አሕመድ ማጠሪያ ጊዜ እየቀረበ ነው ሌላው ሕዝብ ለአመፅ ቢነሳ ከፋኖ ጋር ባጭር ጊዜ ይሔን ቁሻሻ ከነ ቨስባሳ ሠራዊት ሜዳ ላይ መቨተን ይቻላል ድል የፋኖና የሕዝብ ነው ሞት ሐፋሽስቶች,1,2,0,0,0,0
