id,text,anger,disgust,fear,joy,sadness,surprise
deu_train_track_b_01304,"Meiner Erfahrung nach lässt sich sowas nur sehr bedingt ändern. Du stehst auf dominante Männer, er ist nicht dominant. Vielleicht fehlt ihm die Kreativität, die Imagination oder es entspricht einfach nicht seiner Persönlichkeit.  Man macht oft den Fehler zu glauben, dass alle eine ähnliche Art von Sex mögen müssten oder auf diese oder jene Sachen stehen. Zwischen manchen Leuten liegen Welten und er ist auch nicht auf dem Weg zu deiner sexuellen Normalität. Er ist in seiner angekommen.",0,0,0,0,1,0
deu_train_track_b_01305,"Wahnsinn 😳 Ich kann mich noch erinnern, als ein Herr Dirk Müller genau das, vor über einem Jahr vorausgesagt hat !",0,0,0,0,0,2
deu_train_track_b_01306,Mit dem Bild habe ich vor 4 Monaten 3k gesammelt. Viel Glück dir! Guter Geschmack bei der Bildauswahl.,0,0,0,2,0,0
deu_train_track_b_01307,Eine berechtigte Reaktion auf das Massaker letztes Jahr - Verteidigung.,0,1,0,0,0,0
deu_train_track_b_01308,"Wir behandeln nun einen Satzungsänderungsantrag, dass die JA einen festen Platz im Landesvorstand erhält. #LPT #AfD #Stuttgart",0,0,0,0,0,0
deu_train_track_b_01309,Würde Kreuzfahrten einfach verbieten und das mein ich völlig ernst,1,1,0,0,0,0
deu_train_track_b_01310,Damit ist die Kirche offiziell für die AfD linksgrünversifft,0,2,0,0,0,0
deu_train_track_b_01311,"Hatte auch Mal so eine ""Beziehung"".  Mein Highlight: Ich hatte meine erste Stelle nach dem Studium angetreten und war Abends immer richtig am Arsch und wollte mal 10 min für mich, um auf der Couch zu gammeln und mir irgendwelche Scheiße auf YouTube zur Gehirnaufweichung anzusehen. Ihr Argument dagegen: Habe Mal in den Semesterferien gekellnert, 10h am Tag. Da war ich nie so müde, jetzt stell dich nicht so an. Joa als die Dame dann Mal ihr erstes Praktikum gemacht hatte, konnte sie es nachvollziehen. Hat sich aber nie entschuldigt oder so. Naja bin froh aus der Beziehung zu sein. Dir alles gute, vielleicht hilft ne Paartherapie?!",1,1,0,0,1,0
deu_train_track_b_01312,"Das tiefe Problem liegt an deinem Einstellung im Kopf.   Wenn dein Hirn eine Frau sofort zwischen 'hereitbar' oder nicht entscheidet, obwohl unterbewusst, bedeutet dass du im Kopf schon die Absicht und immer hast jemanden neu zu finden und daten.   Warst du von deiner letzten Beziehung emotional abhängig? Du suchst vielleicht nach einem Ersatz.  Das musst du selbst dran arbeiten.",0,0,0,0,0,0
deu_train_track_b_01313,Auf so einem Pedalfahrdings habe ich mir Anfang der 90er als kleiner Bub im Kindergarten einen Milchzahn ausgeschlagen... Der Anblick lässt mich erschaudern,0,0,1,0,0,0
deu_train_track_b_01314,"Ein Schritt vor, zwei zurück. Habe mich nach Jahren(!) endlich meiner Schulden angenommen, damit dass endlich von meiner Seele kommt. Dafür ist mir dann gestern ein Zahn halb weggebrochen. Ich weiß nicht ob ich es schaffe zum Zahnarzt zu gehen, aber es ist ein Zahn der beim Lächeln sichtbar ist. Bemitleide und hasse mich grade selber, halte mich dadurch ab andere wichtige Dinge zu erledigen.",1,0,1,0,2,0
deu_train_track_b_01315,"Ich hab das Gefühl ich müsste es sehen.  Wobei keiner will, das ich Blut sehe.",0,1,1,0,0,0
deu_train_track_b_01316,das kenne ich zu gut 🙄,0,1,0,0,0,0
deu_train_track_b_01317,"So langsam erkennt man auch die Taube in ihm. ""Damals"", als er noch ein kleines Küken war, hätte ich nicht erraten um was für ein Vogel es sich handelt.",0,0,0,0,0,1
deu_train_track_b_01318,"Erstmal wünsche ich dir alles Gute und, dass die Symptome bald nachlassen.  So weit ich weiß, sollen Gynäkologen keine Beschäftigungsverbote ausstellen. Meine Frauenärztin meinte auch, wenn sie dürfte, würde sie eigentlich jede Schwangere ins BV schicken.  Warst du schon bei einem Betriebsarzt deswegen?  Mein AG hat mit zu dem für unsere Region geschickt um auf der sicheren Seite zu sein. Dieser hat mich direkt ins BV geschickt.  Habe aber auch schon leider mitgekriegt, dass es da strengere und nicht so strenge gibt..",0,0,0,0,1,0
deu_train_track_b_01319,"In Deutschland wird systematisch geleugnet, dass ein Genozid im Gazastreifen stattfindet. Wenn ihr euch gefragt habt, wie es sein konnte, dass die deutsche Mehrheitsgesellschaft den Holocaust stillschweigend hingenommen hat: wir erleben es gerade live mit.",1,1,0,0,1,0
deu_train_track_b_01320,"Ich denke damit ist dir 12. Schwangerschaftswoche gemeint. Das heißt von dem ersten Tag der letzten Regel vor der Schwangerschaft, was ca. 2 Wochen bevor man überhaupt schwanger sein kann, ist.   Warum das so ist, darf wer anders erklären, ich versteh es leider auch nicht. :D Geht's da um ""volle"" Monate zum rechnen?",0,0,0,0,0,0
deu_train_track_b_01321,"Wie kommt es, dass du so hervorragend Deutsch sprichst?  Was ist, würdest du sagen, die Meinung der Russen über Deutschland?  Danke fürs Q&A.",0,0,0,0,0,0
deu_train_track_b_01322,Der Gedanke an eine schwere Krankheit lässt mich nachts nicht schlafen.,0,0,2,0,1,0
deu_train_track_b_01323,er besitzt mehr ehre als der ganze rest hier auf twitter aber gut das er es doc nicht getan hat,0,1,0,1,0,0
deu_train_track_b_01324,Nur Liebe für Stumpf &lt;3,0,0,0,1,0,0
deu_train_track_b_01325,"Religion ist wenn der Tod eines Einzelnen vor 2000 Jahren wichtiger ist, als der Tod von momentan Hunderten täglich.",0,1,0,0,1,0
deu_train_track_b_01326,"Hatte auch einen Frühabbort bei der letzten Schwangerschaft, aber keine Tabletten verschrieben bekommen. (Nun in der 35ten Woche) Ich würde es ganz einfach als Unterstützung sehen. Progesteron ist vor allem bis zur 12ten Woche wichtig und wenn du somit die Chance auf eine weitere Fehlgeburt verringern kannst, ist es doch gut. Wenn du dir aber unsicher bist, frag doch nochmal deinen Arzt oder lies den Beipackzettel.",0,0,0,0,1,0
deu_train_track_b_01327,"Wir bezahlen die anderen Täter doch auch gleich direkt. Als ob da nicht alles an die Hamas gehen würde, was nach Gaza geschickt wird.",1,1,0,0,0,0
deu_train_track_b_01328,twitter ist wie crack wenn es schädlich wäre,0,1,0,0,0,0
deu_train_track_b_01329,Wer schützt uns vor Umweltschützer?,1,1,0,0,0,0
deu_train_track_b_01330,Ich hab mich endlich aufgerafft und bin heute aus der Kirche ausgetreten. Und es fühlt sich gut an.,0,0,0,2,0,0
deu_train_track_b_01331,Danke dafür! Deine Arbeit für die Sache ist so wichtig! 🖤✊🏾,0,0,0,2,0,0
deu_train_track_b_01332,"Läuft zwischen deiner Ex-Verlobten und deinem ältesten Freund dann jetzt was ernsthaftes?   Wow, echt wilde Geschichte. Kenn ich eigentlich nur aus Filmen und Serien.",0,0,0,0,0,1
deu_train_track_b_01333,"Ich hatte das bei meinem Großen auch ziemlich stark, da hat mir ein halbes Brötchen gereicht um den halben Tag satt zu sein. War nur blöd weil ich voll gestillt habe und meine Hebamme hat mir da sehr ins Gewissen geredet weil es einfach für mich und mein Kind nicht gesund war.  Ich war innerhalb von 2 Monaten wieder auf meinem Vor-Schwangerschafts Gewicht... ich hab mich bemüht mehr zu essen und ganz viel Stillvitamine genommen weil ich dadurch auch einen krassen Eisenmangel hatte. Nach ein paar Monaten ging es wieder aber bis dahin musste ich mich wirklich an jede Mahlzeit erinnern, hab mir Wecker gestellt und wir haben uns oft was geholt.",0,0,0,0,0,0
deu_train_track_b_01334,AfD ist rechts. Aber keinesfalls rechtsextrem. Da gibt es einen gewaltigen Unterschied.,0,0,0,0,0,0
deu_train_track_b_01335,"Moin, ich werde das erste mal Vater und hab eine Frage zum Thema Ultraschalltermine. Habt ihr euch dafür jedesmal Urlaub genommen oder wie habt ihr das gemacht? Wie oft ist das denn in der Schwangerschaft?   Danke schonmal für eure Hilfe.",0,0,0,0,0,0
deu_train_track_b_01336,"Hihi, also unter Corona eindrücken könnte man eher behaupten das Gegenteil sei 16 Jahre lang der Fall gewesen 😂",0,1,0,1,0,0
deu_train_track_b_01337,"Wie läuft das ab, wenn es mal eine Schaden geben sollte? Kann ja immer mal passieren. Sei es beim parken oder eben bei einem der Sonderwünsche. Oder anders gefragt. Schon was kaputt gemacht? Hat man vielleicht sogar schon mal versucht dir oder einen Kollegen einen Schaden unter zu jubeln?   Wie lief das abwerben beim neuen Arbeitgeber ab? Einfach so gefragt worden ""hey willst ab morgen für mich fahren?""",0,0,0,0,0,0
deu_train_track_b_01338,Was können wir angesichts von Israels Völkermord tun? 1. Israel kritisieren und verurteilen wann und wo immer es geht! 2. Ab sofort keine proisraelischen Politiker und Parteien mehr wählen! 3. Pro-palästinensische Aktionsbündnisse unterstützen! 4. Zionistischen Lobbyismus ächten!,2,1,0,0,0,0
deu_train_track_b_01339,nene bin schon krank also ich bin aber noch nicht so krank.,0,0,0,0,0,0
deu_train_track_b_01340,Mein schwester lan haltet Abstand ‼️‼️,1,0,0,0,0,0
deu_train_track_b_01341,"Bist du vielleicht gut aussehend? Babyface, 1,70m? Wenn ja, ich denke das es damit zu tun hast das die leute denken dass sie alles mit dir tun können weil du kurzer bist und ein Babyface hast und dich ärgern wollen weil du besser aussieht als sie.  (Entschuldige bitte mein Deutsch, ich bin es noch am lernen Ü)",0,0,0,0,1,0
deu_train_track_b_01342,Diskriminierung ist Strafbar und wir leben echt in einer Diktatur . Nachrichten berichten nur das was der Staat vorgibt . Puten hat und hatte mit allem recht . Wir lassen uns unterdrücken .,2,1,0,0,0,0
deu_train_track_b_01343,Als ältester von deinen Geschwistern ist es deine Aufgabe allen jüngeren einzureden das man sie im Müll gefunden hat🤝🏼,0,0,0,1,0,0
deu_train_track_b_01344,Die USA sollten sich mäßigen Israel zu ermahnen. Israel handelt moralisch richtig.,0,0,0,0,0,0
deu_train_track_b_01345,"Kenne ich nur zu gut. Bin mal gespannt welche Tipps hier kommen. ""Witzig"" finde ich auch, dass man aufgrund seines Berufs eine gewisse Expertise in seinem Fachbereich hat, die Leute am Tisch sich aber lieber für das Halbwissen der anderen interessieren und mandann Mühe hat einige Sachen klarzustellen. Dabei wird man dann ständig unterbrochen.",0,1,0,0,0,0
deu_train_track_b_01346,Warum wird plötzlich zum Totschlag in Münster geschwiegen? Warum werden die Täter zu Opfer umgedeutet?,1,0,0,0,0,1
deu_train_track_b_01347,So wie früher in 🇵🇱 unter kommunistischer Herrschaft.,0,0,0,0,0,0
deu_train_track_b_01348,Die Idee ist großartig! Ich wette du bist Rollenspieler! Danke für die tolle Geschichte!,0,0,0,3,0,0
deu_train_track_b_01349,"Der beste Urlaub meines Lebens war eine Mongolei Expedition. 4.000 Offroadkilometer quer durch dieses wundervolle, wilde Land war atemberaubend. Die Gastfreundlichkeit der Nomaden war genauso beeindruckend wie deren Lebensweise. ALLES wird verwertet, kein Stück Müll oder Reste bleiben zurück wenn die Familie sich nach ein paar Wochen einen neuen Standort sucht.  Fantastisches Land und Leute.",0,0,0,3,0,1
deu_train_track_b_01350,Grüße dich. Vor ein paar Wochen hat hier in der Nähe ein Polizist dreimal auf ein flüchtendes Fahrzeug geschossen.  Der PKW hatte wohl zuvor noch beschleunigt und ist direkt auf den Beamten zugefahren. Nach meinem Kenntnisstand könnte der Kollege für jede Kugel ne Woche Urlaub nehmen zum Berichte schreiben ect.  Ist das wirklich so schlimm mit dem Schriftkram bei sowas?,0,0,0,0,0,1
deu_train_track_b_01351,Was für eine Überraschung! Meine Eltern haben mir ein Auto geschenkt.,0,0,0,2,0,2
deu_train_track_b_01352,"Nächstes mal nimmst du gefälligst meine Katzen, meine Frau, unsere Angeln und mich mit. So ist das ganz schön frech, findest du nicht? :P",0,0,0,1,0,0
deu_train_track_b_01353,"ist vielleicht ne unangenehme Frage, aber das hab ich mich schon länger gefragt, wie das bei einer Querschnittslähmung ist: Klappt bei dir der Stuhlgang, bzw. merkst du, trotz Lähmung, wenn du musst?",0,0,0,0,0,0
deu_train_track_b_01354,"Solange die Garantie der Hersteller für Entschädigung bei Impfschäden abgelehnt wird, KEINE Impfung! 😡",3,1,0,0,0,0
deu_train_track_b_01355,Ich bin 24 und seit 2020 bin ich jetzt Patient im Maßregelvollzug aufgrund einer Straftat aus 2019 unter Alkoholeinfluss.  Fragt gerne alles was euch interessiert und lernt vielleicht ein wenig aus meinen Fehlern :),0,0,0,0,0,0
deu_train_track_b_01356,"Ich glaube, man muss ""Nebenwirkungen von Medikamenten"" und ""Impfreaktion"" unterscheiden. Wenn Du impfst, geht der Körper aus Vollkurs Verteidigung - das ist in Ordnung so - auch wenn keine Gefahr besteht.  Nebenwirkungen wären, wenn Du einen dritten Arm bekommst oder grüne Pusteln auf dem Po.",0,0,0,0,0,0
deu_train_track_b_01357,"Digga alles was gelb ist ist nervig oder hässlich  Bienen, Wespen, gelbe Bonbons (kein Mensch will Zitrone essen)",1,2,0,0,0,0
deu_train_track_b_01358,"Der leichteste Weg ist, die Polizei zu verständigen. Die haben die Möglichkeit, zum einen den Unfall aufzunehmen und zum anderen gibt es die Möglichkeit eine Meldung zur Überprüfung der Fahreignung (Paragraph 2 Absatz 12 StVG). Diese Meldung ist der schnellste Weg, der Führerscheinstelle solche Vorkommnisse mitzuteilen.   Und bezüglich deines Tipps mit dem Zettel beim Unfall hinterlassen, rechtlich gesehen reicht das nicht aus um seinen Pflichten nachzukommen. Es gibt diverse Urteile, dass trotz des Zettels das Entfernen von der Unfallstelle vollendet ist. Und die Konsequenz sind hohe Strafen.",0,0,0,0,0,0
deu_train_track_b_01359,"Gute Besserung, das tut mir echt leid :/  Leider wissen sehr viele nicht dass richtige Katzenbisse (auch von der eigenen Katze) immer vom Arzt abgeklärt werden sollten und Notfälle sein können.  Wir mussten unsere Arbeitskollegin einmal fast zum Arzt zwingen weil sie meinte es wäre alles nicht so schlimm und man sieht ja noch gar nichts. Der Arzt war gar nicht erfreut darüber wie locker sie das genommen hat!",0,0,1,0,1,0
deu_train_track_b_01360,Das tut mir so leid für euch.  Ich versuche bei sowas immer dankbar über die gemeinsame schöne Zeit zu sein und mich vor allem an den positiven Erinnerungen festzuhalten.,0,0,0,0,2,0
deu_train_track_b_01361,"Der Autofahrer, der bei 0:37 auf die Autobahn fahren wollte hat sich schön erschrocken.",0,0,0,0,0,0
deu_train_track_b_01362,"Erst lässt Selenskyj den Bürgerkrieg in seinen östlichen Landesteilen zu, um russischstämmige Ukrainer zu beseitigen, und nun sieht er zu, wie seine jungen Männer auf dem Schlachtfeld sterben oder ins Ausland flüchten. Er wird bald selbst beseitigt 👍",2,1,0,0,0,0
deu_train_track_b_01363,"Ich komme zwar aus Berlin, kann dir zu deiner Frage aber leider auch nichts sagen. Ich wollte nur einen kleinen Sprachtipp dalassen: c-section heißt auf deutsch 'Kaiserschnitt', um Verwirrung zu verhindern :) Alles Gute dir!",0,0,0,0,0,0
deu_train_track_b_01364,"In einem tiefen Tunnel versteckt sich Yahya Al-Sinwar und schützt sich mit Kindern, Frauen und Alten. Nach Kriegsende wird er wie eine Maus aus dem Tunnel auftauchen und sagen: „Ich habe gewonnen.“ Leider wurden diejenigen vertrieben, die vertrieben wurden und Hungrige und die ihr Zuhause und ihre Kinder verloren haben, werden ihm applaudieren.",1,2,0,0,2,0
deu_train_track_b_01365,Viele Regale wären leer,0,0,1,0,0,0
deu_train_track_b_01366,"Komisches krokodil   Edit: danke fuer die awards, das erste mal dass ich welche bekommen hab, und dann auch noch fuer so nen intellektuell hochwertigen kommentar!",0,0,0,2,0,1
deu_train_track_b_01367,"Auf jeden Fall jetzt schon anfangen.  Ich hab ""erst"" in der 12. Woche angefangen und viele waren schon voll.  Ich telefonier nicht so gerne, also hab ich auch einigen Hebammen eine E-Mail geschrieben, wenn eine Adresse angegeben war um erstmal herauszufinden ob sie noch Kapazitäten hat.  Hast du vielleicht Freunde, die dir eine Hebamme empfehlen können? Wenn man auf persönliche Erfahrungen von anderen zurückgreifen kann, ist es ja auch ganz gut.  Es steht dir auf jeden Fall eine Hebamme zu, nutz das, egal was dein Hintergrund ist. Die Hebamme kümmert sich ja nicht nur um das Neugeborene sondern auch um die Neu-Mama.",0,0,0,0,0,0
deu_train_track_b_01368,"Ich glaub Boris Johnson hatte seine US Staatsbürgerschaft abgetreten, weil er als US Bürger dort auch hätte Steuern zahlen müssen. Wie schaut es da bei dir aus, gilt das für alle oder erst ab einem bestimmten Einkommen? Oder kann man das umgehen?",0,0,0,0,0,0
deu_train_track_b_01369,Keine Stadthalle für Nazis ✌️,1,2,0,0,0,0
deu_train_track_b_01370,Der Russenknecht heult? Gut so. Mit der internationalen Hilfe für die Ukraine ist Euer Geldgeber aus dem Kreml bald erledigt.,1,2,0,1,0,0
deu_train_track_b_01371,Die Bösen Viecher wenn man das Licht im Keller ausmacht und wieder hochrennt.,0,0,0,0,0,0
deu_train_track_b_01372,"Die Energie wird nie wieder billiger werden, da der Staat jeden Cent benötigt um Milliarden in der ganzen Welt verschleudern zu können",2,1,0,0,0,0
deu_train_track_b_01373,"Wenn Du sie unterstützen möchtest, melde Dich doch einfach vielleicht über Chat, ob und wo Du sie unterstützen kannst.   Je nachdem wie nahe ihr euch steht, kannst Du ihr Hilfe im Haushalt anbieten, aber auch Essen bringen, einkaufen oder einfach ein bisschen da sein.",0,0,0,1,0,0
deu_train_track_b_01374,Diese Nacht hoffe ich auf sehr viele brennende orcs. Diese Wut und der Hass wächst und wächst ins unermessliche,2,1,0,0,0,0
deu_train_track_b_01375,Ein weiterer Fortschritt aber du bist richtig cute !!,0,0,0,2,0,0
deu_train_track_b_01376,"Kommt am Ende auf das Labor an. Ich bin mir ziemlich sicher, dass 5 Tage so der Richtwert ist, aber habe auch schon von längeren Wartezeiten gehört. Ein guter Arzt schaut sie sich ja dann nochmal an und sagt dann Bescheid bzw lässt Bescheid sagen, wie die Ergebnisse sind. Denke mal, dass die sich dafür dann auch noch mal ein paar Tage Raum gegeben wird.",0,0,0,0,0,0
deu_train_track_b_01377,"Als Kind. Die Tante schickte zu Weihnachten ein Päckchen. Der Karton versprach von außen einen Soundblaster für den PC. Wir waren gerade im vollen PC-Selbstbau-Alter. Wir konnten es kaum abwarten bis Heiligabend...Karton aufgerissen, drin waren: Socken! Selbst gestrickt! Hässlich! Kratzig! Der Soundblaster trötete derweil fröhlich im PC vom Onkel.",0,1,0,0,1,1
deu_train_track_b_01378,"Ich habe auch nun von 36/37 Größe 38 nötig.  Das ganze ist jetzt aber erst nach meiner zweiten Schwangerschaft. Also 36 habe ich schon nach der ersten nicht mehr tragen können. Meine Podologin meinte, dass sei halt nicht so selten weil ja mehr Gewicht auf die Füße drückt und man dann oft breitere Füße auch bekommt.",0,0,0,0,0,0
deu_train_track_b_01379,"Auf jeden Fall ihm das ganze erklären.  Wenn er sauer ist, dann is man einen toxischen Bekannten los. Er hat keinerlei Berechtigung auf deinen Freund sauer zu sein, da der nix falsches getan hat.  Wenn er vernünftig ist is er eine toxische Beziehung los.  Fucking hell, wenn ich so durch die Kommentare lese is echt erschreckend was für schlechte Freunde leute hier sind... einfach nicht einmischen und so ein anderer nonsense. Wenn Freunde von mir betrogen und dadurch disrespected werden und möglicherweise in einer längeren Beziehung bleiben ohne das zu wissen und ich das ändern kann dann ist das eine moralische Pflicht. Sonst ist man nicht mit der Person befreundet.",1,1,0,0,1,0
deu_train_track_b_01380,"Die Abläufe hat vor allem unser Gegner drin, wenn er die langen Bälle abläuft.",0,0,0,0,0,0
deu_train_track_b_01381,"Größtes Problem der #AfD-Bubble: vollständig fehlende Medienkompetenz, ""informieren"" ausschließlich in der AfD-Bubble und die konsequente Verweigerung, mehr als eine Überschrift zu lesen. #Correctiv",1,1,0,0,0,0
deu_train_track_b_01382,"Korrektur: es heißt Klimaterroristen. Bitte, gern geschehen.",1,1,0,0,0,0
deu_train_track_b_01383,Also Geld für die Folgen bereitstellen während man weiter Teil der Ursache ist? Ok cool,1,1,0,0,0,0
deu_train_track_b_01384,Ich freu mich unglaublich für dich/euch!  Es ist nie zu spät um liebe zu finden :)  Wünsche euch alles gute <3,0,0,0,3,0,0
deu_train_track_b_01385,"Warum wird eigentlich so wenig darüber geredet, dass die Arbeit des #UNRWA sehr gefährlich ist, so gefährlich, dass bereits mehr als 150 Mitarbeiter bei dem Versuch getötet wurden, humanitäre Hilfe für die völlig verzweifelte Bevölkerung in #Gaza zu organisieren?",1,1,0,0,1,0
deu_train_track_b_01386,Wenn die Vollidioten aus der Politik verschwunden sind.🙄,2,1,0,0,0,0
deu_train_track_b_01387,"Besonders beliebt ist auch ""Wir mussten während Corona auf so viel verzichten"". Der Satz kommt bestimmt von denen, die während Corona auch gern auf die Maske verzichtet haben.",1,1,0,0,0,0
deu_train_track_b_01388,"Ich komme aus einer sehr bildungsfernen Hartz IV Familie, habe als einzige Person in der gesamten (auch erweiterten) Familie das Gymnasium besucht und das Abitur gemacht. Danach habe ich im In- und Ausland studiert, arbeite nun und bin ein Teil der Mittelschicht. Das fühlt sich für mich immer noch alles sehr surreal an.  EDIT: Bis auf wenige Ausnahmen, bin ich wirklich positiv überrascht von dem respektvollen und aufgeschlossenen Umgang mit dem Thema. Ich möchte mich bei allen bedanken, die hier in dieser Weise mit mir interagiert haben.",0,0,0,2,0,1
deu_train_track_b_01389,"Fändest du es genauso unterhaltsam wie ich wenn wir Doping Olympiade hätten? Wo jeder soviel Zeug nehmen und spritzen kann wie er/sie will und dann einfach ab dafür? 100 m Lauf mit 40 km/h, Weitwurf über 2 km und das ganze Basketballteam is 3 meter im Durchschnitt?",0,1,0,1,0,0
deu_train_track_b_01390,"Was muss man alles machen um dorthin auszuwandern? Und was muss man beachten? Nicht nur was den reinen Prozess des Auswanderns angeht, sondern auch was sich im Leben so am stärksten ändert. Frage als jemand der das später auch machen will",0,0,0,0,0,0
deu_train_track_b_01391,"In der Schule waren zwei, die sich geprügelt haben. Ich bin hin und wollte sie auseinander ziehen. Dabei habe ich einen von beiden von hinten umfasst, beide Arme waren am Körper und habe ihn mit einem Ruck nach hinten weggezogen. Habe ihm so den rechten Arm gebrochen.  Wie man es macht, macht man es falsch.",0,0,0,0,1,0
deu_train_track_b_01392,"Sehr schön! Auch das Tierchen schön in den Fokus bekommen, Belichtung gefällt mir auch. Sehr gut :)   Meine Freundin ist auch ein bisschen talentiert und ich versuche auch oft dagegen anzustinken und mich zu verbessern :D Bleib dran",0,0,0,2,0,0
deu_train_track_b_01393,Krieg ist die Hölle auf Erden!,0,1,1,0,2,0
deu_train_track_b_01394,"Wie alle anderen schon gesagt haben... Cyto und Röteln sind kein Spaß, wenn du schwanger bist. Falls du zögerst, ins Verbot zu gehen, dann frag dich am besten vorher, ob du jemand bist, der sich schnell Vorwürfe machen würde, wenn es am Ende leider nicht ganz klappt.  Viele Frühschwangerschaften gehen ja, wie du wahrscheinlich weißt, bis zur 14. Woche noch ab, teils völlig grundlos, bedauerlicherweise gibt es dann aber viele, die sich trotzdem fragen oder eben gar Vorwürfe machen, ob sie etwas hätten anders machen sollen, hat mir meine Hausärztin mal ans Herz gelegt.",0,0,1,0,0,0
deu_train_track_b_01395,Sehr geil. Da wird mein Sammlerherz ganz schön neidisch - aber sei Dir natürlich gegönnt. Behalte sie in Ehren. 👌👍,0,0,0,2,0,0
deu_train_track_b_01396,"Das ist zwar schön geschrieben, aber es klingt so als wäre das Ziel am Ende Suizid. Oder irre ich mich da?",0,0,1,0,1,0
deu_train_track_b_01397,"Fit werden. Das Leben ist um Größenordnungen geiler, wenn man fit ist.  Andererseits ist es auch nie zu spät dafür.",0,0,0,1,0,0
deu_train_track_b_01398,"#Kriegstreiber, #Hetzer und #Rüstungslobbyist #Masala lehnt bei #Maischberger Verhandlungen im #NATO #Stellvertreterkrieg in der #Ukraine gegen #Russland ab und sagt, wir müssten uns an #Krieg gewöhnen. Die #Militarisierung in den Öffentlich Rechtlichen weitet sich aus.",1,1,0,0,0,0
deu_train_track_b_01399,"In dem frühen Stadium kann man das nicht so richtig sagen, aber periodenähnliche Krämpfe sind zumindest nichts Außergewöhnliches. Deine Gebärmutter dehnt sich schon. Ich hatte ganz am Anfang auch solche Schmerzen, aber eher im oberen Bereich des Unterleibs und im Rücken statt noch weiter unten wie sonst bei meiner Periode, und nicht so stark. Bei mir war alles in Ordnung. Viel Glück!",0,0,0,0,0,0
deu_train_track_b_01400,"Was sind das nur für Menschen, ein Land in einen Krieg zu führen und das eigene Land dadurch zu zerstören.",1,2,0,0,1,0
deu_train_track_b_01401,"Ich glaube es war so um die 20. SSW rum, dass ich die Kleine gespürt habe. Durch die Vorderwandplazenta hatte ich aber selbst am Ende der Schwangerschaft nie große Beulen am Bauch, die durch Tritte verursacht wurden.",0,0,0,0,0,0
deu_train_track_b_01402,"Klimabonus für Asylwerber ist gut füttern für Flüchtling hinter Grenzen von Österreich , das ist schmutzige politik von Politiker.",1,2,0,0,0,0
deu_train_track_b_01403,Zum Cop sein geboren. Fehlen nur noch die auf den Daumen gepressten Oakleys.,0,0,0,0,0,0
deu_train_track_b_01404,Jedes andere land hätte schon längst sanktionen ohne ende gesehen und würde wirtschaftlich und politisch geächtet werden.... aber nicht israel,2,1,0,0,0,0
deu_train_track_b_01405,Beiden unterstützt und finanziert den Genozide auf GAZA und dann will er großzügig sein und Hilfsgüter abwerfen nachdem er selbst die Hungersnot zu verantworten hat. #free Palestine 🇵🇸,1,2,0,0,0,0
deu_train_track_b_01406,Free Palästina 🇵🇸 ich hoffe die Wünsche der Israelis werden wahr und Netanyahu wird abgesetzt! Er muss dafür büßen!,1,1,0,0,0,0
