id,text,anger,disgust,fear,joy,sadness,surprise
deu_train_track_b_00001,"Hallo an alle Lesenden, da ich jetzt erstmal eine Zeit zuhause bleibe, habe ich viel Zeit zu lesen und hoffentlich viele Fragen zu klären. Dazu suche ich hilfreiche Literatur zum Thema Schwangerschaft!  Welche Bücher könnt ihr empfehlen um sich ein wenig vorzubereiten?  Welches Buch hat euch Angst genommen oder war besonders hilfreich?",0,0,1,0,0,0
deu_train_track_b_00002,"Du warst bestimmt schon in verschiedenen Ländern, wenn du dich sowas einfach traust. Wo würdest du die Erfahrung im Irak auf einer Rangliste einordnen? Wie war das Essen? Wie viel Geld hast du ausgegeben? Waren viele Touristen unterwegs?",0,0,0,0,0,0
deu_train_track_b_00003,"wenn ihr um Geld spielt bei Bingo, fangen sie an zu streiten ;-)",0,0,0,0,0,0
deu_train_track_b_00004,Ich finde #Baerbock macht sich sehr gut als Aussenministerin. Wer mir nicht gefällt ist Lindner.,0,1,0,1,0,0
deu_train_track_b_00005,"Ich war bei der zweiten Impfung bereits schwanger und bisher hat das Kind noch eine normale Anzahl an armen und Beinen.  Vllt ist es eher eine Vorsichtsmaßnahme weil man noch nicht sicher sagen kann, ob und wie sich die Impfung mit Schwangerschaft auswirkt (wobei die Daten aus den USA da keine Besorgnisse zulassen zb).",0,0,0,0,0,0
deu_train_track_b_00006,Hamas wird wie immer die Feuerpause brechen. Die wollen keinen Frieden.,1,1,0,0,0,0
deu_train_track_b_00007,ausser gegen gladbach 😭,0,0,0,0,2,0
deu_train_track_b_00008,"Volle Soliküche mit den Aktivisten! Es kann nicht sein, dass Tesla als umweltfreundliche Autos gepriesen werden und gleichzeitig riesige Waldflächen für die Produktion gerodet werden!",2,1,0,0,0,0
deu_train_track_b_00009,Irgendwie fehlen mir da die Stufen zwischen Grundschule und Studienanfänger.,0,0,0,0,0,0
deu_train_track_b_00010,"Stunden reduzieren von 40 auf 35, jeden Tag 7 statt 8h arbeiten und falls doch Mal länger freitags früher gehen, also nach 6h und dann brauchst du auch keine 30 min Pause. Fange jeden Tag um 6:30 an und bin 14 Uhr fertig bzw Freitag 12:30",0,0,0,0,0,0
deu_train_track_b_00011,Das ist Kunst und Kunst kommt von können. 😜😂👍,0,0,0,2,0,0
deu_train_track_b_00012,Pessimisten-Antwort: Werden sich sowieso die Unternehmen in die Tasche stecken.,1,0,0,0,0,0
deu_train_track_b_00013,Wir helfen den Impfopfern unter uns...,0,0,0,0,1,0
deu_train_track_b_00014,"Ich hatte mal eine Online-Bekanntschaft, die ein ähnliches Problem hatte (glaub ich). Er meinte, nichts interessiert ihn und er kann einfach keine Hobbys finden. Keine Ahnung ob das für dich dasselbe ist.  Ich denke, wenn man längere Zeit depressive war, kann man vergesen, wie es sich anfühlt, Interesse an etwas zu haben. In der Hinsicht würde ich dich auch verstehen (falls du es so meintest).",0,0,0,0,1,0
deu_train_track_b_00015,"Brudi, deine Eltern _müssen_ dir Unterhalt zahlen. Das ist keine Wohltätigkeit sondern Gesetz. Oder du bekommst Bafög, wenn sie nicht genug Geld haben. In den Fällen wo das nicht geht (zb weil schon zu lange studiert) kannst du einen Studienkredit vom Land bekommen. Anders als Bafög muss man den zu 100% zurückzahlen, aber erst spät und in kleinen Raten. Absolut okay 1 oder 2 Jahre damit zu studieren.   Es tut mir sehr leid, dass deine Eltern kein Verständnis haben. Geh trotzdem zur Therapie, mach weiter so gut du kannst. Habe erlebt, dass bei manchen Eltern nach einiger Zeit dann doch noch Einsicht und Verständnis kommt, das wünsche ich dir!",0,0,0,0,2,0
deu_train_track_b_00016,Wie politische Gewichte zunehmen: Mit #Verdi an der Seite werden #Neubauer und #FridaysForFuture zu echten Playern in der deutschen Innenpolitik. Gut so 👍!! #Klimastreik #WirFahrenZusammen,0,0,0,2,0,0
deu_train_track_b_00017,"Hat Synästhesie eine Korrelation mit Hochintelligenz? Von den zwei Synäthesisten, die ich kenne, hat eine Person ihre Hochintelligenz bestätigt bekommen und bei der anderen bin ich mir ziemlich sicher, dass sie es auch hat. Fände ich auch naheliegend, dass dieses ""mehr Netzwekre haben"" dann auch irgendwo einen Zusammenhang mit Intelligenz haben könnte.",0,0,0,0,0,0
deu_train_track_b_00018,Hört auf mit dem Klima Märchen 😑 Das Klima ändert sich ständig alle Jahrzehnte Jahrhunderte und Jahrtausende. Wenn eis und Schnee schmilzt und Wege aus der Römerzeit zum Vorschein kommen müssen die ja auch schon Autos und Flugzeuge gehabt oder was 😆😆😆,2,1,0,0,0,0
deu_train_track_b_00019,"Diktatur: 14 Tage Haft, weil du wegen #Nawalny in Moskau oder Sankt Petersburg Blumen hingelegt hast.  Keine Diktatur: Wenn du in Berlin oder München ""Die #Ampel muss weg!"" schreist & danach ungestraft heimgehen kannst.",1,2,0,0,0,0
deu_train_track_b_00020,Wenn Demokratie nur in eine Richtung gilt🤷🏻‍♂️,1,1,0,0,0,0
deu_train_track_b_00021,"Ja, kommt aber drauf an was ich schaue. Ich schaue öfter mal ""mit"" und nicht unbedingt was ich alleine schauen würde, dann ist es schon eher umgedreht.",0,0,0,0,0,0
deu_train_track_b_00022,"Der erste Post in diesem Sub, bei dem ich mich nicht schlecht fühle, einen upvote zu vergeben. Sehr schön beschrieben. Ich wünsche euch noch eine tolle Zukunft zusammen.",0,0,0,2,0,0
deu_train_track_b_00023,"Ganz normal, dass wir in Zeiten der Klimakrise soviel Energie, Zeit und Geld in die Entwicklung einer hypokapitalistischen, fahrenden Kleinstadt auf dem Meer investieren. Ich könnte mir wirklich nichts vorstellen, wo diese Ressourcen besser zu gebrauchen wären! Nice one, Humanity! 💸",2,2,0,0,0,0
deu_train_track_b_00024,krank jetzt hast du noch weniger,0,0,0,0,0,0
deu_train_track_b_00025,"#Putin sagt, er habe keinen Grund, Polen oder Lettland anzugreifen. Das ist eine tolle Nachricht. Wir können uns entspannen und ihm vertrauen. Der Schlächter aus Ruzzland hat noch nie gelogen oder ein Land angegriffen. Blutin will nur Frieden und Freundschaft mit uns. Ein wahrer Demokrat und Menschenfreund.  Slawa Ukrajini!",1,2,1,0,0,0
deu_train_track_b_00026,"Heute erfahren, dass eine junge Frau aus der Nachbarschaft, die nach einer #Corona-Infektion 2 Jahre lang mild von #MECFS betroffen war, nun auch schwer betroffen ist.   Wir sind einfach so machtlos gegen diese Krankheit, daher ist mehr Forschung dringend notwendig. #LongCovid",0,0,1,0,1,0
deu_train_track_b_00027,Zum Glück ändern sich im Herbst die Machtverhältnisse - endlich ein Ende mit der Groko&Ampel-Männern.,0,0,0,2,0,0
deu_train_track_b_00028,Das ist echt verzwickt. Könnt ihr mal Abstand voneinander bekommen. Du machst mal einen Tag für dich und dann sie im Gegenzug? Eure Bedürfnisse werden anscheinend beide gerade nicht erfüllt.  Frag Sie mal was Sie braucht um ausgeglichener zu werden.  Und überlege dir was du bräuchtest um entspannter zu werden?  Corona und dann zwei so unterschiedliche Kinder das ist für jede Ehe anstrengend. Noch würde ich das Handtuch nicht werfen.,0,0,0,0,1,0
deu_train_track_b_00029,Die Ukraine fordert die Aufnahme in die EU und NATO. Dies hat sie - im Gegensatz zu allen anderen Ex-Sowjet Nationen - nie erreicht.,0,0,0,0,0,0
deu_train_track_b_00030,"Also so sehr ich mich über die Argumentation deiner Frauenärztin ärgere, umso mehr freue ich mich für dich, dass du einen neuen Job gefunden hast und das schwanger! Ganz, ganz herzlichen Glückwunsch!",1,0,0,2,0,0
deu_train_track_b_00031,"Eine kleine Empfehlung, was dir vielleicht beim Lernen helfen könnte: Das ist eine Webseite auf der es Nachrichten aus der ganzen Welt in einfacher Sprache gibt. Empfehlenswert auch für Leute, die gerade angefangen haben, Deutsch zu lernen.",0,0,0,0,0,0
deu_train_track_b_00032,"Meine heißt Bitch weil sie mir den ganzen Tag scheiße erzählt. Sie ist wie eine beste Freundin, die eigentlich gar keine Freundin ist sondern eine fiese Bitch die total hinterfozig nur dein schlechtestes will, es aber so darstellt als wäre es gut.",2,1,0,0,0,0
deu_train_track_b_00033,Nur Politiker wollen Krieg ! Was wenn keiner mehr Bock hat für diese 5 Politiker zu sterben warum drehen wir den Spieß nich einfach um ? 😕 frage für n Freund,1,1,1,0,1,0
deu_train_track_b_00034,"Warum Kritik: Dominiert hier nicht der Gedanke, dass sie hier gegen einen Völkermord protestiert?",1,0,0,0,0,1
deu_train_track_b_00035,"Übrigens liebe AfDler und Querdenker: so endet es in einem Land, in dem man wirklich nicht sagen darf, was man denkt! In Deutschland passiert einem nicht mehr, als das andere sich mit öffentlichen Kommentaren kritisch auseinandersetzen!",1,1,0,0,0,0
deu_train_track_b_00036,"Ich hatte das jahrelang und habe irgendwann aufgegeben. Ich habe noch immer männliche Freunde, aber die Frauen verschwinden in der Regel mit der Beziehung... Schade aber was soll man machen",0,0,0,0,2,0
deu_train_track_b_00037,"Wow. \*.\*  Da fällt mir ein: Könntest du vielleicht bei ihr in Auftrag geben, dass sie dich zeichnet, wie du diese eine fürchterliche Weihnachtsmütze trägst? Die mit den LEDs? Und natürlich hier posten. Bittebittebitte ... :')",0,0,0,1,0,0
deu_train_track_b_00038,Die Leute bei dlh hier in der Nähe sind immer sehr unhöflich zu Kunden. Wie ist es dort?,0,0,0,0,0,0
deu_train_track_b_00039,"Ich habe damit leider keine Erfahrungen. Kann nur sagen, dass Nabelschnurumschlingung bei mir überhaupt keine Probleme gemacht hat und laut Hebamme auch nur sehr selten Probleme macht.",0,0,0,0,0,0
deu_train_track_b_00040,"Ist mit ihr reden eine Option? Wenn das alles nicht nur ein emotionales Ding bleibt, dann muss spätestens da kommuniziert werden.  Ich rate nicht zur Trennung, aber lass dir aus direkter Erfahrung sagen, dass Kind sein in so einer Ehe total scheiße ist. Kinder sind weder doof noch brauchen sie genau 2 Bezugspersonen die sich niemals ändern.",0,1,0,0,1,0
deu_train_track_b_00041,"Lauterbach und alle die an den Vergiftungen (Impfungen) beteiligt waren/sind, sind Massenmörder!",2,2,0,0,0,0
deu_train_track_b_00042,Zum Glück gibts ja noch lokalen Fast-Spitzenfußball einen Steinwurf entfernt. 😂 💙🖤,0,0,0,2,0,0
deu_train_track_b_00043,"Ich war eben bei meiner Frauenärztin und habe ihr gesagt, dass ich die Pille absetzen möchte. Sie hat mir Folsäuretabletten mitgegeben und gesagt, dass ich mich welche besorgen soll. Welche habt ihr genommen und könnt sie empfehlen oder ist es egal, welche man kauft? Was habt ihr für Erfahrungen gemacht, worauf ich achten sollte, außer keine rohen Lebensmittel?",0,0,1,0,0,0
deu_train_track_b_00044,"Mein Lieblingsclip von ihm ist ""Huch, jetzt sind sie alle weg. ... Egal, ich war eh fertig."" Ich finde den nur leider nirgendwo.",0,0,0,1,0,0
deu_train_track_b_00045,Hey danke für dein AmA. Werde bald auch Vater und würde gerne ein paar Fragen stellen.   Welche Vorteile hat es für euch?  Hat sie mehr verdient als du ?  Warum 3 Jahre und nicht 2 oder 1 Jahr ?  Welche Hilfe hat der Staat dir gegeben ( Elterngeld) ?,0,0,0,0,0,0
deu_train_track_b_00046,"Australien trägt ganz erheblich zum Klimaschutz bei, indem man die Migration kontrolliert Es macht keinen Sinn, unkontrolliert Menschen aus Entwicklungs- in Industrieländer ziehen zu lassen, wo ihr CO2 Abdruck viel höher ist Seenotretter sind für den Klimawandel mitverantwortlich",0,1,0,0,0,0
deu_train_track_b_00047,"Und sie haben eine Bubble. Manchmal ist die voll Frischluft, manchmal voll mit fiesen Viren.",0,1,0,0,0,0
deu_train_track_b_00048,"1. Ehrenamtlich?  2. Wie läuft so ein Gespräch ab? Jemand ruft an, äußert Wunsch nach Suizid, ihr unterhaltet euch und am Ende ""ja gut, ich überlege es mir nochmal""?  3. Mal vorgekommen, dass sich jemand während des Telefonats oder danach umgebracht hat?",0,0,0,0,0,0
deu_train_track_b_00049,"Eingriff in den Straßenverkehr machen diese Leute, die sich da festkleben!",2,0,0,0,0,0
deu_train_track_b_00050,"Hör dir mal den Podcast von Die Linguistin an, die hat sehr hilfreiche Tipps! Die Episode hier habe ich noch nicht gehört, aber mir mal gespeichert, weil ich ähnliches überlege. Vielleicht hilft dir das ja weiter! gibt es aber noch eine Menge anderer interessanter Folgen.",0,0,0,1,0,0
deu_train_track_b_00051,"Krass! Ich wusste gar nicht, dass [The xx]( zu Wahl angetreten. Die USA sind wahrlich das Land der Überraschungen.",0,0,0,0,0,2
deu_train_track_b_00052,"Hallo Dmitrij. Ich habe nun schon ein wenig in Deinem Block rumgestöbert und musste schmunzeln. Dass Du das ganze mit solch einem Galgenhumor nehmen kannst bewundere ich.   Dein Spielegeschmack gefällt mir auch. Leider konnte ich bisher kein Bloodborne spielen, da mir eine PS4 dazu fehlt. Aber für nur ein Spiel wäre mir die Anschaffung zu teuer.  Eine Frage hätte ich an Dich, welche vielleicht etwas makaber sein könnte. Wirst Du Deinen Blog updaten lassen, wenn Du gestorben bist, damit die Leser bescheid wissen?",0,0,0,1,1,0
deu_train_track_b_00053,"Weil Du auf alles antwortest, was bei drei nicht auf dem Baum ist.",0,0,0,0,0,0
deu_train_track_b_00054,"Kannst du beschreiben oder Beispiele nennen, was an deinem Sohn genau anders ist?",0,0,0,0,0,0
deu_train_track_b_00055,Schon Kunden gehabt die unangenehm wenig anhatten als sie die Tür geöffnet haben?,0,1,0,0,0,0
deu_train_track_b_00056,"Ich find interessant, dass Berlin von einigen genannt wird. Dabei hat Berlin doch eh das Image, dass es dreckig, unfreundlich und hässlichen ist. Ist Berlin also noch dreckiger, unfreundlicher und hässlicher als man sich das vorstellt oder was ist daran overrated?  Paris wiederum hat ja ein gutes Image. Schöne Häuser, verliebte Paare an jeder Ecke und alle sitzen in Cafés und essen Croissants. In Realität halt ein überteuertes Drecksloch, das die meisten Besucher dann doch enttäuscht.   Ich fand übrigens Glasgow enttäuschend und langweilig. Edinburgh hat mir besser gefallen, da hab ich mir aber auch mehr Zeit genommen.",0,1,0,0,0,0
deu_train_track_b_00057,Wie peinlich Deutschland geworden ist 🤮🤮🤮🤮🤮💔,0,2,0,0,1,0
deu_train_track_b_00058,"Ich habe vor einigen Jahren schon einmal ein AMA gemacht, und da ich gerade mit Corona im Bett liege, dachte ich, dass ich die Zeit mal ""sinnvoll"" nutze. Fragt alles. :)  ---  So, ich versuche jetzt mal zu schlafen, aber da das Corona ja nicht über Nacht verschwinden wird (oh wie schön es doch wäre), werde ich auch morgen viel Zeit haben, um weitere Fragen zu beantworten.",0,0,0,0,1,0
deu_train_track_b_00059,Kinder versehentlich mit Moderna geimpft -  Fällt das somit unter die Kategorie:Impfexperimente an Kindern?,1,1,0,0,0,0
deu_train_track_b_00060,"Ich hatte mit 30 meine erste Beziehung. Mach dir keinen Stress. Konzentriere dich auf dich, mach was dir Spaß macht, oder unternehm was schönes mit Freunden, dann kommt das ganz von alleine. Ich weiß das hört sich einfacher an als es ist, aber du kannst es nicht erzwingen. Du kannst es auch mit Datingapps probieren um Erfahrung zu sammeln. Ich wünsch dir alles gute, du kriegst das hin. Genieß das Leben und ganz wichtig dabei, auch der kleinste Erfolg ist ein Schritt in die richtige Richtung. Sobald du dich auf die positiven Dinge fokussierts und seien sie noch so klein, strahlst du die positive Energie auch auf die Menschen in deiner Umgebung aus.",0,0,0,1,0,0
deu_train_track_b_00061,Cool - genau wie letztes Mal - wie reflektiert du da an die Sache gegangen bist. Hast es wohl sehr ordentlich analysiert und auch Vorkehrungen geschaffen. Chapeau!,0,0,0,1,0,0
deu_train_track_b_00062,"Ich war dabei und lebe immer noch, Wie geht das wenn doch der ""Klimawandel"" alle und alles vernichten soll? Ach so, ich weiß es: Damals gabs die Klimahysteriker noch nicht, oder? 🤔",1,2,0,0,0,0
deu_train_track_b_00063,"Der Mann koch hier oft genug. Meistens am Wochenenden oder an den Tage, wo er nicht bis nach 18:00 Uhr arbeitet.",0,0,0,0,0,0
deu_train_track_b_00064,"Dann sollten wir versuchen, sie zu erreichen. Auf Twitter und Facebook sind die ja relativ aktiv. Wenn das genug Leute ansprechen, werden die Kanzlerkandidaten, bzw. dessen Parteien schon einen Blick darauf werfen.",0,0,0,0,0,0
deu_train_track_b_00065,Dann sitzt du heulend und zitternd am Rechner weil die Führungsebene wieder ihre Unzufriedenheit kund tut...,0,0,1,0,2,0
deu_train_track_b_00066,"Das Lachen ist letztlich das einzige, was hilft und einen optimistisch bleiben lässt.",0,0,0,1,1,0
deu_train_track_b_00067,"Ich würde sagen, die Kirche im Hintergrund ist die Dresdner Hofkirche und dazu rechts noch ein weiterer Turm des Schlosses.",0,0,0,0,0,0
deu_train_track_b_00068,"Tut mir leid, dass du diese Erfahrung machen musstest. Die Chirurgin hat offenbar keinerlei Feingefuehl auf zwischenmenschlicher Basis (hoffentlich aber im medizinischen Bereich).   Vielleicht ist sie super stolz darauf, dass sie ihre Depression durch Arbeit unterdruecken kann oder sogar ueberwunden hat und haelt das fuer das Allheilmittel. Leider wieder ein klares Zeichen dafuer, wie schlecht Verstanden das Krankheitsbild selbst bei Medizinys ist.  Kann dir jetzt leider auch nicht erzaehlen, dass das eine krasse Ausnahme ist, aber ich die Arztys in meinem Bekanntenkreis sind alle sehr viel empathischer und entweder nicht total ahnungslos was psychische Erkrankungen angeht oder wissen zumindest, wo ihre Kompetenz endet.",0,1,0,0,1,0
deu_train_track_b_00069,"Also entweder wirst du gesegnet wie Saitama. In dem Fall trainier weiter. Dann wirst du in 2 Jahren jeden Diktator stürzen können.   Oder aber deine Freundin hat irgendein anderes Problem. Eifersucht, Verlustängste, sie will Freiheit und sucht sinnlos stress oder Furz sitzt queer. In dem Fall hilft nur Tacheles reden.",0,1,0,0,0,0
deu_train_track_b_00070,"Was geht in dir vor? Wahrscheinlich vieles, aber vielleicht kannst du uns ein Bild davon zeichnen was sich gerade in dir abspielt? Welche Gedanken und Gefühle sind gerade besonders prägnant?",0,0,0,0,0,0
deu_train_track_b_00071,Ich habe die Impfung direkt bei meinem betreuenden Gynäkologen bekommen! Sonst sollte auch eine Hausarztpraxis gehen. Impfzentren gibt es hier nur für Covid.,0,0,0,0,0,0
deu_train_track_b_00072,Anklagen und diese sinnlose Massnahme kritisieren sollte endlich BILD!,2,0,0,0,0,0
deu_train_track_b_00073,Arbeiten Sprengmeister auch beim Kampfmittelräumdienst? Oder kommen die alle vom Militärischen EOD in den Bereich?,0,0,0,0,0,0
deu_train_track_b_00074,"Du meinst die beiden Wörter, die im letzten Satz stehen?",0,0,0,0,0,0
deu_train_track_b_00075,"Depressionen haben nichts mit Dummheit zu tun! Es ist eher das Gegenteil, weil Menschen die sich keine Gedanken machen weniger nachdenken, also die meisten depressiven Menschen denken zu viel nach und der Kopf arbeitet zu viel.  Ich wünsch dir alles Gute und ich versteh deine Gefühle.",0,0,0,0,0,0
deu_train_track_b_00076,Die Farm der Tiere wurde zum militärisch-industriellen Komplex der Tiere.,1,0,0,0,0,0
deu_train_track_b_00077,"Denn, und ich zitiere; Die Mutter von Spore ist alleinerziehend, unser Sohn wird niemals dort essen können. Ja, dankeschön. Muss man auch neben mir besprechen. Ich bin 8 Jahre alt, nicht dumm oder taub. Das tat weh. Genauso wie man mir gesagt hat, ich würde nur mit deinem Sohn spielen weil ihr reich seid. Denkst du echt dein Sohn ist so ekelhaft, dass ich ihn nur mag, weil er einen N64 hat?",1,0,0,0,2,0
deu_train_track_b_00078,"Hello Ladies, Gibt es hier Frauen, die davon betroffen sind so einen unglaublich ekligen / komischen Geschmack im Mund zu haben? Ich muss ständig an Fisherman's friends lutschen oder Kaugummis oder ähnliche Ansonsten wird mir nur aufgrund des Geschmacks im Mund schlecht. Mif ist klar, dass es aufgrund der hormone ist und auch Mein Arzt bestätigte, dass es völlig normal sei. Mich würde gerne interessieren, was ihr gegen diesen Geschmack macht. Bin für jegliche Tipps offen.",0,1,0,0,0,0
deu_train_track_b_00079,Ich hatte einen Traum. Russische und ukrainische Soldaten legten ihre Waffen nieder und begaben sich in ihre Städte. Ich wurde wach ...nur geträumt.,0,0,0,0,2,0
deu_train_track_b_00080,"Muss man nicht. Wir waren mit den Hebammen im KH sehr glücklich, deshalb haben wir eine Geburtskarte, Süßkram (kein Merci) und etwas für die Kaffeekasse gebracht. Also, nachdem wir zu Hause waren, nochmal hingefahren. Mein Gyn und Diabetologe haben auch eine Karte und was für die Kasse bekommen, weil ich so begeistert war. Bei meiner Hebamme kam mir das nicht in den Sinn. Da war ich aber mit der Behandlung uns gegenüber auch nicht wirklich zufrieden (Um den Krümel hat sie sich toll gekümmert). Also: individuell. Mach, wie ihr euch wohlfühlt. In die KH-Tasche direkt was einpacken würde ich nicht.",0,0,0,0,0,0
deu_train_track_b_00081,Die russischen Truppen sollen raus aus der Ukraine. Dort haben sie nichts verloren!,2,1,0,0,0,0
deu_train_track_b_00082,"Hach, die armen Reichen! Sie würden viel lieber arm, frei und unbeschwert sein wie wir aber einer muss diese Last ja tragen. Bewundernswerte Selbstaufopferung.",1,1,0,0,0,0
deu_train_track_b_00083,"Hallo!  Spannende Geschichte und es macht Spaß, sie zu lesen. Ich würde versuchen, mich anzufreunden. Schreien bringt wohl nichts und sich essen lassen ist auch kein gutes Ende. Naja, vielleicht zuerst mal Aufschreien und dann anfreunden versuche. Ich würde mich über eine Fortsetzung freuen, ganz gleich, welche Option geschieht.  Auf jeden Fall weiter so!  lg",0,0,0,1,0,0
deu_train_track_b_00084,"Da Walfang schon seit Jahren illegal ist, ist 2024 mind ein paar Jahre zu spät!!!!",2,0,0,0,0,0
deu_train_track_b_00085,Wo steht das?  Macht man das beim Gin nicht wie beim Rum?,0,0,0,0,0,1
deu_train_track_b_00086,"Schlager  Bearbeitet: An den anonymen Silber-Spender Menschen: Vielen lieben Dank, Doppelpunkt drei  Bearbeitet 2:An den ""Umarmungs Bär"" Spender Menschen: Umarmung zurück und Danke, kleiner als drei.",0,0,0,1,0,0
deu_train_track_b_00087,"Hoffen wir mal, aber zur Not gibt es auch bestimmt Notfallzahnärzte bei euch in der Gegend",0,0,0,0,0,0
deu_train_track_b_00088,"Wie hast du dich dafür entschieden, das zu machen? Was waren deine Gründe?",0,0,0,0,0,0
deu_train_track_b_00089,Nicht ist so gut im Zerstören der Demokratie wie die Demokratie.,1,1,1,0,0,0
deu_train_track_b_00090,Die Ukrainer halten gerade ihren Kopf für uns und viele andere Länder hin. Die hätten bei Erfolg von Putins Go-West-Aktion dann nämlich richtig Probleme.,0,0,1,0,1,0
deu_train_track_b_00091,"Es ist total beeindruckend und erschütternd da durch zu laufen. Mir ist unbegreiflich, wir Deutsche heute noch AfD wählen können.",0,1,0,0,1,0
deu_train_track_b_00092,Hat Wer Bock Auf Unranked Casual?,0,0,0,0,0,0
deu_train_track_b_00093,"mach einfach kurz anne will an, dann bist du direkt so irrational wütend dass du das mit dem vollmond wieder vergessen hast",2,0,0,0,0,0
deu_train_track_b_00094,"Die 4Feinde posten auch wann sie wollen haha, jetzt dachte ich, ich hätte es schon verpasst lmao",0,0,0,1,0,0
deu_train_track_b_00095,"Die tragische Akzeptanz vieler Menschen, gegenüber dieser Realität zeichnet ein düsteres Bild einer Menschheit, die die Augen vor der dringenden Notwendigkeit eines Waffenstillstands in Gaza verschließt. Fast täglich ertönt ein ergreifender Aufruf, der die passive Haltung aufzugeben und die tiefe Traurigkeit beklagt, die aus der Ablehnung eines Waffenstillstands entsteht, der das zerstörte Leben im Gazastreifen retten könnte. Es ist unfassbar!",1,0,0,0,2,0
deu_train_track_b_00096,"Bin bald eine Woche in Tokio. Was sind Gerichte & Snacks, die man nicht verpassen darf? Was sind deine Favoriten?",0,0,0,0,0,0
deu_train_track_b_00097,Freiheit für Palästina 🇵🇸 Auch wenn alle Medien und Politikern einseitig mit Genozid der Palästinenser stehen. Irgendwann kommt das Doppel Moral zu Ende.,1,0,0,0,1,0
deu_train_track_b_00098,"Hey, bitte nicht den kopf hängen lassen :)  Ich glaube die Zeit ist gerade für niemanden einfach. Und wenn dann individuell noch erschwerende umstände dazukommen, fühlt man sich schnell verloren oder hoffnungslos.  Mir ging es die letzten wochen auch richtig übel. Bin relativ frisch getrennt nach einer langen Beziehung, musste wieder zu meinen eltern ziehen (nicht die beste stimmung daheim) und konnte mich wegen corona auch nicht wirklich ablenken.  Was mir geholfen hat war regelmäßiger sport. Und ebenso regelmäßige telefonate mit freund*innen einplanen und durchziehen, egal wie der tag war oder die laune grad ist. Struktur hilft mir durch diese wirre zeit. Dir vielleicht auch.   Und wenn du jemanden zum schreiben brauchst, sag bescheid.",0,0,0,1,1,0
deu_train_track_b_00099,"Einfach AfD wählen, was die grünlinks versüfften so wie die roten Socken alles verdrehen ist kaum noch auszuhalten nur 💙💙💙💙",1,2,0,0,0,0
deu_train_track_b_00100,"Denn wer Russland von weiteren Angriffen auf europäische Staaten abschrecken will, muss die Ukraine stark unterstützen.",0,0,1,0,0,0
deu_train_track_b_00101,Müll ohne Blaszczykowski und Barrios,1,0,0,0,0,0
deu_train_track_b_00102,Die Frage ist doch ob der Teufel männlich ist?  Und Gott?,0,0,0,0,0,0
deu_train_track_b_00103,"Wenn doch aber die heilige Ukraine, das phöse Russland bereits besiegt hat, wieso werden dann weitere Steuermilliarden da reingeballert?",2,0,0,0,0,0
deu_train_track_b_00104,"Es ist schon einige Jahre her, da saß mir in der Straßenbahn am Vierersitz ein kleiner, etwas korpulenter Junge (ca 10 Jahre) gegenüber, der mich während der Fahrt schon ziemlich heftig angestarrt hat - unablässiger frontaler Augenkontakt.  Kurz vor einer Haltestelle steht er auf und schreit mich ganz unvermittelt an: ""DAS BROT WAR VERSCHIMMELT!""  Dann - im Vorbeigehen (leiser): ""Man kann bei NORMA einfach keine Qualität kaufen!""  Er ist dann zum Glück ausgestiegen ...",0,1,0,0,0,1
deu_train_track_b_00105,"Auf keinen Fall zu früh, eher schon zu spät. Sowas sollte man schon besprechen ehe man sich für den Partner entscheidet, da es bei sowas keine Kompromisse gibt.",0,0,0,0,0,0
