id,text,anger,disgust,fear,joy,sadness,surprise
deu_train_track_b_01987,"Beeindruckender strategischer Erfolg für Putin: Die NATO hat seit heute 32 Mitglieder, vor dem Überfall auf die Ukraine waren es 30. Und die direkte Grenze zw. der NATO und  Russland ist 1.300 km länger geworden.",0,0,0,0,0,0
deu_train_track_b_01988,Verehrte Lady ich würde gerne Nase nehmen 🙈,0,0,0,1,0,0
deu_train_track_b_01989,Eine Katastrophe. Wir als Menschheit versagen gerade auf der ganzen Linie,1,1,1,0,2,0
deu_train_track_b_01990,Puhh das klingt echt nach viel Arbeit. Da gehe ich lieber weiter die Todesanzeigen durch und streiche diejenigen aus dem Telefonbuch.,0,0,0,0,1,0
deu_train_track_b_01991,"Du solltest an der Stelle besser auf deine Ärztin,.ggf. Hebamme hören - oder dir eine fachliche Zweitmeinung anhören, falls dich deine aktuelle Ärztin nicht überzeugt. Hier im Netz kann dir niemand sagen ob es zuviel ist oder nicht. Es können Wassereinlangerungen sein. Es wird auf jeden Fall davon abgeraten abzunehmen oder irgendwelche Diäten einzuhalten während der Schwangerschaft. Der Körper verändert sich jetzt sehr, leider in einigen Fällen gar nicht so wie man es vielleicht gerne hätte, aber das gehört dazu. Es ist auf jeden Fall sicherer auf ärztliche Beratung und ggf Tests zu setzen als sich laienhaft Gedanken zu machen.",0,0,1,0,0,0
deu_train_track_b_01992,"Schon 58 Jahre her, Sie haben sich aber gut gehalten. 💯",0,0,0,1,0,0
deu_train_track_b_01993,Genau wegen so Storys liebe ich diesen Sub! :D  Danke fürs Teilen!,0,0,0,2,0,0
deu_train_track_b_01994,"Danke für die Einsicht in Deinen daily struggle, Brudi. Da macht man sich ja sonst keine Gedanken drüber bzw. bekommt das kaum mit.",0,0,0,1,0,0
deu_train_track_b_01995,Warum kann ich nicht wie ein Radiergummi sein : Meine Fehler radieren  Irgendwann verschwinden,0,0,0,0,1,0
deu_train_track_b_01996,"Wir hatten einen und waren *extrem* zufrieden damit. Kann nach Kind1 auch aufgerüstet werden, um zwei Kinder zu transportieren und ist klein genug für öV (und unseren Aufzug).",0,0,0,2,0,0
deu_train_track_b_01997,Bin seit Freitag zum 4. mal unerwartet im September gestorben.   Feels good. :),0,0,0,1,0,1
deu_train_track_b_01998,"Ich war 10 Tage über Termin und wurde eingeleitet. Bin auch bis zum Schluss spazieren gegangen was ging, aber es hat leider nicht geholfen. Sex war für mich raus, dafür war ich dann zu rund. Aber: Manchen hat es geholfen!",0,0,0,0,0,0
deu_train_track_b_01999,"Mir hilft die Perspektive des optimistischen Nihilismus und ich könnte mir vorstellen, dass das auch was für dich ist. [Kurzgesagt]( hat das schön aufgearbeitet: ""Wenn du dich nicht an die 13,75 Milliarden Jahre vor deiner Geburt erinnern kannst, dann werden auch die Aberbillionen Jahre, die nach dir kommen, wie im Flug vergehen. Schließe deine Augen. Zähl bis eins. So fühlt sich die Ewigkeit an.""",0,0,0,0,0,0
deu_train_track_b_02000,Zum Glück nicht 😊  Guten Morgen Lena ☀️☀️☀️,0,0,0,2,0,0
deu_train_track_b_02001,Zum Glück ist auch wirklich nur das Licht kaputt.,0,0,0,2,0,0
deu_train_track_b_02002,"Wozu braucht man hier Mut. Absoluter Unfug. Auch die ""Rechtsradikalen"" in Bautzen achten die Demokratie und Meinungsfreiheit. Nur umgekehrt geht es halt nicht.",1,1,0,0,0,0
deu_train_track_b_02003,"Der Genozid muss aufhören, würde es wirklich um Geiseln gehen, würden Sie doch keine Rakete warlos in Menschenmengen schießen. Damit löschen Sie Ihre eigenen Geiseln aus. Wie Sie klar zugeben, geht es um Terretoriums Erweiterung.",2,1,0,0,1,0
deu_train_track_b_02004,"Man könnte auch einfach vegan 🌱 werden, das wäre wesentlich besser für die Tiere, Umwelt, Klima und Gesundheit.",0,0,0,0,0,0
deu_train_track_b_02005,"Wenn man es schafft, 1+1 zusammenzuzählen, dann checkt man, dass es für Deutschland, die Umwelt, das Klima das Beste ist, Minister kommen möglichst schnell von A nach B, können an möglichst vielen Orten in möglichst kurzer Zeit möglichst viel bewegen, und dann auch möglichst rasch wieder zu Hause Kraft schöpfen.",0,0,0,0,0,0
deu_train_track_b_02006,War doch abzusehen. Nieder mit der Ampel,2,0,0,0,0,0
deu_train_track_b_02007,"Hi ihr Lieben  Ich leide jetzt seit einem Jahr an Depressionen und in den letzten Wochen habe ich immer wieder das Problem, dass ich Hunger habe, allerdings weder Lust zum essen/Essen zubereiten habe und auch keine Ideen. Ich schaue mir viele Rezepte an und denke mir nur, dass es mir eigentlich zu viel Arbeit ist. Zudem kommt noch, dass es bei uns momentan um die 30 Grad ist. Vielleicht habt ihr ja Ideen/Rezepte für mich, gerne nicht nur kaltes, sondern auch gekochte Sachen.  Über eure Antworten würde ich mich freuen.  Lg  Lara",0,0,0,0,1,0
deu_train_track_b_02008,"Ein Kollege und ich waren ca. 14 Jahre alt als wir beide uns entschlossen haben ins Rathaus zu gehen, weil es da so einen coolen Aufzug gab der dauerhaft in Betrieb ist und nicht stoppt. Wir sind reingehüpft und wollten bis nach ganz oben. Relativ weit oben angekommen merkten wir dass keine weiteres Stockwerk auf uns wartet, sondern Dunkelheit. In dem Moment haben wir uns beide gleichzeitig angeguckt, mit dem selben Gedanken dass wir oben vielleicht irgendwie zerquetscht werden. Es stellte sich jedoch raus dass der Aufzug von rechts nach links im Bogen wanderte und so wieder nach unten fuhr.  Da haben wir uns erstmal einen abgelacht.",0,0,0,2,0,0
deu_train_track_b_02009,"Mach ich, danke dir!",0,0,0,2,0,0
deu_train_track_b_02010,Ich muss ehrlich gestehen das ich immer wieder mich erwische wie ich vermeide gedrängt an anderen Leuten vorbei zu gehen. Ich warte lieber und halte Abstand. Und wenn das mal wie bei Konzerten nicht möglich ist schießen mir gleich die blöden Gedanken in den Kopf ob der andere krank ist was wenn ja und ob ich es denn auch jetzt habe. Eigentlich totaler Schwachsinn aber das hat der ganze Abstand Mist mit mir gemacht.,0,0,1,0,1,0
deu_train_track_b_02011,"Ich konnte mich nicht impfen lassen, da es da noch keinen Impfstoff und später noch keine Empfehlung der Stiko gab. Wir haben uns die komplette Schwangerschaft isoliert. Ich habe meine Schwester zwei mal unter freiem Himmel getroffen und einmal waren wir bei einem Freund im Babysachen zu holen. Da waren mein Partner und der Freund schon geimpft und ich bin dann einfach kurz draußen geblieben. Da gab es aber noch kein Delta. Jetzt ist das Baby über drei Monate alt und wir sind immer noch extrem vorsichtig. Wir treffen selten Leute, wenn dann nur Geimpfte und draußen. So würde ich es auch noch handhaben, wenn ich noch schwanger wäre.",0,0,1,0,0,0
deu_train_track_b_02012,"Anstatt man einfach alles daran setzt den Krieg ohne weitere Waffengewalt zu stoppen. Das sollte der Diskurs sein, im Kommentarbereich, im Bundestag, und International. Die Ukraine wird das nicht aus eigener Kraft gewinnen auch nicht mit westlichen Waffen",0,0,0,0,0,0
deu_train_track_b_02013,"Die Menschen in Gaza leben schon seit Jahren in Not und leid, nicht nur wegen jetzigen Situation. Sie werden in ihrem Land gefangen gehalten. Alle Regierungen haben das ignoriert. Jetzt sieht die ganze Welt, was dort los ist. 🙁🙁😔😔",0,0,0,0,2,0
deu_train_track_b_02014,Der soll Mal schön bleiben wo er ist - wo er doch gerade erst wieder in Fahrt gekommen ist.,1,1,0,0,0,0
deu_train_track_b_02015,"Klingt ein bisschen wie Ischia Schmerz!  Am besten in Bewegung bleiben. Zu viel sitzen macht es oft schlimmer - spazieren, bisschen Yoga machen.   Mir hat auch einen Sitzkeil am Stuhl geholfen und abwechselnd am Petzi/Yogaball sitzen. Es gibt auch hervorragende Übungen für die Hüfte, die man am Ball machen kann.   Ich habe auch vom Frauenarzt ein Rezept für Physio wegen Ischia bekommen - evtl wäre das auch eine Möglichkeit!",0,0,0,0,0,0
deu_train_track_b_02016,Genozid 🤷🏻 Und niemand kümmert sich.,1,1,0,0,2,0
deu_train_track_b_02017,"War mein 18 Geburtstag, kam gerade heim von einem Ausflug, wollte davon erzählen und danach was mit meinen Kumpels machen. Ich kam zu Tür rein und bekam mit den Worten ""Deine Mutter und ich lassen uns scheiden"" ein Geschenk in die Hand gedrückt. War zwar nicht ganz unerwartet, nur das timing war wie aus einer schlechten Komödie.",0,0,0,0,2,1
deu_train_track_b_02018,"Ich glaube, die ganzen Kommentare, die dir raten, dass du etwas neues ausprobieren/verändern solltest, kannst du geflissentlich überlesen. Denn es liegt offensichtlich nicht in deiner Macht, hier alleine etwas zu ändern. Ihr müsst unbedingt darüber sprechen. Man kann hier lange mutmaßen, was die Ursache sein könnte, aber es gibt zu viele Möglichkeiten. Wenn es wirklich so ist, dass seine Libido nicht mehr so stark ist, müsst ihr überlegen, wie ihr das angehen wollt und vielleicht einen Termin bei einem Arzt vereinbaren. Und du wirst dich mit diesen schrecklichen Gefühlen des Zurückgewiesen Werdens auseinandersetzen müssen, die jeder zwangsläufig hat, dessen Partner keinen/nicht viel Sex will.",0,1,0,0,1,0
deu_train_track_b_02019,"Wichtig ist, dass der Zivilbevölkerung geholfen wird und sie vor dem Hungertod bewahrt wird. Terrorismus, Fanatismus, Despoten, skrupellos, schädigende machthungrige Menschen/Konzerne/Entscheider müssen von allen verfolgt und hart bestraft werden, um unsere Gesellschaften ! zu schützen. Solche schlechten Menschen, die alles um sich herum vergiften und z. T. selbst dekadent leben, braucht es nicht ....",1,2,0,0,1,0
deu_train_track_b_02020,BILD Mitarbeiter die Inhalte für Bild.de klauen und sich über FOCUS beschweren,1,1,0,0,0,0
deu_train_track_b_02021,Das verlieren wir zu 100% noch,0,0,1,0,0,0
deu_train_track_b_02022,Und bei mir im Dorf fährt ein Anti-Greta Wagen. Seufz...,1,0,0,0,0,0
deu_train_track_b_02023,"Böhmermann macht Spaß, aber ich glaube, hier würde man nur latent-sarkastische Antworten kriegen, die genau gar keine Relevanz haben. Versuch ist's aber vielleicht wert :)",0,0,0,0,0,0
deu_train_track_b_02024,"Liebe Kiddos, #NichtNachmachen",0,0,1,0,0,0
deu_train_track_b_02025,"lachen müsste ich ja, wenn da irgendwer dabei ist, der zb mit der nein-kampagne zum covid19-gesetz verstrickt ist in finanzieller hinicht.",0,1,0,0,0,0
deu_train_track_b_02026,Ich war 5 Jahre lang crystal abhängig. (Hab mir das auch gespritzt) mittlerweile bin ich aber clean,0,0,0,1,0,0
deu_train_track_b_02027,Berlin heißt Berlin weil es in einem Sumpf erbaut wurde. Also einem Feuchtgebiet. Schwachmat.,1,1,0,0,0,0
deu_train_track_b_02028,"Absolut angemessen und legitim, daß Israel sich verteidigt!🇮🇱✊️",0,0,0,2,0,0
deu_train_track_b_02029,"Der Lattenzaun Es war einmal ein Lattenzaun, mit Zwischenraum, hindurchzuschaun. Ein Architekt, der dieses sah, stand eines Abends plötzlich da - und nahm den Zwischenraum heraus und baute draus ein großes Haus. Der Zaun indessen stand ganz dumm, mit Latten ohne was herum. Ein Anblick grässlich und gemein. Drum zog ihn der Senat auch ein. Der Architekt jedoch entfloh nach Afri- od- Ameriko. Christian Morgenstern (1871-1914)",0,0,0,0,0,0
deu_train_track_b_02030,"Bin momentan in der 32. Woche und seit ungefähr 2-3 Wochen merke ich wie viel anstrengender alles wird und habe leider auch Probleme beim gehen, da sich das Becken lockert. Der Bauch ist mittlerweile auch echt groß und abends spannt er. Also alles in allem seit dem 8. Monat fühle ich mich sehr schwanger :D",0,0,0,1,0,0
deu_train_track_b_02031,omg jetzt weiß ich auch endlich wie du heißt,0,0,0,1,0,1
deu_train_track_b_02032,"Wie kommt man dazu, bist du generell im Filmgeschäft unterwegs oder wurdest du auf der Straße angesprochen mit ""Hey, Sie haben genau den Körper, den wir gerade benötigen!""?  Und die wohl wichtigste Frage: Welche Serie/Film?",0,0,0,0,0,0
deu_train_track_b_02033,Bezahlen die gut ?,0,0,0,0,0,0
deu_train_track_b_02034,"Bevor wieder iwelche AfD Sympathisanten fragen, warum so viel über die Demos berichtet wird? Weil es die größten Demos der deutschen Geschichte sind, Weil sie wichtig und richtig sind und weil sie für Demokratie, Offenheit und Toleranz und gegen die AfD und alle Feinde der Demokratie gerichtet sind!",1,1,0,1,0,0
deu_train_track_b_02035,"In Gaza werden die brutalsten Verbrechen der Weltgeschichte begangen, und die amerikanische Regierung trägt die größte Verantwortung für die Katharsis der Palästinenser. Herr Joe Biden sollte für diese Verbrechen strafrechtlich verfolgt werden ...",2,2,0,0,1,0
deu_train_track_b_02036,Aber bitte richtig bauen. Aus einheimischem Holz.  Für ein Insektenhotel soll kein Baum gefällt werden. Sonst paradox.,0,0,0,0,0,0
deu_train_track_b_02037,"Ok, schön das unsere Zusammenarbeite nun so ein Ende findet. Bin sehr enttäuscht von dir.",0,1,0,0,2,0
deu_train_track_b_02038,"Gefühlt hatte ich den Sarkasmus in deinen Worten, jedoch fehlte mir die Gewissheit. 🫣",0,0,0,0,0,0
deu_train_track_b_02039,Menschen nur aufgrund ihres Geschlechtes zu diskriminieren ist aber nicht so fortschrittlich...,0,2,0,0,0,0
deu_train_track_b_02040,"Ich wollte nur mal sagen: Danke für deine Offenheit. Ich habe genau vor dieser Situation Angst, vor dieser Entscheidung und es ist schön zu lesen, dass man es schaffen kann damit umzugehen. Ich finde dich mutig und bewundernswert.   Eine einzige Frage habe ich: Würdest du Untersuchungen außer der Reihe machen zukünftig?  Ich hab beim ersten Kind nichts gemacht außer den üblichen Untersuchungen und es war zum Glück nichts. Aber anhand deines Posts stelle ich mir jetzt diese Frage.",0,0,1,1,0,0
deu_train_track_b_02041,"1.) Ist es möglich dein Tätigkeitsbereich etwas mehr einzugrenzen? In welchem Bereich Softwareentwicklung zb  2.)Ich bin gerade noch im Studium und finde die Möglichkeit des freelancen ziemlich interessant. Wie sah dein Werdegang dazu aus?  3.) Ich hab öfter gehört, dass gerade am Anfang die Kundenaquise sehr schwer sein soll. Wie war das bei dir und hast eventuell Tipps?   Danke für deine Mühe :)",0,0,0,0,0,0
deu_train_track_b_02042,Na da sind die vielen Anderen ja ganz schön doof....,0,1,0,0,0,0
deu_train_track_b_02043,"Hat er keine Freunde oder Kollegen, die auch Väter sind? Mir wäre es voll peinlich wenn aufkommen würde, dass ich keine Windeln wechsle, weil ich von meinen Freunden und Verwandten ganz genau weiß, dass die es alle machen.  Durch seine Weigerung bist du mega unflexibel - absolut nicht fair und unverhältnismäßig. Da kann ich er sich noch auf allen anderen Ebenen bemühen, er muss als Vater in der Lage sein, euer Kind komplett alleine zu versorgen.",0,1,0,0,0,0
deu_train_track_b_02044,Deswegen habt ihr in der bilateralen Vereinbarung mit der #Ukraine den #Krieg auf zehn Jahre festgeschrieben und eine diplomatische Lösung ausgeschlossen?  #Deutschland will einen langen Krieg und setzt ausschließlich auf eine militärische Lösung. #Baerbock lügt schamlos.,2,1,0,0,0,0
deu_train_track_b_02045,"Ich fühle mit dir. Meine Oma hat zwar kein corona aber sie ist sehr krank und schwach in der Klinik und ich kann nicht zu ihr. Ich habe ihr Karten und Blumen geschickt, so kann ich ihr vielleicht wenigstens ein Lächeln ins Gesicht zaubern. Alles gute!",0,0,0,0,2,0
deu_train_track_b_02046,"Einer der besten Vorträge die ich bisher zu Depressionen gefunden habe. Es lohnt sich, das komplette Video anzuschauen. Ich habe auf Minute 50:07 verlinkt, da es dort gezielt um das Thema Depression geht.",0,0,0,1,0,0
deu_train_track_b_02047,"Du könntest deinen Chef informieren, ihn aber darum bitten es noch nicht weiter zu erzählen.  Du kannst sonst auch mal googeln: schwanger Kündigungsschutz",0,0,0,0,0,0
deu_train_track_b_02048,"Die Narkose zur Ausschabung habe ich bestimmt schon 100 mal gemacht. Ist ein kurzer Eingriff (ca. 10 Minuten) und i.d.R. immer unter Vollnarkose, d.h. du bekommst nichts mit davon.",0,0,0,0,0,0
deu_train_track_b_02049,"Meine große Schwester ist mit 17 ausgezogen, um ihre Ausbildung in einer Großstadt anzufangen. Meine Mutter hat das Kindergeld während dieser 3 Jahre behalten mit der Begründung: ""Du durftest ja auch kostenlos bei uns wohnen."" \ Von einem Abzweigungsantrag wusste sie leider nichts. Ich zu dem Zeitpunkt auch nicht, war ja erst 11.  Was mich betraf, ein Beispiel: mir wurde verboten zu duschen und wir haben alle 2 Mal in der Woche gebadet. Nacheinander, im selben Wasser.",1,1,0,0,1,0
deu_train_track_b_02050,Das ist schön für dich!,0,0,0,2,0,0
deu_train_track_b_02051,Wie sind denn alle Fridays for Future-Teilnehmer in die Stadt gekommen? Ein Großteil zu 100% mit dem Auto. Da finde ich die 2. Begründung für den Streik heute echt lächerlich.,0,2,0,0,0,0
deu_train_track_b_02052,"Krim gehörte von 1783 bis 1954 zu Russland.  Das sind 171 Jahre. Seit 70 Jahren gehört sie zur Ukraine. Bis 1783 gehörte die Krim zu unterschiedlichen Staaten. Dass die Krim schon immer russisch war, in Unsinn. Eine Bildungslücke in nationalistischer Echokammer. Eine von vielen.",1,1,0,0,0,0
deu_train_track_b_02053,Wir haben eine Spendenaktion gestartet und so viel Unterstützung bekommen.,0,0,0,2,0,1
deu_train_track_b_02054,"Gründe gibt es viele über die man Jahre lang diskutieren könnte. Ein positives an dem ganzen war zu sehen wer wie wirklich ist und denkt. Die ganzen Leute die fanatisch für die Impfung und Verfolgung von ungeimpften waren habe ich zb. ausnahmslos aus meinem Leben verbannt und können vor mir tot umfallen. Egal ob Familien Mitglieder oder nicht. Man erkannte auch den wahren Charakter von Menschen die man schon ewig kannte 😉 vermeintliche "" Freunde"" wurden zu Feinden. Klingt zwar alles hart aber ich bin froh dass es in gewisser Hinsicht so gekommen ist denn schneller hätte man niemals das wahre ich von so vielen Menschen um einen erkannt. Komprimiertes aussortieren. Und die erbärmlichsten sind die die in der Pandemie fanatisch für Impfung usw waren und jetzt wo das Thema quasi vorbei ist Tuns so als ob nichts gewesen wäre.",0,1,0,1,0,0
deu_train_track_b_02055,"Danke! Genau mein Gedanke letzte Nacht, früher wurde darauf noch deutlich mehr wert gelegt. Wäre schön, wenn das wieder so weit kommt.  Und als kleiner Anhang: Dieses Dönermann AMA wurde sogar von Bento als Quelle für einen Artikel über die Qualität von Donerfleisch benutzt. Bei einem unverifizierten AMA bedenklich.",0,1,0,0,0,0
deu_train_track_b_02056,"1. Wann ist das Tanken am günstigsten? 2. Wann ändert sich der Spritpreis? Alle 30min? 3. Wozu ist der Hinweis, kleinste Abgabemenge 5l? In die Roller passen doch meist nur 2..3l 4. Was passiert, wenn man ausversehen vergisst zu bezahlen und wegfährt? 5. Kann man einen Öl Wechsel privat auf dem Gelände einer Tankstelle durchführen? 6. Würdest du selbst das Tankstellenessen essen? 7. Was passiert nach einem Überfall? Bekommt man nach dem Erlebnis 14 Tage frei? 8. Wie viel verdient die Tankstelle pro Liter Benzin? Ich habe gehört pro Packung Zigaretten sind dass nur wenige Cents.",1,0,0,0,0,0
deu_train_track_b_02057,Rede mit ihm. Ist wahrscheinlich nur die Kreditkarte oder ähnliches. Und wer zum Teufel holt noch Kontoauszüge?,0,0,0,0,0,1
deu_train_track_b_02058,"Es gibt verschiedene Eisenpräparate die individuell unterschiedlich vertragen werden. Statt Ferro Sanol kannst du auch Tardyferon nehmen, vielleicht funktioniert das besser.",0,0,0,0,0,0
deu_train_track_b_02059,"Ich denke, der Gehirnnebel kommt von den Spikes im Körper. Für mich ist das,ein klarer Fall von Impfschaden, denn ich kenne ne Menge Leute, die nicht geimoft sind und übelst an Corona erkrankt sind. Von den Ungeimpften hat niemand Gehirnnebel oder Long- Covid. Alle Ungeimpften haben die Infektionen ohne Schäden überstanden.",0,1,1,0,0,0
deu_train_track_b_02060,"Das ist mir hier irgendwie noch zu abstrakt mit diesem Internetz, kann man hier vielleicht noch einen Bezug zur echten Welt (also die der 1950er-Jahre) herstellen? Vielleicht einfach noch das Wort ""Datenautobahn"" einstreuen",0,1,0,0,0,0
deu_train_track_b_02061,"Einige sind sehr gut, zum Rest unbedingt Abstand halten 🙄",0,1,0,0,0,0
deu_train_track_b_02062,Impfschäden betreffen seltsamerweise nur Ungeimpfte.,1,1,0,0,0,0
deu_train_track_b_02063,#UK macht gute Laune #ESC2021,0,0,0,2,0,0
deu_train_track_b_02064,immer wenn ich länger kein unterhemd trage werde ich übel krank,0,0,0,0,1,0
deu_train_track_b_02065,"Wenn Russland bombardiert und dort 17 Menschen ""verletzt"" werden, schreit die Tagesschau laut auf. Wenn Israel 30.000 Menschen in 100 Tagen abschlachtet, wird still zugeschaut. Da könnte man sich beginnen zu fragen, weswegen das so ist.",2,1,0,0,0,0
deu_train_track_b_02066,"Your Name. Bin kein riesiger Animefan aber dieser Film hat mich sehr überrascht. Ich schaue ihn mir eben zum zweiten Mal an, da die Handlung recht verwoben ist. Man kann nach dem Schauen auch viel darüber nachdenken. Sehr bezaubernd würde ich fast sagen und wahnsinnig schön gezeichnet :)",0,0,0,2,0,1
deu_train_track_b_02067,"Ja, bei mir war die ganze Schwangerschaft über alles ok, bis ca. Zur 36. Ssw. Dann hieß es: zu wenig Fruchtwasser, zu wenig Gewicht, ctg auffällig, beckenendlage Ich wurde dann engmaschiger kontrolliert und es wurde ein Kaiserschnitt bei 38+0 gemacht. Während der OP meinte die Ärztin, das war doch nicht so wenig Fruchtwasser:) mein Baby ist kerngesund. Wünsche euch alles Gute, ihr habt es fast geschafft! Zum Ende hin ist etwas weniger Fruchtwasser wohl relativ normal (hab mich kaputt gegoogled) und wenn es drastisch zu wenig wäre, hätte deine gyn schon reagiert!",0,0,0,1,0,0
deu_train_track_b_02068,Jubel in Deutschland: Dank sterbender Industrie sinkt der #Gasverbrauch auf historisches Minus! Die Arbeitslosen liegen sich in den Armen und feiern den (Etappen-)Sieg gegen das #Klima!,2,1,0,0,0,0
deu_train_track_b_02069,alles gut zwischen uns - aber wenn du in der schule masturbierst bye,0,2,0,0,0,0
deu_train_track_b_02070,du bist ein schlechter bundespräsident mein lieber,1,1,0,0,0,0
deu_train_track_b_02071,"Es hätte ja auch gar keinen Zweck, die Rechtswidrigkeit dieser Aktion zu verschleiern. Das wissen sie ja selber...",0,1,0,0,0,0
deu_train_track_b_02072,nö bin fett hab wurstfinger,0,1,0,0,0,0
deu_train_track_b_02073,"Kannst du mir sagen wie das mit der Ketamin Therapie ablief? War das ambulant oder stationär und hat die Krankenkasse es übernommen?  Mir geht es ähnlich wie dir, tausende Medikamente ausprobiert, aber nichts hilft so richtig. Ich werde in 2 Wochen meine erste Elektrokrampftherapie machen, vielleicht wäre das etwas für dich?",0,0,0,0,0,0
deu_train_track_b_02074,"Mittlerweile kennt man die Opfer besser, als zuvor namhafte Schauspielerinnen … Schrecklich! RIP",0,1,0,0,2,0
deu_train_track_b_02075,"Das war keine Morddrohung, das war versuchter Totschlag. Immerhin hat er Dich beinahe totgefahren. Haste das Kennzeichen noch? DIE Anzeige waere mir den Aerger auf jeden Fall wert.  Und wer weiss, vielleicht rettest Du einem anderen Mopedfahrer damit das Leben. Dein Vater kann ja alleine schon wahrheitsgemaess bezeugen, dass der Autofahrer Dich bis zum Haus verfolgt hat, das alleine spricht schon Baende fuer seine Aggressivitaet.",1,1,1,0,0,0
deu_train_track_b_02076,Fordern „Recht auf gesunde und nachhaltige Nahrung…“ werfen dann aber mit Lebensmittel. Genauso sinnvoll wie die Klimaaktivisten die damals Bäume abgesägt haben. Soll‘s mal einer checken. Glaube die Checkens selbst nicht mehr. 😅,1,1,0,0,0,0
deu_train_track_b_02077,"Damals beim Kiffen, im Park und überall sonst wo, immer hab ich die Freunde animiert den Müll auch wegzuschmeißen. Freunde, bewahret uns das Kiffer-Image sagte ich zu ihnen. Manchmal hat's funktioniert, ein manch anderes Mal durfte ich dann selber besagtes Ehrenamt ausführen. Stolz war ich dennoch, dass unser kleiner Kiffer-Trupp (zumindest in meiner Gegenwart) Abfall-Neutral unterwegs war. Freunde, die ihr das hier lest, bewahret das Kiffer-Image!",0,0,0,1,0,0
deu_train_track_b_02078,Menschen die lautstark Tiktoks in den Öffentlichen anschauen,1,1,0,0,0,0
deu_train_track_b_02079,Wie wäre es mit Friedensverhandlungen?,0,0,0,0,0,0
deu_train_track_b_02080,"Hi, ja, bei mir wurde genauso langsam die Dosis erhöht. In den ersten 2-3 Wochen hatte ich vermehrt Kopfschmerzen, Einschlafprobleme, bin teilweise früher aufgewacht als sonst, gestörtes Temperaturempfinden, körperliches Trägheitsgefühl und blitzartige Blitzlichterscheinungen (wie bei einem Gewitter) mit einem lauten Geräusch während der Einschlafphase und kurz nach dem Aufwachen (nennet sich exploding head syndrome. Ist ungefährlich).  Nachdem du auf 10mg bist, musst du nicht wieder Einschleichen, wenn du auf höhere Dosen wechselst.  Hat mir persönlich nicht viel geholfen, wurde dann auf ein SNRI (Serotonin Noradrenalin Wiederaufnahmehemmer, in meinem Fall Venlafaxin) gesetzt, dass gibt mir zusätzlich mehr Antrieb.  Gute Besserung :)",0,0,0,0,0,0
deu_train_track_b_02081,"Habe leider keinen Rat, aber finde du klingst unfassbar stark und tüchtig, ich bin sicher ein tolles neues Leben wartet jetzt auf dich - alles Gute dafür!",0,0,0,1,0,0
deu_train_track_b_02082,"Jeden Tag werden in Gaza US-Fahnen verbrannt und was machen die Amis? Sie werfen Hilfsgüter ab, Chapeau!",0,1,0,1,0,0
deu_train_track_b_02083,Warum nicht in der Werwer Straße?? DU bist echt ein falscher Freund Marvin,1,1,0,0,1,0
deu_train_track_b_02084,Russisches Militär ausserhalb ihrer territorialen Grenzen? Ohne Zögern wegbomben.,2,1,0,0,0,0
deu_train_track_b_02085,"Die Freien Wähler hatten auch als Mehrheit für die Einführung der Corona Impfpflicht abgestimmt, obwohl sie noch kurz zuvor dagegen waren. Kubicki Syndrom.",0,1,0,0,0,1
deu_train_track_b_02086,Besonders gut wenn man auf der Suche nach einem Erklärungsvideo ist und das gefundene Video mit deutschen Titel dann in französisch ist. Absoluter Müll diese automatische Übersetzung.,2,1,0,0,0,0
