id,text,anger,disgust,fear,joy,sadness,surprise
deu_train_track_b_00620,Erstmal ankommen und dann wird das schon :) Alles Gute,0,0,0,1,0,0
deu_train_track_b_00621,junge sehe heute so gottlos gut aus,0,0,0,3,0,0
deu_train_track_b_00622,"Heftig, es tut mir Leid, dass du soetwas durchmachen musstest, sowas wünscht man nichtmal seinem schlimmsten Feind. Ich habe einen riesen Respekt vor dir, du bist eine starke Person.  Wie genau sah deine Flucht aus und hast du bei deiner Flucht Unterstützung bekommen? Hast du die Täter im Nachhinein angezeigt? Wie geht es dir und deinem Kind Heute?",0,0,1,1,2,0
deu_train_track_b_00623,"Ist deine Frau schon in psychologischer Behandlung nach der Tat? Wenn nein, dann so schnell wie möglich. Vielleicht könnt ihr auch zusammen zu einem Therapeuten gehen und die Gefühle von euch beiden zusammen einordnen.  Du musst auch wissen, eine Abtreibung ist nie leicht für den Körper/Geist. Sie ist frisch traumatisiert, so einfach ist eine (schnelle) Entscheidung nicht. Und es ist ja auch - egal wer der Vater ist - ihr Kind.",0,0,1,0,1,0
deu_train_track_b_00624,"Es gibt sicherlich eine Frau die dir deine Freiheiten lässt und mit der du ebenso eure gemeinsame Zeit genießen kannst. Jeder Mensch hat eine andere Vorstellung von Beziehungen und vielleicht sind diese bei dir und deiner Partnerin einfach nicht gleich. Nicht alle Menschen sind kompatibel. Rede mit ihr darüber und versuche zu schauen, ob Kompromisse hier noch funktionieren oder, ob ihr lieber, zum Wohl aller, die Beziehung beenden solltet.",0,0,0,0,0,0
deu_train_track_b_00625,🥺🥺🥺🥺 bienchen bin sowas von neidisch 😱🤯😤😆🤭✌🏼💚,0,0,0,1,0,0
deu_train_track_b_00626,Er hat die Frage mit wenigen Worten komplett ins Leere laufen lassen und als Suggestivfrage entlarvt.,0,0,0,1,0,1
deu_train_track_b_00627,"Herr Lauterbach, leichtes stechen ziehen unter linker Brust?",0,0,0,0,0,0
deu_train_track_b_00628,"bruder werden da zweistellige punktzahlen bei dir ausgeklammert oder seh ich das falsch? falls ja, mashalla",0,0,0,0,0,1
deu_train_track_b_00629,🚨ON SALE: Harry Styles Styles Love On Tour 2023 - 2 Hollywood Tickets  - DÜSSELDORF NIGHT 2 (28.06.2023) - 300€ each,0,0,0,0,0,0
deu_train_track_b_00630,"je häufiger Kontakt du zu jemanden hast und je mehr beide Seiten investieren, desto eher entwickelt sich eine Freundschaft.. das kann nicht erzwungen werden... je älter wir werden desto schwieriger wird es auch Freundschaften zu schließen... die Prioritäten verschieben sich einfach und es wurden gute wie schlechte Erfahrungen gemacht... tu was dir Spaß macht sei es am PC, Sport oder einen neue Sprache... such dir einen Tandempartner aus dem Ausland. Lern seine Sprache und bring ihm unsere bei. Daraus können sich auch Freundschaften entwickeln   Bist du noch im Verein? Machst du noch Sport?  Sport, Regelmäßigkeit (Essen, Trinken, Schlaf, Kontakte) und Erfolgserlebnisse sind wichtig für das Selbstwertgefühl :)",0,0,0,0,0,0
deu_train_track_b_00631,Denke er war vor allen mit seinem Gehalt unzufrieden,0,0,0,0,0,0
deu_train_track_b_00632,"wie sind hier eure erfahrungen? bitte schonungslos ehrlich, wir sind unter uns.   wie sexuell sind die verhältnisse mit euren langjährigen partner*innen überhaupt?   hat sich der sex im laufe der jahre verändert, findet er überhaupt noch statt?  und, weil das leben halt anders zusammenschweisst: welchen stellenwert hat sex mit der partnerin / dem partner überhaupt noch?  wichtig: bitte kein judging, egal ob jmd. andere vorstellungen von partnerschaft und moral hat als ihr selbst.",0,0,0,0,0,0
deu_train_track_b_00633,"Diese Situation wo man der Meiunung ist nur noch zu exisiteren kenne ich gut, manchmal vielleicht auch obwohl man Menschen hat die einen eigentlich auch gut tun. Dass du an deiner Mutter denkst finde ich toll. Gibt es etwas was du dir wünscht, was dein Leben wieder positiver beeinflussen kann? Ich drück dich einfach mal von ganzen Herzen und wünsche dir alles Gute.",0,0,0,1,1,0
deu_train_track_b_00634,"So wie Putin verbal gegen den Westen schießt, wünsche ich das andersrum, nur noch einen Zacken schärfer! Der Westen muss Putin endlich - realistisch durchsetzbare - Grenzen setzen. Nur das versteht der Zwerg!",2,2,0,0,0,0
deu_train_track_b_00635,Genau das selbe ist meinen beiden Brüdern auch passiert. Alte Bekannte melden sich und wollen einem auf einmal was verkaufen. Classic,0,1,0,0,1,0
deu_train_track_b_00636,Danke für 🇩🇪 Beteiligung an einem Völkerm💀rd. Dafür haben wir ja ein Händchen 👍🏼,2,2,0,0,0,0
deu_train_track_b_00637,"Ich war mit 21 Jahren im Gefängnis. Ich bin wie die breite Gesellschaft sagen würde "" weich*"" und links dazu. Habe dort krasse Leute kennengelernt. Fragt mich gerne Sachen die euch interessieren.  *stehe zu meinen Gefühlen und sowas",0,0,0,0,0,0
deu_train_track_b_00638,Da wäre ich mir nicht so sicher,0,0,0,0,0,0
deu_train_track_b_00639,Egal wenn die CDU aufstellt. Der nächste Kanzler ist grün,0,0,0,0,0,0
deu_train_track_b_00640,"Du bist die Veränderung die Du suchst. Wenn dann Azubis Dir nachfolgend werden sie ein neues, anderes Bild ""der Polizei"" haben, weil Du es neu gemalt hast.  Habe das Selbstvertrauen, Du bist wichtig für die nötige Veränderung!  Danke für Deinen Dienst!",0,0,0,1,0,0
deu_train_track_b_00641,"Von den Machern von „Covid ist nur ne Grippe“, „Bald sind alle Geimpften tot“ und „Ukraine - was geht mich das an?“ Jetzt der neue Blockbuster: „Nazis und ihre NSDAP waren sozialistisch, Hitler war ein Linker!“ Die ganze Wahrheit darüber, wie die Antifa 6 Millionen Juden tötete!",1,2,0,0,0,0
deu_train_track_b_00642,"Wir sind auch ein ziemlich faules Paar, das gerne zockt und Serien schaut, und für uns ist der beste Ausgleich dazu eine Wanderung oder ein langer Spaziergang in der Natur. Super entspannend und hat immer für gute Gespräche gesorgt.",0,0,0,1,0,0
deu_train_track_b_00643,"Höcke vertritt faschistische Positionen, sein Wahlrecht gehört aberkannt. Natürlich löst das nicht das zugrunde liegenden Problem der Spaltung in unserer Gesellschaft, aber bei diesem Symptom nichts zu unternehmen ist wie bei 42 °C Fieber einfach abzuwarten",1,1,1,0,0,0
deu_train_track_b_00644,Der sub kommt genau zur richtigen Zeit. Bin gerade zum zweiten Mal schwanger nach einer Fehlgeburt im Dezember.   u/nebensaechlich erinnere mich noch an deinen Namen aus dem Juli bumper sub :),0,0,0,1,0,0
deu_train_track_b_00645,"Alles gute für dich Respekt diese Geschichte so hier zu äußern, wir Menschen sind Steh auf Männchen , nach jedem Niederschlag stehen wir wieder auf und machen weiter vom Schicksal geführt wirst du neue Menschen treffen und du wirst jemand neues Treffen du hast deine Freudnin immer wieder aufgebaut und keine Mühen gescheut und für den nächsten erst besten hast Sie Dich vielleicht verlassen Krankheit hin oder her sie ist es vielleicht nicht wert gewesen schließ mit den Kapitel ab Steh auf Männchen such dir eine neue Wohnung wenn Dich deine stört , eine neue Arbeitsstelle und eine neue Umgebung Horch in dich hinein und das Schicksal führt dich",0,0,0,0,0,0
deu_train_track_b_00646,"Im russischen Staatsfernsehen wird jeden Tag gedroht und gehetzt. Russland nutzt psychologische Kriegsführung, um in Deutschland Angst zu schüren.   Leider gibt es in Deutschland einige, die diese Ängste bewirtschaften und russische Propaganda weiterverbreiten.   Russland war militärisch bisher nicht dazu in der Lage, große Brücken in Kyjiw, Mykolajiw oder Dnipro zu zerstören.   Wir müssen keine Angst davor haben, dass Russland Brücken in Deutschland angreift.  Gleichzeitig ist die von Russland illegal errrichtete Krimbrücke für die Ukraine ein legitimes militärisches Ziel.",1,1,0,0,0,0
deu_train_track_b_00647,"Ich bin bei 39+3 und gefühlt tut sich auch überhaupt nix. Keine Übungswehen, Bauch geht nicht nach unten, gar nichts.  Habe aber eine Einleitung für Freitag geplant und engmaschige Kontrollen wegen GDM. Also von mir aus könnte es wahrlich jetzt losgehen...",0,0,0,0,0,0
deu_train_track_b_00648,"Habe ich muss ich sagen noch nie von gehört bisher, interessant.  Inwiefern wirkt sich das denn auf dein alltägliches Leben aus? Oder auch auf Beziehungen?  Hast du mit allen diesen Symptomen zu kämpfen oder nur mit einem gewissen Teil?",0,0,0,0,0,1
deu_train_track_b_00649,"🤡Es ist also PROrussische #Propaganda zu sagen, dass die deutsche Regierung die eigene Bevölkerung  vernachlässige um die #Ukraine zu unterstützen?!🤡",2,1,0,0,0,0
deu_train_track_b_00650,Egal nicht alles muss man unter Kontrolle haben,0,0,0,0,0,0
deu_train_track_b_00651,"Kenne mich mit dem Thema Beschäftigungsverbot in der Schwangerschaft nicht aus, kann dir aber sagen dass viele Arbeitgeber überrascht und zickig reagieren. Dabei warst du ja sogar offener als du hättest sein müssen.",0,0,0,0,0,0
deu_train_track_b_00652,"Hilfsgüter abwerfen, aber dafür schön die Hand gegen einen Waffenstllstand heben… Heuchlerei vom feinsten 🤣🤦🏼‍♀️🤬",2,2,0,0,0,0
deu_train_track_b_00653,"Ich war letztens mit Freunden wandern und immer wenn wir über eine Brücke, die über eine Straße führt, gehen mussten haben wir den Autofahrern zugewinkt. Viele haben zurückgewunken oder gehupt :D  Diese kleinen Momente haben uns und ich denke mal auch den Autofahrern ein kurzes Lächeln geschenkt",0,0,0,2,0,0
deu_train_track_b_00654,"Ich finde das kommt darauf an, wie alt ihr seid.  Wenn du jetzt 13 bist ist das sehr früh, aber ab Mitte zwanzig ist es ganz gut so etwas zu klären.",0,0,0,0,0,0
deu_train_track_b_00655,"Korrekt, es wird von dir falsch verwendet.",0,0,0,0,0,0
deu_train_track_b_00656,Wie wäre es mit Bemühungen für Frieden??? Wir das Volk interessieren uns nicht für ein Krieg wir haben genug Probleme!!!!,2,1,0,0,0,0
deu_train_track_b_00657,Wird es ihnen langsam unheimlich ? Drehen sie sich auf der Straße immer wieder um ?👻,0,0,1,0,0,0
deu_train_track_b_00658,Hi. Danke für dein AMA.   Woher kommt denn deine Mutter und ihre Familie? Hat sie einen deutschen geheiratet?  Bist du mit 19 dann abgehauen und hast woanders dein Leben aufgebaut oder wie hat sich das entwickelt?  Schön dass es dir jetzt gut geht. VG,0,0,0,1,0,0
deu_train_track_b_00659,"In Deutschland rechte bekämpfen und in Israel eine rechts-religiöse Regierung unterstützen, genau mein Humor 👏😂",2,0,0,0,0,0
deu_train_track_b_00660,"Die grüne Planwirtschaft karikiert sich selbst und entfernt sich immer weiter von ihren Sektenzielen. Dass sich dabei die deutsche Wirtschaft ins Nirvana verabschiedet und die Gesellschaft immer weiter gespalten wird, nehmen die Grünen gern in Kauf.",2,1,0,0,0,0
deu_train_track_b_00661,Die Tschechen werden sich in der Haltung Ihrer Regierung wiederfinden. Keine Aufnahme dieser Leute !,1,2,0,0,0,0
deu_train_track_b_00662,"Bin auch wegen diverser Psychischer Krankheiten seit 10 Monaten krankgeschrieben.So die ersten 4-5 Monate habe ich von der Krankasse mitunter fast schon wöchentlich Anrufe bekommen ,wies denn nun aussieht,Am Anfang fand ich ja das ganz nett das man fragt wies mir geht,aber als sie mich ""nett""darum gebeten haben doch mit gesundheitlichem Attest zu kündigen das ich aus dem Krankengeld rausbin war ich dann auch verärgert. Mittlerweile kommen keine Anrufe seit dem die wissen das ich demnächst eine Berufliche Rehabiliation machen werde.  Wäre das für dich auch eine Option?",1,0,0,0,1,0
deu_train_track_b_00663,"Ich mein das nicht böse, aber ihr seit 1,5h voneinander entfernt und bekommt es nicht hin euch regelmäßig zu treffen? Oder hab ich das falsch verstanden.  Dieses unbedingte Erhalten der eigenen Freiheit hat euch auf jeden Fall ne Menge Ärger gemacht. Die Frage ist, ob sie das überhaupt mal anders haben will und wie das nach dem Studium denn weitergehen soll. Über sowas solltet ihr vielleicht mal gemeinsam sprechen, bevor da falsche Erwartungen entstehen.  Dass ihr euch bis zum Ende des Studiums aber mal häufiger sehen könnt ist eigentlich echt leicht. Meine Verlobte studiert gerade in München und wir wohnen eigentlich in der Nähe von Holland, selbst wir haben uns öfter gesehen als ihr.",0,0,0,0,0,0
deu_train_track_b_00664,Wir werden Israel niemals vergeben,2,2,0,0,0,0
deu_train_track_b_00665,danke für den song,0,0,0,2,0,0
deu_train_track_b_00666,"Krieg ist keine Lösung sondern ein Kreislauf der Gewalt. Das was jetzt passiert tut mir unendlich leid und ich kann mir nicht vorstellen wie schmerzhaft das für die zu Zivilbevölkerung ist. Es geht entgegen meiner Vorstellungskraft. Ich habe einen Traum , wünsche mir ein ein großes Land in dem alle Religionen vereinigt und friedlich leben können.",0,0,1,0,2,0
deu_train_track_b_00667,Klingt für mich so als hätte sie beim feiern anderweitig interessante Leute getroffen. Aber mal ehrlich wenn ihr seid Jahren kaum Sex hattet dann wurde es auch Zeit das ihr euch trennt denn dann habt ihr keine intakte Beziehung und das seit Jahren.,0,1,0,0,1,0
deu_train_track_b_00668,mach ich abee omg der ust echt schlimm,0,1,0,0,0,0
deu_train_track_b_00669,"Qualitätsmensch, allererste Sahne, danke für dein Eingreifen! Es braucht mehr Menschen wie dich",0,0,0,2,0,0
deu_train_track_b_00670,"Ich bin seit über 10 Jahren depressiv (sowie Borderliner) und habe teils Suizidgedanken.  Ich war bereits bei drei Psychotherapeuten, habe eine Gruppentherapie gemacht, war in einer Selbsthilfegruppe, hab Ergotherapie gemacht, Selbsthilfebücher gelesen, war beim Psychiater und hab Medis ausprobiert.  Nichts hat geholfen, es ist über die Jahre nur immer schlimmer geworden. Ich weiß mittlerweile auch nicht wo ich mich noch hinwenden soll. Die Telefonseelsorge hatte ich kontaktiert aber nur schlechte Erfahrung gemacht...",0,0,1,0,3,0
deu_train_track_b_00671,In 90% der Fälle wird „POV“ falsch verwendet es macht mich wahnsinnig,2,0,0,0,0,0
deu_train_track_b_00672,"Ich bin xy Jahre alt und hatte bei WKDA (WirkaufendeinAuto) gearbeitet.   Eine Ausbildung zuvor in einem anderen Unternehmen hatte ich als Kaufmann für Büromanagement absolviert.  Für die Zeit bei WKDA war ich als Serviceassistent im Kundensupport tätig. Genauso schlecht wie der Ruf dieses Unternehmens ist, war es auch die Arbeit.  Fragt mich alles!",0,1,0,0,0,0
deu_train_track_b_00673,"Verehrter Führer, Schöpfer? Nein, damit kann ich mich nicht identifizieren. Ich bin jemand wie jede/r andere hier mit dem einzigen Unterschied, dass ich irgendwann auf *Subreddit erstellen* geklickt habe. Aber ich nehme mal an, dass das nicht ganz ernst gemeint war :)  Danke für die Ankündigung! Bei mir geht gerade alles ein wenig drunter und drüber, deswegen ist das untergegangen. Ich schaue mal ob ich am Samstag auch etwas beitragen kann.",0,0,0,1,0,0
deu_train_track_b_00674,Das ist doch nicht schlimm mit denn streams lass deine Stimme erstmal ruhen und ich hoffe das es dir bald wieder gut geht❤,0,0,0,0,0,0
deu_train_track_b_00675,"Naja, sie hat halt Angst das du da Frauen klar machst oder sonst was. War von ihr vielleicht auch nicht gedacht das du direkt in den Club sollst. Naja, redet darüber, klärt ab was wie gemeint war. Wird schon wieder.",0,0,0,0,0,0
deu_train_track_b_00676,"Je mehr ihr schreit, lügt und verleumdet, desto überzeugter bin ich das die #AfD die richtige Wahl ist.  Denn wer verlogene Kampagnen gegen eine politischen Gegner ins Feld führt, aus der Regierung heraus gegen die Opposition demonstrieren lässt, die Opposition verbieten und Menschen Grundrechten entziehen will, sich mit linksextremen gemein macht die den Tod von ""AfD´lern"" fordern, der ist mehr Faschist als er selber noch merkt.  Der Faschismus ist nicht rechts - er kommt von links!",2,2,0,0,0,0
deu_train_track_b_00677,Der Gestank in dieser öffentlichen Toilette ist unerträglich!,0,3,0,0,0,0
deu_train_track_b_00678,Peinlich wer AfD wählt,0,2,0,0,0,0
deu_train_track_b_00679,"skrupellos davon zu sprechen, dass seit Beginn des Krieges geliefert wird - das stimmt nicht. Denn ohne die Intervention der USA, wären sie alle schon längst verhungert.",1,0,0,0,0,0
deu_train_track_b_00680,"Die Palästinenser haben die Hamas gewählt. Jetzt zahlen sie den Preis dafür.  Es kann sofort beendet werden: die Hamas legt die Waffen nieder, lässt alle Geiseln unverzüglich frei und ergibt sich.  Wenn nicht, wird die Hamas komplett vernichtet.  Opferrolle sinnlos.",2,1,0,0,0,0
deu_train_track_b_00681,Weil er mehr auf die Hütte bekommt und dadurch mehr Paraden auspacken kann?,0,0,0,0,0,0
deu_train_track_b_00682,"Schluss machen nein. Wieso muss man gleich immer schluss machen? Woher kommt die Mentalität, dass man direkt jemanden wegschmeißen muss nur weil der Sex nicht gut ist? Zusammen daran arbeiten und zusammen wachsen nur so wird der Sex intensiver und schweißt ein mehr zusammen.",1,0,0,0,1,0
deu_train_track_b_00683,Wünsche deiner Oma alles Gute. :/ Mehr kann ich leider auch nicht machen. Ich hoffe sie schafft es.,0,0,0,0,1,0
deu_train_track_b_00684,Die Nachricht vom Tod eines Kindheitshelden trifft mich sehr.,0,0,0,0,3,0
deu_train_track_b_00685,"Es ist wichtig, dass du dir eines immer vor Augen hältst, du bist nicht für das Glück anderer zuständig.  Trennungen sind nie einfach und es zeigt, dass du dir Gedanken machst indem du Rat suchst. Aber wenn du deine Entscheidung gefällt hast, ist weder ihr noch dir geholfen wenn du weiterhin die Beziehung aufrecht hältst.  Wenn du sie noch magst, biete ihr an weiter da zu sein, wenn sie Hilfe braucht. Damit gibst du ihr etwas Kontrolle über die Situation. Den Schmerz nehmen wirst du ihr nicht, aber du zeigst ihr ein Entgegenkommen und Respekt.",0,0,0,0,1,0
deu_train_track_b_00686,Das ganze Land ist korrupt und ihre ausländischen Geldgeber und Kriegstreiber sind es demnach auch!,2,1,0,0,0,0
deu_train_track_b_00687,"Korrektur: RAUM Offenbach, nicht direkt in Offenbach, mea culpa. Wir sind aber mit Öffis gut erreichbar!",0,0,0,0,0,0
deu_train_track_b_00688,"Eigentlich hast du deine Frage schon selbst beantwortet. Schablonenhäuser sind deutlich billiger als architektonische Meisterwerke. Wenn du zum Beispiel hier auf Reddit rumliest, wirst du feststellen, dass die meisten Leute hohe Kredite aufnehmen und nicht selten auf Kante nähen, um sich eine Immobilie leisten zu können. Hätten die mehr Geld würden sich die meisten wohl auch lieber etwas Individuelles hinstellen als den Einheitsbrei. Das ""Müssen"" korreliert also sehr stark mit dem ""Haben"".",0,0,0,0,1,0
deu_train_track_b_00689,Der tägliche Konsum ist schädlich. Das weiß jeder Stoner auch selber.,0,0,0,0,0,0
deu_train_track_b_00690,"Japp, habe genau die selben Erfahrungen gemacht. Erst jammern sie Rum das man sich melden soll. Meldet man sich, kommt keine Antwort, meldet man sich nicht und wird dann gesehen, kommen gleich diese Sprüche wie ""hättest Mal was gesagt"" etc. Ist mir mittlerweile zu blöd, dem letzten der so ankam hab ich das Handy unter die Nase gerieben und ihm gezeigt das ich ihn 5x angeschrieben hab und nix zurück kam. Hab ihn dann mit dummen Gesicht stehen lassen. Dann lieber einsam als mich nicht auf die Menschen verlassen zu können.",1,1,0,0,1,0
deu_train_track_b_00691,mir gehts auch nicht gut,0,0,0,0,2,0
deu_train_track_b_00692,"Ich habe das auch mal abgesetzt, weil ich was anderes bekommen habe und vorher Venlafaxin raus sein musste.   Ich habe das unter ärztlicher Aufsicht langsam ausgeschlichen, also die Dosis über einen längeren Zeitraum immer weiter verringert. Dann sollte das keine großen Probleme geben. Von heute auf morgen einfach nicht mehr nehmen wird schief gehen und Absetzsymptome hervor rufen.   Ich hatte dabei keine anderen Probleme, als das mir halt die stimmungsaufhellende Wirkung gefehlt hat.",0,0,0,0,0,0
deu_train_track_b_00693,Bayern war Bremen Jäger Nummer 1,0,0,0,0,0,0
deu_train_track_b_00694,"Ich finde, jedes Windrad sollte einen Wärter haben wie ein Leuchtturm. Keine Ahnung, was der dann zu tun hätte. Aber ich will den Job, da hätte ich schön meine Ruhe.",0,0,0,1,0,0
deu_train_track_b_00695,"Es ist vollkommen Egal, ob das Subreddit Sex und Liebe trennen kann.  Du weißt doch schon, dass es ein No-Go für dich ist.",0,1,0,0,0,0
deu_train_track_b_00696,"Ich würde hier gern noch mehr schreiben, aber ich verkneife es mir.",1,0,0,0,0,0
deu_train_track_b_00697,"Ich bin momentan zwischen 10. und 11. SSW und bekomme ein Booster von meine FA in die 12. Woche. Meine 2. Impfung war in Juni, also 6 Monate vorher. Fuer mich es sieht sehr wichtig, ich bin asthmatisch und will keine Corona haben, ich habe auch 2 Kleinkinder zuhause die nicht geimpft sind und fuer mich die Extra-Schutz ist wichtig",0,0,1,0,0,0
deu_train_track_b_00698,"Hast du nen Therapeuten? Könntest mit dem gemeinsam an deinen Ängsten arbeiten. Vielleicht helfen dir auch Medis, hab auch welche und die helfen mir persönlich bei Ängsten ganz gut",0,0,0,0,0,0
deu_train_track_b_00699,".. reparieren die den Dalek etwa?  Mein Wissen über Doctor Who ist zugegebenermaßen gering, aber Daleks zu reparieren halte ich für unklug",0,0,0,0,0,0
deu_train_track_b_00700,"Also eine Hungersnot durch eine Naturkatastrophe ausgelöst ist eine Sache und schlimmer genug. Aber eine menschengemachte, absichtlich verursachte Hungersnot wie in #Gaza ist ekelhaft.",1,3,0,0,0,0
deu_train_track_b_00701,Du stehst jetzt auf der Hit-List von Waschmaschinenhersteller. Wenn Sonntagnacht es an der Tür klingelt - MACH NICHT AUF!  Hihi aber Glückwunsch :) Dinge zu reparieren ist so grundbefriedigend!,0,0,0,2,0,0
deu_train_track_b_00702,Erst liefern Sie Waffen an Israel und jetzt wollen sie Hilfsgüter über den Luftweg abwerfen! Finde den Fehler 😣,1,1,0,0,1,0
deu_train_track_b_00703,"Überwiegend am Telefon, aber auch Anfragen per Chat, Mail, Brief, Fax, WhatsApp, Facebook, Twitter - eigentlich über so ziemlich jedes erdenkliches Medium. Meine Themenschwerpunkte war Netztechnik, Handy-Internet und Handy-Defekte.  Wollt ihr dazu irgendwas wissen?",0,0,0,0,0,0
deu_train_track_b_00704,"Gabs eigentlich irgendne Demo auf der Hildmann war, aber nicht von der Polizei mitgenommen wurde? Ist das vielleicht dessen Fetisch?",0,1,0,0,0,0
deu_train_track_b_00705,läuft ja richtig gut,0,0,0,1,0,0
deu_train_track_b_00706,Ja aber dir meisten sind leider komplett unterdosiert oder schlecht zusammengestellt... Vorallem in Deutschland. Mit gesunder Ernährung und Sport wirst du 90% besser schlafen. Würde damit anfangen.,0,0,0,0,0,0
deu_train_track_b_00707,"Hi, ich suche nach Empfehlungen für Bikinis oder Badeanzüge, die ich in der Schwangerschaft zum (sportlichen) Schwimmen tragen kann.   Ich bin in der 26. Woche und leider passen mir meine Badeanzüge und Bikinis nicht mehr - vor allem wegen der gewachsenen Brüste (ich habe aber leider insgesamt auch zugenommen). Vor der SS hatte ich schon 80E. Wo ich aktuell stehe weiß ich nicht mal, ich denke bei 1-2 Größen größer.  Kennt jemand Marken für große Cups/Größen, die gut ""halten""? Ist ein Bikini praktischer, da der Bauch hier in den übrigen Wochen genug Platz hat, und ich evtl. nur das Oberteil austauschen muss, wenn die Brüste weiter wachsen?",0,0,0,0,0,0
deu_train_track_b_00708,Glückwunsch und alles gute für die neue Saison ihr spielt zum Glück erst am letzten Spieltag gegen mein Lieblingsverein😄,0,0,0,2,0,0
deu_train_track_b_00709,"Ich(m35) war auch eigentlich immer in langen Beziehungen, die letzte ging 11jahre davon 4jahre ehe. Und ja ich muss auch sagen das hat sich alles verändert, das liegt aber auch am alter würde ich sagen. Ich hatte jetzt zwei ""Erfahrungen"" nach alle dem und es war jedes mal beim ersten Treffen sex im Spiel. Wiederum waren beide auch sehr offen und ganz anders als ich es kannte. Ich hatte auch direkt die hand an der Kehle, das war seltsam aber ok für mich( was ich nicht dachte). Konsens ist aber auf jeden Fall immer das aller wichtigste! Ich halte mich da jetzt einfach offen dem gegenüber und schau mal was so kommt.",0,0,0,0,0,0
deu_train_track_b_00710,"Ich habe die Schnauze so voll von den Putin trollen. Wenn ihr Putin so huldigt, dann haut doch ab nach Russland er sucht eh nach Kanonenfutter. Euch Spinnern trauert keiner nach ihr Wichser.😡💩",3,2,0,0,0,0
deu_train_track_b_00711,"Alles andere als normal. So extreme Aussagen tätigen die wenigsten überhaupt mehrmals im Jahr, aber gar öfter in der Woche? Ne, das schreit hier nach fehlender Selbstliebe und Aufmerksamkeit. Da versucht das jemand mit äußerlichen Liebesbekunden und co auszugleichen, was im Inneren fehlt, wenn es denn auch so extrem ist wie beschrieben. Vor allem sowas einfordern geht schon mal gar nicht. Der Partner sollte dies auch wollen und nicht gezwungen werden, denn damit überschreitet man Grenzen und schadet dem Partner eher für sein eigenes Bedürfnis etwas hören zu wollen, ziemlich egoistisch.",0,1,0,0,0,0
deu_train_track_b_00712,"leider kann die Kommentarsektion derzeit nicht geladen werden, bitte versuche es später erneut.",0,0,0,0,0,0
deu_train_track_b_00713,Hoffentlich fahren sie dann nicht mehr im SUV der Eltern in die Schule und sagen den nächsten Städtetrip mit Flieger ab. Eher nicht. Wird alles gut. Denkt an die 68er. Die grillen heute auch Dry Age Beef mit 1000 € Weber Grill. Ich muss lachen.,1,1,0,1,0,0
deu_train_track_b_00714,"Ist man automatisch, wenn man gegen Windparks ist, ein Klimawandelleugner? 🤔 Oder ist das die gleiche Geschichte wie während Corona? Ich möchte keine Impfung und bin dann auch sofort Coronaleugner?",2,0,0,0,0,0
