id,text,anger,disgust,fear,joy,sadness,surprise
hau_train_track_b_01527,Mudai kawai abunda Allah yakaimu 2023 za’a ga abun mamaki a Nigeria 🇳🇬 inshallahu,0,0,0,0,0,1
hau_train_track_b_01528,"Adam A Zango Ya Fitar da Sabon Faifan Bidiyo Kan Halin da Ya Ke Ciki, Ya Yi Godiya",0,0,0,2,0,0
hau_train_track_b_01529,au wai daman basu yafemasa ba ai nazata an wuce wannan maganar sai y kiyayi aisha yasani baba natane ita kadai,0,0,0,0,0,3
hau_train_track_b_01530,Ruwan sama kamar da bakin kwarya ya lalata gidaje 271 a jahar Kaduna,0,0,0,0,2,0
hau_train_track_b_01531,El-Rufai Ya Yiwa Tinubu Addu’ar Allah Ya Bashi Nasara a Zaben Bana,0,0,0,2,0,0
hau_train_track_b_01532,"Allah fa dakanshi yace ya tsinewa Mai karin gashi DA wacce ake karamawa😭😭😭 Amman ynzu ammata shikukasa a gaba,Allah yashiryamu baki daya yasa mu dace,amin",0,2,0,0,1,0
hau_train_track_b_01533,"Mi kake yi da hoton mata a dakin ka? Karuwai nane.. Cut form the movie #TsalleDaya wallahi you give me laugh sir, the way you looked her 😂😂",0,0,0,2,0,0
hau_train_track_b_01534,Toh wae 🤔🤔dama KU jira kuke a kula daku,0,0,0,0,0,2
hau_train_track_b_01535,ai ba abun mamaki bane a najeriya ma beraye sun hana shugaban kasa shiga office,1,0,0,0,0,0
hau_train_track_b_01536,Allah ya waddan wanga cikaba babu😭😭😭 Allah ya kara tsarewa,0,1,1,0,2,0
hau_train_track_b_01537,Tooh yanzu kuna nufin Kano pillars players duk sun samu kunnen doki kenan? Tabdi Jan palalu 😂😂😂,0,0,0,0,0,1
hau_train_track_b_01538,Kar Kuji Tsoron Fari Ko Rashin Abinci Shekara Mai Zuwa Inji Hukumar Kula Da Filayen Noma,0,0,0,0,0,0
hau_train_track_b_01539,Allah Ya Yiwa Na'ibin Limamin Masallacin Sultan Bello Rasuwa,0,0,0,0,3,0
hau_train_track_b_01540,"Daga karshe: Shugaban kasar Ethiopia, Mulatu ya yi murabus",0,0,0,0,0,0
hau_train_track_b_01541,“Allah Ya Kiyaye Hanya Hajiya”: Bidiyon Matashiya Sanye Da Hijabi Tana Tuka Babbar Mota Ya Dauka Hankali,0,0,0,1,0,2
hau_train_track_b_01542,An aje dirom din kashi a kofar gidansa,0,3,0,0,0,0
hau_train_track_b_01543,Ta rubuta Al-Qur’ani gaba daya da tawadan ruwan Zinari,0,0,0,0,0,2
hau_train_track_b_01544,Inda ranka! Miji ya taya matar sa murnar ta haifar masa 'shege' (Hotuna),0,0,0,0,0,3
hau_train_track_b_01545,"Kai Jama’a 🥺. Allah kawo mana karshen wagga masifa, Allah tona asirin sponsors nasu amen 🙏🏾",0,0,1,0,2,0
hau_train_track_b_01546,Babban dana sanin da Dan Kano yayi shine zabar Buhari a 2015 wannan shine dana sani mafi muni a tarihin siyasar jahar kano 😎,0,0,0,0,3,0
hau_train_track_b_01547,Allah ka ceto kasar mu daga rushewa🙏🙏,0,0,2,0,0,0
hau_train_track_b_01548,A fito da su ina? Wai halin da muke ciki bai ishe mu? Sai mun kara jajubo wasu bala'in? A barsu kawai😕😕😕,2,0,0,0,0,0
hau_train_track_b_01549,"Yarinyar ta chaɓa fenti a fuskarta, ga wasu farata zaƙo zaƙo kamar na zakanya.",0,2,0,0,0,0
hau_train_track_b_01550,tabdi jam yanzu kana nufin sangaya rs kenan,0,0,0,0,0,2
hau_train_track_b_01551,Subhanallahi to sabo dame jamaa mudai bazaa kyalemu ba ke nan...😭😭😭,0,0,0,0,2,0
hau_train_track_b_01552,allah don alfarman annibi ka kawo mana karshin wannan musiban,0,0,3,0,0,0
hau_train_track_b_01553,Tun da ta fitarda Mai wuta saura Mai zafii🤣🤣,0,0,0,0,0,0
hau_train_track_b_01554,Himm yanajin tsoron kayin daza ayi masa ne yagudun kai nai ya fashe 😋😋😋😋😋,0,0,0,0,0,0
hau_train_track_b_01555,Su yaki boko haram tukun kafun wannan ya biyo baya🤦🏻‍♀️,1,0,0,0,0,0
hau_train_track_b_01556,Tashin hankali: Wuta ta babbake wani magidanci a dakin budurwarsa,0,0,2,0,2,0
hau_train_track_b_01557,"Yau bazzen manjo talakawa suna murna da samunka a duniya , alherin Allah shi kaima ka baba sarkin tausayin talaka 😂😂",0,0,0,2,0,0
hau_train_track_b_01558,India fah en iska ne😂😂😂,0,0,0,0,1,0
hau_train_track_b_01559,"Innalillahi: Fitacciyar Jarumar Fina-finai Ta Tsallake Rijiya Ta Baya, Ta Yi Godiya Ga Allah",0,0,1,2,0,0
hau_train_track_b_01560,Gobara ta kama gidansu wuta duk ta Kona musu fata abun dadi gani,0,2,0,0,0,0
hau_train_track_b_01561,allah ubangiji yabaka lafiya mu kuma allah yakaremu,0,0,2,0,2,0
hau_train_track_b_01562,Allura da take tsotse jini Waye xai bayar da kansa a kashe masa rayuwa a kan dubu 40 👌,0,0,2,0,0,0
hau_train_track_b_01563,dama har yanzu akwao korona,0,0,0,0,0,3
hau_train_track_b_01564,Mu daurawa tun qarfe dayan dare muka fara.aha😂😁😀😋 ##URL##,0,0,0,0,0,0
hau_train_track_b_01565,"Lokaci yayi da zamu nemi taimako, Saraki ya baiwa shugaba Buhari shawara",0,0,0,0,0,0
hau_train_track_b_01566,Wai shikam dan jarida baya mutuwa ne 😂,0,0,0,0,0,0
hau_train_track_b_01567,Allah ya jikan ta yasa aljanna makoma agare ta...Allah ka jikan iyayen mu da yan uwan mu baki daya...idan tamu tazo kasa mu cika da kyau da imani...Ameen ya Allah 🤲🤲🤲,0,0,0,0,3,0
hau_train_track_b_01568,Harna Tina da great Wall🤧🌚😂😂,0,0,0,0,0,0
hau_train_track_b_01569,"Wike: Tsohon Gwamnan Ribas Ya Bayyana Dalilin Da Ya Kamata APC Ta Yi Godiya Ga Allah, Ya Kuma Caccaki PDP",1,0,0,0,0,0
hau_train_track_b_01570,Allah mun tuba ka yafemu 🤲🤲🤲 Allah ka kawo mana saukin wannan annoba 🤲🤲 🤲,0,0,3,0,0,0
hau_train_track_b_01571,Babu dan air kamar buhari fa a qasar nan. Kume kuke kallon sa haka 🏃🏃🏃🏃,2,0,0,0,0,0
hau_train_track_b_01572,‘Yan bindiga sun sace wani basarake a Jalingo bayan ya bar wurin murnar ranar dimokradiyya,0,0,3,0,1,0
hau_train_track_b_01573,Dandalin Kannywood: Saura kadan in aure Nafisa Abdullahi amma na fasa - Adam Zango,0,0,0,0,0,0
hau_train_track_b_01574,"Tumatur dake daure a cikin leda ya lalacewa, har yayi tsutsa.",0,3,0,0,0,0
hau_train_track_b_01575,😀😀😀😀😀lefinkune ay saida mukace karku bari yayi magana,0,0,0,0,1,0
hau_train_track_b_01576,Kuji dan iska ana sacemu amma wae mawaka yake taya wa murna 😠,3,0,0,0,0,0
hau_train_track_b_01577,Mai gyaran Masai ya lume cikin Kashi,0,3,0,0,0,0
hau_train_track_b_01578,"Birnin Kebbi: Jama'a sun cika da murna, farincikin zuwan Buhari",0,0,0,3,0,0
hau_train_track_b_01579,Allah Mai Iko: Jerin Sunayen Ƙasashen Duniya 6 da Rana Ba Ta Faɗuwa Na Tsawon Lokaci Ba Dare,0,0,0,0,0,3
hau_train_track_b_01580,Subhanallah Allah ka kawo mana dauki 😢,0,0,2,0,1,0
hau_train_track_b_01581,Mara lafiyar tayi amai da zawo akayanta gurin duk ya cakalkale,0,3,0,0,0,0
hau_train_track_b_01582,"Atiku: Domin ceton kanmu, dole ne mu taimakawa gwamnatin Buhari",0,0,0,0,0,0
hau_train_track_b_01583,Wannan yan majalisa dai kau sun wulakanta🤦🏽‍♂️,0,0,0,0,1,0
hau_train_track_b_01584,Tsohon direkta ya tsallake rijiya da baya yayinda 'yan bindiga suka afka musu a Abuja,0,0,2,0,1,0
hau_train_track_b_01585,"Uwargida Ta Siyawa Mai Gida Mota Kirar Ferraru, Martaninsa Ya Ba Jama’a Mamaki",0,0,0,0,0,3
hau_train_track_b_01586,Yanzu-yanzu: Allah ya yiwa mahaifin Ali Nuhu rasuwa,0,0,0,0,3,0
hau_train_track_b_01587,"Duk da ‘Dan takararsa bai yi nasara ba, Tinubu ya taya Adamu murnar zama Shugaban APC",0,0,0,2,0,0
hau_train_track_b_01588,"Da ya bai wa mahaifinsa hantarsa, an yi aikin cike da nasara, sun yi hotuna cikin farinciki",0,0,0,3,0,0
hau_train_track_b_01589,Kurjin fuskarta yaja ruwa har mugunya ce take fitowa fara mai kauri,0,3,0,0,0,0
hau_train_track_b_01590,Duk duniya Najeriya tafi ko ina iskan da raina hankalin mutane🙄,1,0,0,0,1,0
hau_train_track_b_01591,Ya boye hodar koken cikin gasassun kaji,0,1,0,0,0,0
hau_train_track_b_01592,ina gwanin wani ga nawa legend ️,0,0,0,1,0,0
hau_train_track_b_01593,Amarya ta kwalba majina cikin miya,0,3,0,0,0,0
hau_train_track_b_01594,gimbiyar mata eid mubarak,0,0,0,1,0,0
hau_train_track_b_01595,Halan suna zuwa da Sabin qafafu ne da Zan saye gwanjon takalmin da tsada Haka🙄,1,0,0,0,0,0
hau_train_track_b_01596,ina ke yar barcelona ce bamu gane ba,0,0,0,0,0,2
hau_train_track_b_01597,sai a kai mata sammaci kabarinta ai,1,0,0,0,0,0
hau_train_track_b_01598,An fito da da sharar dakin bukar 'kwari suna ta bi.,0,3,0,0,0,0
hau_train_track_b_01599,😂😂😂😂na dauka ma maganin mutuwa suka samo,0,0,0,0,0,0
hau_train_track_b_01600,Wata kyakkyawar budurwa ta mutu bayan aminiyarta ta saka mata guba a abinci saboda ta samu karin girma a wajen aiki,0,1,0,0,3,0
hau_train_track_b_01601,uban wayache karsu kama kawunansu meyake circulating banda nanayen yada rashin kunya da rugurguza hanyar addini da aladun arewa,3,0,0,0,0,0
hau_train_track_b_01602,"Kagara: 'Yan bindiga basu tausayi ko tsoro, sun ce alkawarinsu gwamnati ta karya, Hauwa",0,0,2,0,0,0
hau_train_track_b_01603,ASUU ta yi Allah wadai da korar malaman jami’a da gwamnatin Kaduna ta yi,0,1,0,0,1,0
hau_train_track_b_01604,kaiii allah ya sauwake,0,0,0,0,1,1
hau_train_track_b_01605,Hawa'u Sale na neman taimako cikin gaggawa,0,0,0,0,2,0
hau_train_track_b_01606,Nama ya kare a jihar Kwara sakamakon tsadar farashin shanu a yankin,0,0,0,0,0,2
hau_train_track_b_01607,Abincin ya rube yayi wari har tsutsotsi sun fito akansa,0,3,0,0,0,0
hau_train_track_b_01608,Tabar wawa da bahi🤣,0,0,0,0,0,0
hau_train_track_b_01609,"Shugaba Buhari ya taya shagon dan dambe, Anthony Joshua, murna",0,0,0,2,0,0
hau_train_track_b_01610,’Yan fashi sun sake bayyana a wasu titunan Legas,0,0,3,0,0,0
hau_train_track_b_01611,"Ashema ghana basuda matamasu kyau, yanxu wagga ce kure adakar su 😏",0,1,0,0,0,0
hau_train_track_b_01612,Ali Sarkin Mota: Allah ya yi wa direban Sardauna rasuwa,0,0,0,0,3,0
hau_train_track_b_01613,Akuya ta yi zawo a cikin kunun maijego.,0,3,0,0,0,0
hau_train_track_b_01614,Khadimul Islam: Kasar Saudiyya ta karrama gwamna Ganduje (Hotuna),0,0,0,2,0,0
hau_train_track_b_01615,Allah Ya yi wa Hajiya Rabi Hardawa rasuwa,0,0,0,0,3,0
hau_train_track_b_01616,Akin Hajji: kungiyoyi sun nuna rashin jin dadinsu ga gwamnatin Kalaba,0,0,0,0,2,0
hau_train_track_b_01617,Allah ya kawo mana karshen wannan masifa data addabemu Amin.🤲,0,0,2,0,1,0
hau_train_track_b_01618,Ashe kaima kana Dana KARYA. 😂🤣😂,0,0,0,0,0,1
hau_train_track_b_01619,Buhari da sauran shugabannin kasashen duniya sun taya Biden murna,0,0,0,2,0,0
hau_train_track_b_01620,"Mu gyara zukatan mu, muso junan mu mu dena raina namu mu dena fifita nasu, muji sune bayin mu da zamu yi musu mu'amala me kyau kaga babu jin tsoro kai magan agaban uban kowa da yaren ka shine cinyewa, namu namu ne bare kuwa can ya karata HAUSA FULANI ASAMAN KOWA✊🏼✊🏼✊🏼✊🏼✊🏼",0,0,0,0,0,0
hau_train_track_b_01621,Yan sanda sun damke wata budurwa da ke yiwa 'yan achaba fashi a Katsina,0,0,0,1,0,0
hau_train_track_b_01622,Sauya Sheka: Fusatattun Sanatocin APC Sun Gana da Buhari a Aso Rock,0,0,0,0,0,0
hau_train_track_b_01623,Kotun shari'a ta raba aure a Zamfara saboda tsabar girman mazakutar miji,0,0,0,0,0,0
hau_train_track_b_01624,mtsww ai gara ana zuwa makarantar wannan irin jahilci dakuke nunawa duniya inda bakwa karatu ba a san me zakoyiba kuma,1,1,0,0,1,0
hau_train_track_b_01625,Babu mamaki ma Buhari ya mutu – Fani-Kayode,0,0,0,0,0,0
hau_train_track_b_01626,"Bayan kashe mutum 50, 'Yan bin sun sake sheƙe dandazon mutane a jihar Kaduna",0,0,3,0,2,0
hau_train_track_b_01627,Yan bindiga sun kashe mutane 5 a sabon harin da aka kai jihar Rivers,0,0,2,0,2,0
hau_train_track_b_01628,Babbar Sallah: Wani Gwamnan Arewa Ya Bada Umarnin Biyan Ma'aikatan Jiharsa Albashi Kafin Sallah,0,0,0,3,0,0
hau_train_track_b_01629,"Hmm, giyar kafurci ce take janshi... Wallahi summa tallahi qaryarka tasha qarya! 😤 Duk wanda yacce ya ɗarmi anniyar yaqi da addinin Allah tho wallahi qarshen Alewa qasaa! Saboda da ALLAH ne yake faɗa! Kuma babu Shegen da zai iya jayayya da ALLAH ya samu nasara! 🤯",2,0,0,0,0,0
hau_train_track_b_01630,Fulani da Berom sun yi bikin zaman lafiya a Filato,0,0,0,2,0,0
hau_train_track_b_01631,kuma dai allah ya kawo mana karshen wann masifa,0,0,3,0,0,0
hau_train_track_b_01632,"Kadan suka miki wallahi ni 2,000 suka zare min ji nake kamar nae jumping din yau Gobe Na dira a bankin na musu Tijara Kuma yasin na Daen aeki Dasu😂😂😂😂",1,0,0,0,1,0
hau_train_track_b_01633,Allah ya kara hada su fada har sai sun kare tas!!!😣😣😣,2,0,0,0,0,0
hau_train_track_b_01634,"‘Dan shekara 18 ya dawo da N20.5m da ya tsinta, ya samu kyautar miliyoyi da abubuwan alheri",0,0,0,3,0,2
hau_train_track_b_01635,Dan wahala allah ya la.ance ka🙄,3,1,0,0,0,0
hau_train_track_b_01636,Ko baka fada ba dolenmu muyi tunda ba ganinka zamuyi ba balle mu nuna maka fushinmu.😀,0,0,0,0,1,0
hau_train_track_b_01637,Hmhmhm 🤔🤔 kaih jama a yanzu wait ace buhari baidamu halin da Yan kasa kaiciki,0,0,0,0,2,0
hau_train_track_b_01638,innalillahi allah kadubi bayinka salihai,0,0,2,0,0,0
hau_train_track_b_01639,"Bayan kashe abokinsa da yayi don tsafin yayi kudi, yana mamakin wai har yanzu yana cikin talauci",0,2,0,0,0,1
hau_train_track_b_01640,Hahahaha Nigeria 🇳🇬 duk shekarun da aka dauka Ana saida man fetur babu wani tsari wanda za a dinga tara kudi sai dai yan iska suyita sace kudin.,2,0,0,0,1,0
hau_train_track_b_01641,Dazun ta matse ruwan kurjinta da baki kuma ta kurbe abunta,0,3,0,0,0,0
hau_train_track_b_01642,Hegu suna washe baki😒 sun samu dollar,2,0,0,0,0,0
hau_train_track_b_01643,allah ya jikanshu da rahama,0,0,0,0,3,0
hau_train_track_b_01644,Yanzu-Yanzu: Allah ya yi wa Sanata Ali Wakili na jihar Bauchi rasuwa,0,0,0,0,3,0
hau_train_track_b_01645,Anshiga Uku wannan wane irin mulkine wai 😪🤔??,0,0,0,0,2,0
hau_train_track_b_01646,Abun haryakai ga haka😂😂,0,0,0,0,0,2
hau_train_track_b_01647,Ya na cin tasono,0,2,0,0,0,0
hau_train_track_b_01648,"Allah Ya yi, Saitin Farkon ‘Yan Najeriya 350 da Yaki Ya Rutsa da su a Sudan Sun Dawo",0,0,0,2,0,0
hau_train_track_b_01649,Gwamna Abiodun ya zare hannunsa daga Kwamishinan da ya zagi Osoba,1,0,0,0,0,0
hau_train_track_b_01650,bayada amfani jahilla kawai wan nan girman kaine kuma shine jahilcin as from nun u have change to jahila shidaniya kawai fitsarraliya allah ya isah da sport dinki danayi abaya kuma duk kikabar musulunci bamu yafeba domin akwai alamun hakan,3,0,0,0,0,0
hau_train_track_b_01651,Toh😎😎😎😎😎 kema ure one of them kenan 😄😄😄😄😄😄munji dadi ancire yan iska babu dadi kuma kuji abinda mukaji..last year barca...,0,0,0,2,0,0
hau_train_track_b_01652,Alhaji Shehu Shagari (1924 zuwa 2018),0,0,0,0,0,0
hau_train_track_b_01653,Musulunci yana samun barazana a kasar Faransa,0,0,1,0,1,0
hau_train_track_b_01654,wai ashe ina da budurwa,0,0,0,0,0,3
hau_train_track_b_01655,"Zamfara: An yi batakashi tsakanin sojoji da 'yan bindiga, ba a san adadin wadanda suka mutu ba",0,0,1,0,3,0
hau_train_track_b_01656,Ina ma aba Baba Ganduje 🥰🥰🥰,0,0,0,2,0,0
hau_train_track_b_01657,"Duk party me """"""""""""""""""""""""""""""""A"""""""""""""""""""""""""""""""" din nan duk na APC ce matsala aka samu 😂😂",0,0,0,0,0,0
hau_train_track_b_01658,Wata budurwa tayi kyautar al'aurar ta a 'fezbuk' (Hotuna),0,1,0,0,0,0
hau_train_track_b_01659,Inna lillahi wa'inna ilaihi raji'un Allah kamana tsari da yan luwadi da madigo 👏,0,2,0,0,0,0
hau_train_track_b_01660,Wai shi wannan yaushe zai daina wannan mummunan halin😏 ##URL##,1,0,0,0,2,0
hau_train_track_b_01661,Sallah: Sarkin Musulmi Ya Bada Umarnin Duba Jinjirin Wata,0,0,0,0,0,0
hau_train_track_b_01662,Buhari ya aika sakon ta'aziyya ga gwamna Ahmed Makarfi,0,0,0,0,2,0
hau_train_track_b_01663,Tau Allah yasa dai ba larabci akayi ba dn tsohonga ko ma ismuka bai sanni ba🙄🙄,0,0,0,0,0,0
hau_train_track_b_01664,"Kiji tsoron allah dai , kuma muna addu ah allah y shirya ki shirin adnin musulunci🙏🙏",0,0,0,0,2,0
hau_train_track_b_01665,Allah yasa karshen sune yazo🤲🙏,0,0,1,0,0,0
hau_train_track_b_01666,Yarinya tana shan ruwan kwata mai wari,0,3,0,0,0,0
hau_train_track_b_01667,ya allah ka kawo ma wadannan bayin allah dauki,0,0,2,0,2,0
hau_train_track_b_01668,"😣 Innalillahi wa'inna ilaihirraj'un. Ya kamata Hankalin me yankan Kaba ya koma kan runa, mutane su gyara halayya da dabu'u su kuma yawaita. """"""""""""""""""""""""""""""""Astagfirullah wa atubu ilaih""""""""""""""""""""""""""""""""",0,0,0,0,2,0
hau_train_track_b_01669,Tirkashi: Wani Dalibin jami'a ya lakadawa malamarsa duka kawo wuka daga neman taimako,0,0,0,0,2,2
hau_train_track_b_01670,"Ana daf da zaben shugabannin APC, Buhari ya hadu Tinubu da wadanda suka kafa jam’iyya",0,0,0,0,0,0
hau_train_track_b_01671,buhari faaa yaci kai wollah,1,0,0,0,0,0
hau_train_track_b_01672,Yaci guba dai 🤣🤣🤣,0,0,0,0,0,0
hau_train_track_b_01673,ka dauki salon mulki erinna megidanka firauna,0,0,0,0,0,0
hau_train_track_b_01674,Buhari yanxu zaiji yanda mukaji.....zai tabbatar da yaudara ba dadi😂,0,0,0,1,0,0
hau_train_track_b_01675,Ka fara koh😞 toh duk Wanda yace shine wlh ba shi bane,0,1,0,0,0,0
hau_train_track_b_01676,"Allah ya nuna mu'ujizarsa yayin kubutar da ni daga hannun yan bindiga, Kwamishina ya magantu",0,0,0,0,0,0
hau_train_track_b_01677,Tundafa shuwagabannin su na America sun kashe me kashesu aiko kunga dole suyi murna 😔,0,0,0,0,1,0
hau_train_track_b_01678,Ashe ma Ba kyawawa a Gana 😂😂😂duk su ado gwanja ne,0,0,0,0,0,0
hau_train_track_b_01679,Kulin wakar da yake yi itace “Tunbuɗi amai a hada shi da majina dadi kan dadi”,0,3,0,0,0,0
hau_train_track_b_01680,Qarshen rashin kunya kenan da rashin sanin darajar manya 🌚,3,0,0,0,0,0
hau_train_track_b_01681,Wani Matashi ya sheme Mahaifiyarsa da Katako a jihar Legas,0,2,0,0,0,1
hau_train_track_b_01682,Mudai muna ruwa 😔 Ba damn kallo,0,0,0,0,1,0
hau_train_track_b_01683,Mutanen 9ja iyayen maula most especially Mutanenmu📵📵📵📵📵,1,0,0,0,1,0
hau_train_track_b_01684,Dan uwarsa yaga munyi kama da yan nigeria ne😁😁😁😁,2,0,0,0,0,0
hau_train_track_b_01685,“Ina Mutunta Kudi”: Kyakkyawar Mata Ta Nunawa Duniya Mijinta Dan Dattijo a Bidiyo,0,0,0,1,0,0
hau_train_track_b_01686,Masoyina ne ya yi min ciki ba mijina ba – wata matar aure ta shaidawa kotu cikin alfahari,0,2,0,0,1,0
hau_train_track_b_01687,Kullu Nafsin Za'ikatul Maut: Awanni kadan ya rage a daurawa Fatima aure sai Allah ya karbi rayuwarta,0,0,0,0,3,0
hau_train_track_b_01688,An cafke mutun 6 kan lalata kananan yara a Kebbi,0,3,0,0,0,0
hau_train_track_b_01689,Subhanallah. Allah kaimana Maganin Wannan musibar🤲,0,0,3,0,0,0
hau_train_track_b_01690,Toh Kai garuje dama haka ake bada professor din Kai taste Kaida baka cikin system din ma🤔🤔🤔Allah yakyauta,0,1,0,0,0,0
hau_train_track_b_01691,Allah ya kyauta: Uba ya yi ya ‘yar cikinsa cikin a Yobe,0,3,0,0,0,0
hau_train_track_b_01692,Najeriya ta na cikin karancin na’ura a tsakiyar annobar COVID-19,0,0,2,0,1,0
hau_train_track_b_01693,Allah Ya yi wa jarumi Abdulwahab Awarwasa rasuwa,0,0,0,0,3,0
hau_train_track_b_01694,"Innalilahi ji karya dan Allah, wallahi basu tsoron mutuwa mutanen nan😭😭😭😭",1,0,0,0,2,0
hau_train_track_b_01695,au da shi gogarman ya yarda 😂😂😂 ganduje mai abun mamaki,0,0,0,0,0,2
hau_train_track_b_01696,"Tun lokacin da kare ya mutu a bayan gida, wurin ya cika da tsutsosti",0,3,0,0,0,0
hau_train_track_b_01697,Tashin hankalin da iyalan mu ke shiga fah meza kuce 🙂,2,0,0,0,1,0
hau_train_track_b_01698,amarya tana zuwa wurin daurin aure need,0,0,0,0,0,2
hau_train_track_b_01699,😄 Allah Sarki! Bari da Biba ko ana ina yanzu?,0,0,0,0,0,2
hau_train_track_b_01700,Kotu Ta Kori Dan Takarar Majalisar Tarayya Na PDP a Jihar Imo,0,0,0,0,1,0
hau_train_track_b_01701,innalillahi wa inna ilaihi rajiunallah yayimuna maganin masu wannan mugun aiki,0,1,2,0,2,0
hau_train_track_b_01702,Yau ga Lalacewa Ni Ameenatu🙆🏻🙆🏻🤣🤣,0,0,0,0,1,0
hau_train_track_b_01703,"Sau 6 kacal na taba lalata da yarinyar, mahaifiyarta ce ke zuzutawa - Wanda ake zargi",0,2,0,0,0,0
hau_train_track_b_01704,😂😂😂“@<username> Arsenal ta doke Matsiyata a bayan gidansu 2-1 ##URL##,0,0,0,1,0,0
hau_train_track_b_01705,"#YauDaGobe babu Shakka matsalar da ake samu kenan yanxu baza a bar mace ta zaba ma kan ta, uban yayan ta nagari ba, koh me yasa🙊🙊🙊",0,0,0,0,2,0
hau_train_track_b_01706,"Allah ya yi wa tsohuwar jarumar Kannywood, Zainab Booth rasuwa",0,0,0,0,3,0
hau_train_track_b_01707,Ruwan hammatar me kosai Yana shiga cikin kullun kosan,0,3,0,0,0,0
hau_train_track_b_01708,"An rusa majalisar dokoki, an rufe iyakoki, an saka dokar ta baci a Chadi",0,0,2,0,0,2
hau_train_track_b_01709,Ambaliya ta kashe mutum 37 a Adamawa,0,0,0,0,3,0
hau_train_track_b_01710,Mai haka Kuma? Kudai Komai Mai ma Labari me 😠,2,0,0,0,0,2
hau_train_track_b_01711,Barayi sun farwa ma'aikatan NNPC sun gudu da miliyan 16 a Kano,1,0,1,0,0,0
hau_train_track_b_01712,Wananna maganar banza ce😡,3,0,0,0,0,0
hau_train_track_b_01713,"Innalillahi wa'inna ilaihi raju'un, Ya Allah ka kawo mana karshen wannan masifan ya Rabbi 🤲🤲",0,0,2,0,2,0
hau_train_track_b_01714,Rasha ta yi harbin gargadi kan jirgin yakin Birtaniya,0,0,1,0,0,0
hau_train_track_b_01715,Najeriya da kasar Koriya ta Arewa zasu kulla sabuwar alaka don tabbatar da tsaro da zaman lafiya,0,0,0,1,0,0
hau_train_track_b_01716,Allah ya kawo mana karshen wannan annoba Ameen🤲🤲🤲🤲,0,0,3,0,1,0
hau_train_track_b_01717,Sai dai karuwar chinhanchi da a kasamu😥😥,0,0,0,0,2,0
hau_train_track_b_01718,ya allah yayimu gafara ameen,0,0,0,0,2,0
hau_train_track_b_01719,"Haha 😁😁😋 Nigeria is a joke.. So,mun mata da Allah mahallaci mun koma rokon halittas sa.... Wallahi har naji kunya, Allah wadaran naka ya lalace",1,1,0,0,0,0
hau_train_track_b_01720,Kyakkyawar Matar Aure Ta Nunawa Duniya Mijinta Mai Nakasa a Bidiyo Mai Daukar Hankali,0,0,0,0,0,1
hau_train_track_b_01721,Qatar 2022: Masu tsaron gidan Faransa sun kamu da rashin lafiya,0,0,0,0,2,0
hau_train_track_b_01722,Suhanallah😢😢😭😭😭 @<username> Harin bama bamai ya kashe mutane 44 a Jos. ##URL##,0,0,1,0,3,0
hau_train_track_b_01723,Allah ya yiwa Farfesa Shehu Dalhatu na Jami'ar BUK rasuwa,0,0,0,0,3,0
hau_train_track_b_01724,Ramadan: ’Yan kasuwa sun yi alkawarin daidaita farashin kayan abinci,0,0,0,2,0,0
hau_train_track_b_01725,"Babu wani batun CeCe kuce, Lafiyar buhari kalau kawai iskanci ne 🤣🤣🤣",2,0,0,0,0,0
hau_train_track_b_01726,Yawwa damn ina neman ki fatara mai tada tsohon bashi yau sai kin biyani 50# dana taba a ra miki tun kapin ki zama cele😎😎🏃,0,0,0,0,0,0
hau_train_track_b_01727,"Sarkin Zazzau ya yi sabbin nade-nadensa na farko, ya yi sauye-sauye (jerinsu)",0,0,0,0,0,0
hau_train_track_b_01728,"Allah Bai Gaya Mun Magajin Buhari Ba, Malamin Addini Ya Magantu Kan Zaben 2023",0,0,0,0,0,0
hau_train_track_b_01729,"Yan bindiga sun cika hannu da kansiloli 3 a jahar Zamfara, sun nemi naira miliyan 40",0,0,3,0,1,0
hau_train_track_b_01730,Abeg suyi su dawo abi sai mun hada da protest?🤣,1,0,0,0,0,0
hau_train_track_b_01731,"Ganduje yanzu lashe hannu yake, ya gaalma chin tashi taliyar.. 😂",0,0,0,1,0,0
hau_train_track_b_01732,Yanzu-Yanzu: Shugaba Buhari ya taya ministansa murnan cika shekaru 70,0,0,0,3,0,0
hau_train_track_b_01733,"Babbar magana: Sayar da wiwi a jinina ne, dan haka babu wanda ya isa ya hanani - Wani dilan wiwi ya fadawa hukumar NDLEA",0,0,0,0,0,0
hau_train_track_b_01734,yabar abinci a bude kyankyaso ya hau Kuma yaci be saniba,0,3,0,0,0,0
hau_train_track_b_01735,"A raba mu, duka take lakaɗa min har da damƙar mazakuta na, Magidanci ya yi ƙarar matarsa Fatima",0,0,1,0,2,0
hau_train_track_b_01736,Mafarauci na lashe jinin dabar da ya kama,0,3,0,0,0,0
hau_train_track_b_01737,"Sabuwar shekara na dauke da juna biyun abubuwa masu kyau ga yan Najeriya, gwamna Masari",0,0,0,3,0,0
hau_train_track_b_01738,Toh ina ruwanmu da Corona 😠,2,0,0,0,0,0
hau_train_track_b_01739,Ku barni na dauki diyata ta mutu a gabana - Magidanci ya nemi gwamnati ta bashi 'yarshi bayan yaga wajen da ake kula da su bai da kyau,0,0,0,0,3,0
hau_train_track_b_01740,"Mijina ya yi min ƙaryar nice matarsa ta biyu, alhalin nice ta shida - Mata ta shaidawa kotu",1,0,0,0,1,1
hau_train_track_b_01741,An fara saka dankwali😀 Masha Allahu,0,0,0,2,0,2
hau_train_track_b_01742,Bandakin makarantar ya cika da zarnin fitsari da warin kashi,0,3,0,0,0,0
hau_train_track_b_01743,Nidai kam da sauqi. Amma abokina fah da ya hadu dashi baiji da dadi ba. Don sati guda yayi da jallabiya daya jikinshi kuma yana saman bene bai sauqo ba😂😂😂,0,0,0,0,1,0
hau_train_track_b_01744,Dalilin da ya sa nake boye wasu abubuwa da suka shafe ni – Nafisa Abdullahi,0,0,0,0,0,0
hau_train_track_b_01745,"Kadan suka fara gani. #IMF ta fara kansu. Dama! In har bakaji bari ba, kaji hoho. 😂",0,0,0,2,0,0
hau_train_track_b_01746,barka da sallah 🕌❤️🤲,0,0,0,1,0,0
hau_train_track_b_01747,Tinda nake ban taba ganin hoton dan ta’adda dan lukuti ba Sedai sirara Meyasa🤔?,0,0,0,0,0,1
hau_train_track_b_01748,Labari mai dadin ji: Maganar karin alawus din matasa masu yi wa kasa hidima ta kara tasowa,0,0,0,2,0,0
hau_train_track_b_01749,To ko me yake cewa kuma🤔?,0,0,0,0,0,2
hau_train_track_b_01750,allah yasa dai wayar bata fashe ba,0,0,2,0,0,0
hau_train_track_b_01751,zaman da mukayi da mahaifiyata lokacin dana samu kaina cikin wata damuwa cikin raha da wasa da dariya na samu saukin abubuwan dake damuna da kuma duk lokacin da zanje na tarar mahaifiyata ta hana kowa ni kadai ta ajiyewa wani abu na musamman i love you so much momcy,0,0,0,3,0,0
hau_train_track_b_01752,"Wanan abun yafi karfin hukuma kuma muma yafi karfun mu, addu'a ita kadai ce zata mana maganin wanan abun Allah ka kare mu da kariyar ka, Allah ka kawo mana karshen wanan abun🤲🤲🤲",0,0,3,0,1,0
hau_train_track_b_01753,Allah ya Kara hadasu Su tarwatsawa kansu🤲,3,0,0,0,0,0
hau_train_track_b_01754,"Allah muntuba,Allah kakawo Mana dauki.😭🙏🤲",0,0,2,0,1,0
hau_train_track_b_01755,Allah Ya Yi Wa Ohinoyi na Kasar Ebira Ado Ibrahim Rasuwa a Asibitin Abuja,0,0,0,0,3,0
hau_train_track_b_01756,"Harin 'yan bindiga a Plateau: Ya zuwa yanzu mun binne mutane 106, inji shugaban karamar hukuma",0,0,0,0,3,0
