id,text,anger,disgust,fear,joy,sadness,surprise
hau_train_track_b_00441,A shirye mu ke tsaf mu shiga Kotu da Ganduje – Mawallafin Daily Nigerian Jafar Jafar,1,0,0,0,0,0
hau_train_track_b_00442,Matashi yana yawo da Kai duk amosali,0,2,0,0,0,0
hau_train_track_b_00443,"Kai wannan matan ta kwashi kudi, rai da kwadayi knan ina zataje da kuddi kuma na haram ma haka 🤔🤔",0,0,0,0,0,0
hau_train_track_b_00444,"Matawalle Ya Fusata Kan Tsaro, Ya Tura Zazzafan Gargadi Ga Sabbin Sojin da Suka Samu Karin Girma",2,0,0,0,0,0
hau_train_track_b_00445,Zakuci naman baba lale ko 😂,0,0,0,0,0,0
hau_train_track_b_00446,"Nike da abunda bazan manta dashiba a 2020, har nabar duniya, nabarwa zuciya ta wannan takaicin Allah ya Kara mana imani duniya da lafira Amin.😭😭",1,0,0,0,3,0
hau_train_track_b_00447,Ay fa Kin ga haza😅 Allah ya kyauta,0,0,0,1,0,0
hau_train_track_b_00448,Tab zakuga mamaki daganin idoh ku😹,0,0,0,0,0,0
hau_train_track_b_00449,Lafiya Uwar Jiki: Anfanin kafar kaza 4 a jikin dan adam da zasu baku mamaki,0,0,0,1,0,1
hau_train_track_b_00450,"Wannan abin fa 🤔 Naga alamun dagaske ne, anma su kamfanonin layin da Kuma bakuna zasu Sha wahala",0,0,1,0,2,0
hau_train_track_b_00451,Gwalagwajin tumatur Yana fitar da ruwa me doyi,0,3,0,0,0,0
hau_train_track_b_00452,"Dan wani tsohon shugaban kasa ya aikata kuruciyar bera, ya fuskanci fushin alkali",2,0,0,0,0,0
hau_train_track_b_00453,haba da gaske,0,0,0,0,0,2
hau_train_track_b_00454,taab har na tausayawa masu yin zaben don zasu sha rana a banza,0,0,0,0,2,0
hau_train_track_b_00455,To wai meyasa bazasu gwada a sauran kasashenda sukafi afirka wannan annoba bane. Akwai lauje chikin nadifa🤔🤔,0,0,1,0,1,0
hau_train_track_b_00456,allah kyauta allah mana tsari dasu,0,0,2,0,0,0
hau_train_track_b_00457,Magidanci ya kashe matarsa saboda ta raina bajintarsa wurin kwanciyar aure,0,1,0,0,3,0
hau_train_track_b_00458,wae nikam ya ake gane miji nagari ne Ni nabi kudi banga dai dai bah Ke da kika ni soyayyan kina ta kuka Hahahah 💕💔 Wato. Ko bana gajiya da kallon film dinnan yaseen,0,0,0,2,0,0
hau_train_track_b_00459,Sakamakon canji: Atiku ya taya diyarsa murna bayan ta kama sana'a,0,0,0,3,0,0
hau_train_track_b_00460,Wani Saraki da yayi wa mace zigidir a Kasuwa zai shekara a kurkuku,0,2,0,0,0,0
hau_train_track_b_00461,Kut sata kiri kiri wannan fah ake kira next level 😂😂😂🤣🤣🤣,0,0,0,0,0,1
hau_train_track_b_00462,barawon jakar mata ya shiga hannu,0,0,0,2,0,0
hau_train_track_b_00463,Iyayenshi igbo Amman #hausa rangadau a bakinshi kamar jakin kano😂😂,0,0,0,0,0,1
hau_train_track_b_00464,Kinga Ni ko rahma nayi matukar bakin ciki😠 da Naga wanan hotun Nan kina jamana zagi a matsayin ki n musulma tun Muna damuwa har mun sallama ki Amma abin takaici shine abin ya tashi daka kanmu ta dalilin ki anyi batanci ga fiyayyen halitta Annabin Muhammad S A W 😭😰😥😢,3,0,0,0,2,0
hau_train_track_b_00465,Yadda 'yan kungiyar asiri suka makantar da ni saboda na ki shiga kungiyarsu - Matashi,0,0,0,0,3,0
hau_train_track_b_00466,Nabi ladama da 🏃🏃🏃🏃🏃 ladama fada ake ko aikine yake nuna anyita kixo kina raina Allah da manxansa kixo kina wani kuka a duniya kowa na gani idan k yi ladama gaba dayan k xaki canxa dabi'unk kamar yanda wayanda suka gabace k suka aikata ko n kk wa wannan ladamar baxan karba b,2,0,0,0,0,0
hau_train_track_b_00467,Kudaje na bin gyenbonsa,0,3,0,0,0,0
hau_train_track_b_00468,Idan yanzu bakuyi ba zakuyi nan gaba 😏,0,0,0,0,0,0
hau_train_track_b_00469,Dalilin da ya sa na daina zuwa yin jaje Zamfara – Yariman Bakura,0,0,0,0,0,0
hau_train_track_b_00470,"Akwai Alheri 1: Shugaba Tinubu Ya Gana da Shugaban UAE, Hotuna da Bayanai Sun Bayyana",0,0,0,1,0,0
hau_train_track_b_00471,Gwamnonin APC sun taya Buhari murnar cika shekara 77,0,0,0,3,0,0
hau_train_track_b_00472,"Da duminsa: Yan ta'addan Boko Haram sun hallaka Soji 7, sun koresu daga barikinsu a Borno",0,0,2,0,2,0
hau_train_track_b_00473,Yaron ma'kotan mu da ya 'kone a cinya kiyashi sun baibaye 'konuwar suna ta tsatssagar ciwon,0,3,0,0,0,0
hau_train_track_b_00474,"Jihar Neja: ’Yan Bindiga Sun Hallaka Kodinetan Hukumar FIRS, Sun Sace Mutum 3",0,0,3,0,1,0
hau_train_track_b_00475,meyasa kikesa chain a kafanki 🤔,0,0,0,0,0,2
hau_train_track_b_00476,Takardan da aka yi amfani da shi wajen goge kashin jariri ya fada a ruwan shayi,0,3,0,0,0,0
hau_train_track_b_00477,Subhanallah Allah ya kubutar da su🤲,0,0,1,0,2,0
hau_train_track_b_00478,"An yi wa mutum 1,600 aikin ido kyauta a Jigawa",0,0,0,2,0,0
hau_train_track_b_00479,Wandoki ya yage a gwuiwa😂😂😂😂,0,0,0,0,0,0
hau_train_track_b_00480,"Shawarata ga baba shine Dan Allah a duba talakan Nigeria musamman 'yan arewa wallahi ana cikin mawuyacin hali, yanzu sai kaga magidanci ya koma almajiri sbd kawai bashi da abin yi km ga iyali,yara kanana suna bin gidaje suna barar abin da zasu saka a bakinsu😭😭😭😭",0,0,0,0,3,0
hau_train_track_b_00481,Yan matan yanxu abun tsorone wlh hakafa wata tafara nunamin bakin kishi da tagida ai wlh daga ranar bata kara ganina ba🏃🏻🏃🏻🏃🏻🏃🏻‍♂🦸🏼‍♂🦸🏼‍♂,0,0,2,0,0,0
hau_train_track_b_00482,"Dama bayida wani anfani, sai dai kawai yan kudun Nigeria dasuke koyawa yan arewacin Nigeria iskanci👌🏻. Eg Zina!",1,0,0,0,0,0
hau_train_track_b_00483,tabbbb abun dariya,0,0,0,1,0,1
hau_train_track_b_00484,Alheri danko: Daliban Kwankwaso da su ka yi aure sun sanyawa diyar su sunan matar sa,0,0,0,2,0,0
hau_train_track_b_00485,Hahahaha 😂😂😂 Kaih jama a masu Shan wiwi zasuyi murna,0,0,0,2,0,0
hau_train_track_b_00486,Lallai akwai kura😂,0,0,0,0,0,0
hau_train_track_b_00487,Kunji yan gatan liti mugu arewa kuma su mutu ko 😭,2,0,0,0,2,0
hau_train_track_b_00488,Kina iskanci san ranki plx indai zaki burgeni ki curo NONON ki daya 1 plx i wan see somtin ☝,1,1,0,0,0,0
hau_train_track_b_00489,Kadage da cin bashi har a takai bature ya sallama gidanka yace fito nabiya kudinka😂,0,0,0,1,0,0
hau_train_track_b_00490,"Ohh!...mu da kullun sai munji Harbin fa a arewa?..yayi dai dai, Suma suji Karan Harbin da talakawa ke fama.😳🤨😠",1,0,0,0,0,1
hau_train_track_b_00491,Fasto ya yi wa mataimakiyarsa fyade,0,3,0,0,0,0
hau_train_track_b_00492,Allah Ya kiyaye gaba: Wata wuta da ta tashi a wata kasuwar jihar Kano ta babbaka shaguna 22,0,0,1,0,3,0
hau_train_track_b_00493,ASUU ta ce za ta zura ido ta ga ko Gwamnatin Tarayya za ta cika duk alkwuran da ta dauka,0,0,0,0,0,0
hau_train_track_b_00494,Ko yanzu ya sauka ae ya cucemu ya zalincemu allah ya isa 😭,2,0,0,0,2,0
hau_train_track_b_00495,"Sultan Hassanal Bolkiah: Hamshakin mai arzikin da ya mallaki Rolls Royce 500, N7m kudin askinsa",0,0,0,0,0,1
hau_train_track_b_00496,"‘Muna da Ƙarfin Murƙushe Ku’, Buhari Ya Gargaɗi Ƴan Bindiga Kan Kisar Mutum 83 a Zamfara",2,0,0,0,2,0
hau_train_track_b_00497,"Wata mai sayar da soyayya ta daba wa wani dan kasuwa kwalba har lahira, bayan ya saya yaki biyanta",0,0,0,0,3,0
hau_train_track_b_00498,Allah ya sadamu da farin ciki duniya da lahira.. Good morning prince 👑,0,0,0,1,0,0
hau_train_track_b_00499,"Mun yarda ka yi karatu sosai, amma kayi hakuri: Jami'ar East Carolina ta baiwa Ganduje hakuri",0,0,0,0,1,0
hau_train_track_b_00500,Innalillahi wa’inna ilaiheer raju’un. 😳😳 ubangiji Allah ya yaye masa mukuma allah yakaremu da kariyarsa,0,0,3,0,0,0
hau_train_track_b_00501,Nigeria ta haukace saboda corrona😭,0,0,2,0,0,0
hau_train_track_b_00502,"Alheri danko: Daga kyautar N100, mabaraci ya samu sakayyar N100k nan take",0,0,0,1,0,2
hau_train_track_b_00503,wai daman hakan ne hakuri ana kisan alumma shine shugabanci tir da irin wanga hali na ko in kulaa,2,1,0,0,2,0
hau_train_track_b_00504,Kwamishinan da ya yi wa Buhari fatan mutuwa ya rasu,0,0,0,0,3,0
hau_train_track_b_00505,Ya Allah 🤲🤲 ka kawo karshen wannan kisa da akeyi a duk wani state Allah ameen,0,0,2,0,1,0
hau_train_track_b_00506,A fada sunan su da yan uwansu mana in ba tsoro ba. 🙄,1,0,0,0,0,0
hau_train_track_b_00507,Yadda dan sanda ya dinga lalata da ni tun dare har asuba - Matar da ta take doka,0,3,0,0,0,0
hau_train_track_b_00508,allah ya mayar musu da wanda ya fishi alkhairi kuma ya kiyaye nagaba amin summa amin,0,0,0,0,2,0
hau_train_track_b_00509,to yau ko kashe mutane da akeyi yayi shuru ballantana wanga abu 😭,0,0,0,0,3,0
hau_train_track_b_00510,Toh rahama anchi uwar su messi din 😂😂😂,1,0,0,0,0,0
hau_train_track_b_00511,"Talauci Talauchi To shin Ku minene naku kun kwashe kudin talakka kunkai kasashen waje kun danne kuzo kuna maganar talauchi? Ai Ku kun kubuta kubari mu talakkawa Allah shi yimana mafita tunda bamuda amfani a wajan ku sai ranar zabe ta dawo muje muyi muku bauta, wllh Allah Ya'isa😭",2,0,0,0,3,0
hau_train_track_b_00512,allah ya kawo mana karshin wannan annoba data anbabi duniya ya allah,0,0,2,0,0,0
hau_train_track_b_00513,taff toh allah ya kiyaye,0,0,1,0,1,1
hau_train_track_b_00514,"Allah s.w yasa kwanciya hutawa, Ina yiwa jama'ar zazzau ta'aziyya😭😭",0,0,0,0,3,0
hau_train_track_b_00515,Ai kuwa sai a fara da ma aikata masu ɗamara👮; indai da gaske ake.,0,0,0,0,0,0
hau_train_track_b_00516,Yanzun nan: 'Yan bindiga da kayan sojoji sun bude wa matafiya wuta a hanyar Benin-Ore,0,0,3,0,2,0
hau_train_track_b_00517,Dandalin Kannywood: Muhimmiyar wasiyyata ga masu son koyi da ni a duniya - Nafisa Abdullahi,0,0,0,0,0,0
hau_train_track_b_00518,A ƙarshe: Kotu ta garƙame mutane 6 da aka same su da ɗanyen naman mutum,0,2,0,0,0,0
hau_train_track_b_00519,📻 BBC Hausa da sauran ma'aikatan Ku maza da Mata wadanda Duke Nigeria Da birtaniya INA taya Ku murnar Cika shekara @<username>,0,0,0,3,0,0
hau_train_track_b_00520,wai product din nan naka kowa siyarmasa kak need,0,0,0,0,0,2
hau_train_track_b_00521,Yar lesbians rahama sadau 🤔,1,3,0,0,0,0
hau_train_track_b_00522,Allah ya wadaran naka ya lalace Na wani ya gyaru Amma wanga kan ku bincike shi dun ya fara zarewa kana musulmi Amma baka da tunani ah matsayin ka na malami ko da yake dan PDP ne kuma lashe money 💰,2,0,0,0,0,0
hau_train_track_b_00523,ya salaam ya allah ka kawo karshen wannan annoba,0,0,3,0,0,0
hau_train_track_b_00524,"Tau ganiga wane ya ishi wane tsoron Allah. Natabbata she's doing something wrong that's why she was exposed. Am not happy rather than sad 😔 Allah tsayannan, sauran mata kukama kanku",0,0,0,0,3,0
hau_train_track_b_00525,Matasa sun ƙona gidan gona saboda kashe mai gadi a Jos,2,0,0,0,2,0
hau_train_track_b_00526,Kai dan Allah ji kayan sa Ko Gaye bai iya ba Wlh 😃😀😀,0,1,0,0,0,0
hau_train_track_b_00527,allah ya kawo mana qarshen wannan annobar,0,0,3,0,0,0
hau_train_track_b_00528,Hukumar jin dadin alhazai ta yi kira ga maniyyata su dakatad da shirye-shiryen Hajjin bana,0,0,0,0,1,0
hau_train_track_b_00529,Allah daya gari ban-bam: Rihanna ta maka mahaifinta kotu kan sanya sunansa a kasuwanci,0,0,0,0,0,2
hau_train_track_b_00530,ai ba abun burgewa bane,1,0,0,0,1,0
hau_train_track_b_00531,Kullum ba abin daya damu al'umma akeba😏,1,0,0,0,1,0
hau_train_track_b_00532,’Yan bindiga sun kashe manoma 2 suna shuka a gonarsu,0,0,0,0,3,0
hau_train_track_b_00533,"Wata Sabuwa: Ta sake kacamewa a APC, Sanata Adamu ya dakatar da dukkanin daraktocin jam'iyya",0,0,0,0,0,3
hau_train_track_b_00534,Taliyar tayi hunhuna yauki takeyi a flask din,0,2,0,0,0,0
hau_train_track_b_00535,"Kamar a jahiliyya: Uba ya kashe 'ya'yansa tagwaye, za a rataye shi har sai ya mutu",0,1,0,0,2,0
hau_train_track_b_00536,Yan Bindiga Sanye Da Kayan Sojoji Sun Kashe Fitaccen Jigon Jam'iyyar PDP a Bayelsa,0,0,2,0,2,0
hau_train_track_b_00537,"Kai😥 Allah ya sawaqe amma Ana zalunci a kasar nan wlh, saikaga nasama kokarinsa ya cuci na kasa dashi, shi bai taimaka mai ba sannan kuma anbashi yabayar kokari yake ya danne😭, Ohh Allah.🙆",1,0,0,0,3,0
hau_train_track_b_00538,Karshen duniya: Ma'aikacin gidan 'Zoo' ya yi wa macen goggon biri ciki,0,2,0,0,0,2
hau_train_track_b_00539,Da alamu Boss Mustapha da Abba Kyari su cigaba da rike mukamansu,0,0,0,0,0,0
hau_train_track_b_00540,Rubabben kwanannen abincin ya cika dakin girkin da wari,0,3,0,0,0,0
hau_train_track_b_00541,EU ta gargadi China kan taimaka wa Rasha,0,0,0,0,0,0
hau_train_track_b_00542,too ashe sunada bambanci uhumm,0,0,0,0,0,2
hau_train_track_b_00543,Jaruma mai kayanmata ta wallafa wasu bidiyo na taya ma'aikatanta 4 murnar aurensu,0,0,0,2,0,0
hau_train_track_b_00544,Dan tana daya daga cikin wanda suka sa albasa yayi tsada?? 😂,0,0,0,0,0,0
hau_train_track_b_00545,An zo gurin: Zan cire duk wani jami'in kwastan da yake samun kudi fiye da albashin sa - Hameed Ali,1,0,0,0,0,0
hau_train_track_b_00546,talakawa ma sunyi tir da ɓoye abincin su da aka yi,0,2,0,0,1,0
hau_train_track_b_00547,Yarinyan na cin abinci cikin kwanon da ke wari kuma cike da tsutsa,0,3,0,0,0,0
hau_train_track_b_00548,"Hadda Da Karatun Al-Kurani Mai Girma Yana Taimakawa Gyara Kwakwalwa, Gwamna Abdulrazaq",0,0,0,0,0,0
hau_train_track_b_00549,Wlhi Kunji kunya... Ashe dama ku yan madrid ne. Bakomae akwai Allah😧,2,1,0,0,1,0
hau_train_track_b_00550,Allah yakawo Mana zaman lafiya a kasarmu Nigeria 👈👈,0,0,1,0,1,0
hau_train_track_b_00551,Gwamna Nasir El-Rufai yayi alkawarin taimakawa Makauniyar da ta zama Lauya,0,0,0,2,0,0
hau_train_track_b_00552,Kaico: Jaririya tamutu bayan shan nonon uwar da maciji ya sara a Indiya,0,0,0,0,3,0
hau_train_track_b_00553,A gidan uwar wah zamu taya su murnar😒😏,3,0,0,0,0,0
hau_train_track_b_00554,Miyar Kuka tayi Kore kalar zawayin jariri,0,3,0,0,0,0
hau_train_track_b_00555,Ana Rigima a Jam’iyyar APC Tun da Ministan Buhari Ya Ki Fitowa Ya Goyi Bayan Tinubu,0,0,0,0,0,0
hau_train_track_b_00556,"Ok shi wannan yaron dan ana lallabashi gani yake kamar tsoronsa akeji, Hmm yaro baisan wuta ba sai ya taka America tafishi hauka yaseen🤒",2,0,0,0,0,0
hau_train_track_b_00557,Dama nasiru salisu zango KATO NE? Wlh jinake Dan siririne😂,0,0,0,0,0,3
hau_train_track_b_00558,Ke ba ko kyau gareki ba sai tsabar iskanci shashasha kawae😠😠😠,3,0,0,0,0,0
hau_train_track_b_00559,Buhari ya taya Amurka murnar cika shekara 245 da samun ’yanci,0,0,0,2,0,0
hau_train_track_b_00560,Se yau kika gani kenan😂🤣,0,0,0,0,0,1
hau_train_track_b_00561,Yanzu meye amfanin wanann labarin 🙄kayan tada zuciya da amai!! Gross 🤢🤮 Toh Allah ya tarwatsa Duk wanda yakeso yayi implementing din wannan bala’in,1,3,0,0,0,0
hau_train_track_b_00562,COVID-19: Boss Mustapha ya sanar da inda aka kwana a yaki da annobar,0,0,0,0,0,0
hau_train_track_b_00563,Mutanena yau kuma wannan shafin aka bude saboda kulalata muna yara a Twitter 🤔,0,0,0,0,0,2
hau_train_track_b_00564,"Wan nan batu haka yake, ace kana tsohon soja kuma mai muqamin #_GEN fah amma ace harkar tsaro ta gaza samuwa. Tur da shugaba irin kah wallhi 😭. Allah ka shiryi yan bindiga/garkuwa da mutane/ Boko Haram in suna da rabo, in Kuma basu da rabo Allah kai mana maganin su...😭🙏",1,0,0,0,3,0
hau_train_track_b_00565,jaka wawuya kawai nidai kawai abinda zance miki ki daina ikirarin ke musulmace dan gara kawai ki koma arnancin kawai dan yafi miki kyau allah ya shiryeki in daki shiryu in badaki shiryuba kuma allah ya mana maganinki idiot,3,0,0,0,0,0
hau_train_track_b_00566,"Ga wani ban daki da kashi ya kumbura a cikin tukunyar kashin, ga kuma tsutsar tana taaana tanata yawo a kasa saboda rashin wanki",0,3,0,0,0,0
hau_train_track_b_00567,mahaukaci ne ama,0,0,0,0,0,0
hau_train_track_b_00568,ga cuta ga macuta gakuma masu cutuwa ya allah,1,0,1,0,0,0
hau_train_track_b_00569,inna lillahi wa inna ilaihi rajiun again kuma daiallah kai kasan dalili allah mun tuba allah ka takaita wadan nan masifu da ka jarrabi kasar mu da su,0,0,3,0,1,0
hau_train_track_b_00570,"Tashin Hankali😲 Wannan KO Anya bazata samu tobon Hankali ba kuwa """"""""""""""""""""""""""""""""Shekaru 27 fa a sume"""""""""""""""""""""""""""""""" 😱",0,0,0,0,0,3
hau_train_track_b_00571,Allah ka yaye mana wannan annoba Amin 🤲 🤲,0,0,3,0,1,0
hau_train_track_b_00572,Kajimin masana ilimin taurari da shisshigi 🤔🤨Aimu masana ilimin yunwa da qishirwa mun tabbatar 29 za'ayi🙄😥,2,0,0,0,0,0
hau_train_track_b_00573,Garabasa: Hadiman Marafa a APC sun samu kyautar motoci 41,0,0,0,2,0,0
hau_train_track_b_00574,allah kakawo mana karshen zubarda jinnin musulmea afadin duniya,0,0,2,0,1,0
hau_train_track_b_00575,Kungiyar Jama'atu Nasril Islam tayi kira da a zauna lafiya kan batun adan kabilanci,0,0,0,0,0,0
hau_train_track_b_00576,"Kai Subhanallah 😥 Allah ya tona asirin Wanda yayi mata,Allah ka hanashi nutsuwar zuciya da kwanciyar hankali",2,0,0,0,2,0
hau_train_track_b_00577,"Katsina: Yan bindiga sun sake kai kazamin hari Malumfashi jihar Katsina, sun kashe mutane",0,0,2,0,3,0
hau_train_track_b_00578,Amsoshin tambayoyi: Barka da Sallah!,0,0,0,0,0,0
hau_train_track_b_00579,Zamfara 💭💭sabo da sanyi kankara ke fadowa,0,0,0,0,0,1
hau_train_track_b_00580,"Yan bindiga sun yi ma yayan jam’iyyar APC kwantan bauna, sun kashe 5",0,0,0,0,3,0
hau_train_track_b_00581,Karya kayi alade👀,2,0,0,0,0,0
hau_train_track_b_00582,Hannun kuturun Yana fitar fa ruwan mugunya,0,3,0,0,0,0
hau_train_track_b_00583,Hikenan ma haihuwa da hanji! Karshen Riga kafi kenan ko WHO iyakaci🤣🤣😁😁 NAIJA😎,0,0,0,0,0,0
hau_train_track_b_00584,😳😳Innalillahi wa inna ilaihirrajiun. Allah yai mana sauki da rangwame Allah ya yafe mana zunubai kurakurai da dukkan gangancin mu 😭😭 amn,0,0,3,0,1,0
hau_train_track_b_00585,"Kasar China ta fasa-kwai, ta ce Amurka ke hura wutar rikicin mutanen Falastina-Isra’ila",0,0,0,0,0,0
hau_train_track_b_00586,Lazy youth su samu wajan Shan iska mana 🤣😂🤣,0,0,0,1,0,0
hau_train_track_b_00587,Wata mata ta tsotse ruwan ciwon mijinta.,0,3,0,0,0,0
hau_train_track_b_00588,Allah muntuba allah mundawo xuwa gareka ya allah kamana tsari da wannan abu ya allah ka nisanta mu da ita ameen 🙏🙏😭😭😭,0,0,3,0,2,0
hau_train_track_b_00589,Tab di jan😯 wato shi yama manta asalinsa kenan?,0,0,0,0,0,3
hau_train_track_b_00590,"Dan Allah ku daina kawo mana irin wadannan labarun haushin..😢😢, Shi buharin duk kashe- kashe da ake yi a AREWA yataba yin wata maganar, ??",2,0,0,0,0,0
hau_train_track_b_00591,Mutumin da ya bai wa matar da yake so kodarsa ta ki aurensa,0,0,0,0,2,0
hau_train_track_b_00592,Matashin makiyayi ya kashe yayan sa saboda Saniya,0,2,0,0,3,0
hau_train_track_b_00593,Kalli Yar 20yrs Kamar me shayarwa😲,0,1,0,0,0,2
hau_train_track_b_00594,Rikici: APC da Buhari sun nemi a yi watsi da karar da ke neman tsige Buhari a daura Atiku,0,0,0,0,0,1
hau_train_track_b_00595,Aa bakuyi bahhh wlhh ko kadan❤️,1,0,0,0,0,0
hau_train_track_b_00596,Kwastoma da abokansa sun kashe Karuwa Musulma don sun ga Al-Qur'ani cikin dakinta,0,0,0,0,3,0
hau_train_track_b_00597,’Yan sanda sun kama wanda ya yi garkuwa da jikansa,0,0,0,0,0,0
hau_train_track_b_00598,Ba ance ya mutu ba 🙄,0,0,0,0,0,1
hau_train_track_b_00599,daman wanda ba musulmi ba ze iya auren mace musulma,0,0,0,0,0,3
hau_train_track_b_00600,Mutane da dama sun hallaka yayin da miyagun yan Bindiga suka farmaki barikin Sojoji a Sokoto,0,0,2,0,3,0
hau_train_track_b_00601,"Wata karuwa tayi ritaya bayan iyar da ayyuka ga mutane 28,000, ta sami kyautuka",0,0,0,0,0,2
hau_train_track_b_00602,Buhari ya yi ta’aziyyar mutuwar Uwargidar sarkin Daura da tsohon kwamishinan shari’a na Kano,0,0,0,0,3,0
hau_train_track_b_00603,"Ai ba takaitawa ba, anbar kawo hare haren ya kamata yace🙏",0,0,1,0,1,0
hau_train_track_b_00604,COVID-19: Gwamnatin Kano ta soke yin dukkan hawan sallah da shagulgula,0,0,2,0,0,0
hau_train_track_b_00605,Matar Ahmed Musa ta haifi ɗa namiji,0,0,0,2,0,0
hau_train_track_b_00606,"Toh,🤦 muda bamu yarda d itaba mah",0,0,0,0,0,0
hau_train_track_b_00607,"Ba labari me dadi a Nigeria, yan ta'adda na yaqarmu, shuwagabanni na mana izgili😢",0,0,0,0,3,0
hau_train_track_b_00608,Allah ya yi wa Sarkin Kauran Namoda rasuwa,0,0,0,0,3,0
hau_train_track_b_00609,Ya Allah kakawo mana maganin wannan musibar 🙏🙏🙏🙏,0,0,2,0,0,0
hau_train_track_b_00610,"Very unfortunate! Dama ai mafi yawan su, suna amfani da wannan damar ne domin suci zarafin talaka ! Saboda ni shaida ne akan irin wannan mummunar d'abi'ar ta mafi yawan jami'an tsaron kasar nan, samun damar shigar su aikin tsaro tamkar lasisin cin zarafi ne😡",3,0,0,0,0,0
hau_train_track_b_00611,Mai Tabargaza: Jarumar fim da ta sha tabar wiwi da shafin Bible ta ce a shirye take ta yayyaga Al-Qur'ani idan aka bata,0,2,0,0,0,0
hau_train_track_b_00612,An shiga fargaba a majalisar dokokin Jigawa kan yunkurin tsige kakakin majalisa,0,0,3,0,0,0
hau_train_track_b_00613,Sabon hari a Jos: 'Yan bindiga sun bude wa mazauna wuta a kauyen Durbi,0,0,3,0,2,0
hau_train_track_b_00614,ku banda ku,0,0,0,0,0,1
hau_train_track_b_00615,Sir karya takai tun kafin a haife ta nake kallon films dinka 😂 😂 😂,1,0,0,1,0,0
hau_train_track_b_00616,"Da duminsa: 'Yan bindiga sun kashe shahararren mafaraucin Adamawa, Mori",0,0,2,0,1,0
hau_train_track_b_00617,"Fasto Ya Yi Ɓatanci Ga Annabi (SAW) Da Al-Kur'ani a Osun Cikin Bidiyo, MURIC Ta Yi Martani",2,0,0,0,0,0
hau_train_track_b_00618,Rikicin Makiyaya: An fallasa asirin Gwamnan Jihar Benuwe,0,0,0,0,0,0
hau_train_track_b_00619,Dan hakin daka raina: Jam’iyyar PRP ta bada mamaki a jahar Bauchi,0,0,0,0,0,3
hau_train_track_b_00620,"Cikin fushi, budurwa ta wallafa bidiyon yadda tela ya canza sitayel din da ta zaba",3,0,0,0,0,0
hau_train_track_b_00621,"In kana raye zaka sha kallo😂. Ikon Allah, shi kuma wannan a haka nasa haukan yake!",0,1,0,0,0,3
hau_train_track_b_00622,Ya ci rubabben kwai,0,3,0,0,0,0
hau_train_track_b_00623,ina miki fatan alheri ako da Yaushe hakika ni masoyiyarki ce ta Gaskiya ILYSM 💗,0,0,0,2,0,0
hau_train_track_b_00624,Ya rasu lokacin da yake dinka kayan Sallah,0,0,0,0,3,0
hau_train_track_b_00625,Tafi tafi mah xa’ace an sace shugaban kasar indae aka cigaba da haka 🤔,1,0,0,0,1,0
hau_train_track_b_00626,Lafiya Jari: Amfani 10 na Dabino ga lafiyar bil Adama,0,0,0,0,0,0
hau_train_track_b_00627,Taya ya wannan ya zama mafita ga damuwan yan Nigeria 🇳🇬,0,0,0,0,0,0
hau_train_track_b_00628,"Allah Sarki, har helicopter Gwamnan jihar yake yawo da ita wai don tsaro. Talakawa kuma ko oho 😔",0,0,0,0,3,0
hau_train_track_b_00629,"Bidiyo: Matar aure ta bai wa mai kayan miya kyautar N1m, ta bayyana alherin da yayi mata a baya",0,0,0,2,0,2
hau_train_track_b_00630,Matar da Atiku ke sumbanta mahaifiyata ce - wani bawan Allah yayi bayani,0,0,0,0,0,0
hau_train_track_b_00631,Ya kamata gwamnati da kamfanoni su zuba jari a Kannywood- Darakta Kamal,0,0,0,0,0,0
hau_train_track_b_00632,kaji ƴan iskan banza da wofi kun je kunyi iskancin ku zaku rainawa mutane hankali abin ɓoye ne ya fito fili allah ya sawwaƙe amin,3,0,0,0,0,0
hau_train_track_b_00633,Uwa da 'Ya sun sheka barzahu bayan fasto ya basu jikon magani sun sha,0,0,1,0,2,1
hau_train_track_b_00634,Allah ka watsa su mugaye kawai😭,3,0,0,0,0,0
hau_train_track_b_00635,Ka yarda da ikon Allah - Sarakunan gargajiya sun shawarci Atiku,0,0,0,0,0,0
hau_train_track_b_00636,"Harin Kuje: Kun Bani Kunya, Buhari Ya Fada Wa Hukumomin Tattara Bayanan Sirri",0,0,0,0,1,0
hau_train_track_b_00637,"Anyi ruwa, kashin shanu ya jike ga yara sun shiga garken suna ta wanka da shi Harda masu ci",0,3,0,0,0,0
hau_train_track_b_00638,Yanzu-yanzu: Sabbin mutane 543 sun kamu da cutar COVID-19 a Nigeria,0,0,2,0,1,0
hau_train_track_b_00639,Ta taka zawon da akai kan hanya,0,3,0,0,0,0
hau_train_track_b_00640,wai wannan kazantace ko kuma rashi iya wanki amma ki canza bai miki makeup saboda kinfara likin,0,2,0,0,0,1
hau_train_track_b_00641,Fatan alheri zuwa gareki😍,0,0,0,2,0,0
hau_train_track_b_00642,Kwankwaso ya gina makaranta don murnar cika shekaru 64 da haihuwarsa,0,0,0,2,0,0
hau_train_track_b_00643,Ni Yasin kowa sai an mai dinnan taban daria over😂 dagaji kasan dan iskane kawai ya rubuta😂,0,0,0,2,0,0
hau_train_track_b_00644,"Bayan dakatar da Abba Kyari, IGP ya gargadi sauran jam'ian 'yan sandan Najeriya",0,0,1,0,0,0
hau_train_track_b_00645,Wannan cuta akwai rashin kunya dai😂😂 @<username>,0,0,0,0,0,0
hau_train_track_b_00646,"Yanzu Yanzu: Allah ya yi wa jarumin Kannywood, Ahmad Tage rasuwa",0,0,0,0,3,0
hau_train_track_b_00647,Kalli kyawawan hotunan Aisha Yesufu da mijinta yayin da suke murnar shekaru 21 da aure,0,0,0,3,0,0
hau_train_track_b_00648,🤣🤣🤣 ko kyau bb,0,1,0,0,0,0
hau_train_track_b_00649,Karasa wake rubuta Mai abun nan🤔 wani abun dakajishi sai Kai mamakin wai Anya kuwa anyi bincike kan fadin shi,1,0,0,0,0,2
hau_train_track_b_00650,Innalillahi wayyo Allah🙆Dan Allah gwamnati kisa baki adaena kashe su😭😭basuda laifi gara kuyi sasanci tsakaninku da adinga kashesu babu gaira babu dalili..Dan Allah kuyi wani abu akae mutuwa kawae akeyi😭😭,0,0,3,0,2,0
hau_train_track_b_00651,"Abin mamaki mutum yadinga girba karya, a,haukan tunaninsa daidai yake yi kaidai kwai surrkududu🦓🦓🦓🐴🐴🐴",2,0,0,0,0,2
hau_train_track_b_00652,Idan wannan ya fadi ai tashi zai masa wuya... 😂,0,0,0,1,0,0
hau_train_track_b_00653,Gyambon da ke kafar sa yana fitar da ruwa mai wari da ya ja hankalin kwari,0,3,0,0,0,0
hau_train_track_b_00654,Sheikh Dahiru Bauchi ya yi buda-baki da tawagar fastocin jihohi 19 na arewa,0,0,0,0,0,0
hau_train_track_b_00655,Aikin Banza Aikin Hofi. mtswwwww 🚶🚶🚶,3,0,0,0,0,0
hau_train_track_b_00656,"Katobara: Allah-n da ya yi mana maganin mulkin Abacha, shine zai kara taimakon mu a 2019 – Obasanjo",0,0,0,0,0,0
hau_train_track_b_00657,RS kina bura uba pah ki tayin sama! sama!! sama!!! bama hassada da yin Allah goooo 🏹🏹,0,0,0,2,0,0
hau_train_track_b_00658,allah ya kare mu daga wannan cuta masu ita allah ya basu lafiya,0,0,3,0,1,0
hau_train_track_b_00659,allah kashiga tsakanin mu da wannan yariman,0,0,2,0,0,0
hau_train_track_b_00660,Cutar korona ta hallaka mutum 654 a Najeriya - NCDC,0,0,1,0,3,0
