id,text,anger,disgust,fear,joy,sadness,surprise
hau_train_track_b_00879,Tashin hankali: Tsananin talauci da yunwa yasa na taba cin kashin mutum - In ji wata mawakiya,0,2,0,0,2,0
hau_train_track_b_00880,Yar shekara 14 ta ci kyautar wacce ta kera mutum-mutumin dake taimakawa wajen kiwon lafiya,0,0,0,2,0,0
hau_train_track_b_00881,Yanzu-yanzu: Allah ya yiwa mahaifin Makarfi rasuwa,0,0,0,0,3,0
hau_train_track_b_00882,Yarike mukaminsa ba'aso ai sunusi yafi karfinshi shi kansa yasani. dan haka bamason matsayin🤷‍♀️ muza'a rainawa hankali ya nada yayan matarsa......🙄🙄🙄,2,0,0,0,0,0
hau_train_track_b_00883,Allah ya tsare: Yadda aka yi garkuwa da wasu masu kasuwancin gawayi a Kaduna,0,0,1,0,2,0
hau_train_track_b_00884,Makarantar Hidayatul Muslimin ta Akim Kalaba ta yaye dalibanta,0,0,0,0,0,0
hau_train_track_b_00885,"Sabuwar cutar tsutsa ta bulla a gonaki a Kebbi, manoma na fargabar bazuwarta",0,0,3,0,0,0
hau_train_track_b_00886,allah subhanahu wataala kawargaxa shirinsu kakawomana qarshensu ya allah kawulakantasu dasuda masu daukar nauyinsu ya arhamarraheemeen ‍️,2,0,1,0,1,0
hau_train_track_b_00887,Khadimul Islam: Ganduje ya sanya wa sabuwar gadar sama sunan wani babban malamin Islama,0,0,0,1,0,0
hau_train_track_b_00888,wannan ko shine salman khan din,0,0,0,0,0,2
hau_train_track_b_00889,Allahumma ya kyauta 😂😂😂,0,0,0,0,0,0
hau_train_track_b_00890,"Dan Sadau: Kwamiti ya fusata, ya kori Sheikh Nuru Khalid daga limancin masallacin Abuja gaba daya",2,0,0,0,0,0
hau_train_track_b_00891,"Dan Gwamna El-rufai ya wallafa hoton matan mahaifinsa, ya ce auren mata fiye da ɗaya yana da kyau",0,0,0,1,0,0
hau_train_track_b_00892,Bayan aikin wahala yayi gumi ya shiga cikin mutane se tsami yake,0,2,0,0,0,0
hau_train_track_b_00893,"Nazo tsallaka kwatamin, idona ya gano min wasu gundura gunduran bahaya suna iyo a sama",0,3,0,0,0,0
hau_train_track_b_00894,ashe duniya har bango gareta barouba to lahira zasuje kenan,0,0,0,0,0,3
hau_train_track_b_00895,"Tonon silili: Mijina fitaccen dan luwadi ne, a Legas suke yin iskancin su - Matar aure",0,3,0,0,0,0
hau_train_track_b_00896,Ikon Allah! Ayoyin Al-Kur’ani sun bayyana a jikin jariri ( Hotuna),0,0,0,0,0,3
hau_train_track_b_00897,"Masha Allah Yayi dai dai, A masayina dan Borno nai farin ciki, Allah ya karbi Adu'armu,🤲🤲",0,0,0,3,0,0
hau_train_track_b_00898,Kawai a saka hukuncin kisa ga masu kidnapping domin wannan shine mafitar magance wannanatsalar ku taimaka wa talakkawa da dokar kisa akan masu kidnapping domin talakka kadai ne abin zaifi wahalarwa😭😭😭,2,0,0,0,2,0
hau_train_track_b_00899,Rariyar bandakin tana fito da wani ba'kin ruwa me wari.,0,3,0,0,0,0
hau_train_track_b_00900,ae bayan talauci bamusan komai ba tunda muka tashi🤔🤔,1,0,0,0,2,0
hau_train_track_b_00901,Nifa bazan zageki ba Amma Dan Allah inada tambaya guda daya kinaso kiga annabi muhammad (S.a.w) ? Adalilinki wani kafiri yake kalaman batanci akan annabinmu 😭😭 rahama Allah yashiryeni amiin ##URL##,0,2,0,0,3,0
hau_train_track_b_00902,Kyauta??? Zasu raba data ne? 😂,0,0,0,0,0,2
hau_train_track_b_00903,Hahahahahahahaha Wai sun fusata akan shafin Twitter.😂😂😂😂,0,0,0,2,0,0
hau_train_track_b_00904,🇳🇬🇳🇬uwa Mai kashe ya'yan ta🇳🇬🇳🇬🇳🇬,0,0,0,0,1,0
hau_train_track_b_00905,A gaskia ba'a mana Adalci! Talaka kam shine a wahale😢,0,0,0,0,3,0
hau_train_track_b_00906,wata zatayi murna da wannan labarin 😊,0,0,0,2,0,0
hau_train_track_b_00907,Zaben 2023: Prophet Barnabas Ya Yi Hasashen Yadda Peter Obi Zai Zama Shugaban Kasa,0,0,0,0,0,0
hau_train_track_b_00908,Abun yazo kanmu inji mai tsoron wanka😷,0,0,1,0,0,0
hau_train_track_b_00909,Àllah yasa kaffara ne Kuma kibar kuka 😭 ki lizamchi istigifari,0,0,0,0,3,0
hau_train_track_b_00910,"Subahanallah, Allah kah kawomana sauki cikin gagawa. Ameen🙏🙏",0,0,0,0,2,0
hau_train_track_b_00911,Babban hafsan Sojan sama ya nishadantar da Sojojin dake yaki da Boko Haram (Hotuna),0,0,0,2,0,0
hau_train_track_b_00912,Allah yasa a cikin barbarar da tai an samu karuwa ba tafiar banza tai ba😂💔,0,0,0,0,0,0
hau_train_track_b_00913,Yan bindiga sun budewa kwamandan Soji wuta a Kaduna,0,0,2,0,2,0
hau_train_track_b_00914,Mutane na son gulma😂,0,0,0,0,0,0
hau_train_track_b_00915,allah ya kawo muna karshen wannan rikichi na,0,0,2,0,0,0
hau_train_track_b_00916,"Abba Kyari ya sha da kyar, saura kiris masu fushi da shi su hallaka shi a gidan yari",0,0,2,0,0,0
hau_train_track_b_00917,"Arewa maso gabashin Nigeria na iya fuskantar matsanancin Fari da yunwa, Majalisar dinkin duniya",0,0,3,0,0,0
hau_train_track_b_00918,Allah yabiya soyaya zamani🔫😂😂😂😂😂😂😂😎😈,0,0,0,1,0,0
hau_train_track_b_00919,Rayuwar abun ban tsoro ce an ma raini yara da soyayya da kauna sun botsare inaga an kuntata masu .Cutar da yaro baya da wani amfani mata da iyaye maza suna yin babban kuskure tunba shi Uba yana gani ana cutar da yayansa idan mahaifiyarsu bata gidan sai ya kauda ido matar uba 😬,0,0,0,0,2,0
hau_train_track_b_00920,iko sai lillahi africa kenan abun mamaki baya karewa,0,0,0,0,0,3
hau_train_track_b_00921,Mijina ya kashe diyarmu don yin tsafin samun kudi – Uwargida ga Kotu,0,1,1,0,2,0
hau_train_track_b_00922,Jiya naji wannan lbr a fcbook ban yarda ba amma yanzu NA aminta hmm Nigeria kenan kasarmu ta gado🤔🤔,0,0,0,0,0,1
hau_train_track_b_00923,ya yabawa banza dai,2,0,0,0,0,0
hau_train_track_b_00924,"Anyi """"""""""""""""""""""""""""""""watsi"""""""""""""""""""""""""""""""" da al'adu 😂😂😂😂",0,0,0,0,0,0
hau_train_track_b_00925,Nifa duna rude😂,0,0,0,0,0,0
hau_train_track_b_00926,😢😢😢😥munaji munagani an rabamu da kannenmu acikin wanyanda yan bindiga suka sace akwai yan garina amma shiru kakeyi allah ka isarmana mana 😭😭,2,0,0,0,2,0
hau_train_track_b_00927,Nih kam man utd nake goyon bayan suci wannan gasar sannan kokunki koh kunso su zasuci kofi dakune yan city😉,0,0,0,1,0,0
hau_train_track_b_00928,Allah Akbar kabiran Allah ya gafarta ma ibro ya haskka kabin ka yasa mu cika da imani 😭😭😭😭,0,0,0,0,3,0
hau_train_track_b_00929,"An Kama Yan Sanda Da Ke Ba Wa Rarara Tsaro, Za Su Gamu Da Fushin Hukuma",0,0,0,0,0,0
hau_train_track_b_00930,Ikon Allah: Kofura Bashir Umar wanda ya mayar da kudi N15m ya samu zuwa Hajji,0,0,0,1,0,3
hau_train_track_b_00931,Dakin bahayan anguwar ta cika tam harta birtsin kashi.,0,3,0,0,0,0
hau_train_track_b_00932,"Hasbunallahu wani'imal wakil, Allah kayi mna tsari ga wannan cutar 😭🙏",0,0,2,0,1,0
hau_train_track_b_00933,Which red LIPS🙄 Ke kaurama abu jan baki Wallahi labbanki kamat smeagol😂,1,0,0,0,0,0
hau_train_track_b_00934,Babbar magana: Matan Kannywood suna bin mazan banza da masu mulki - Tanimu Akawu,0,0,0,0,0,3
hau_train_track_b_00935,"Son komawa wasa Turai domin gogayya da manyan 'zakaru' yasa na bar Al Nassr, Ahmed Musa",0,0,0,0,0,0
hau_train_track_b_00936,Mumu sai speak English. You sef yaushe kika iya English din😏🙄🤨🙄😏🤨🙄😶😏🙄,2,0,0,0,0,1
hau_train_track_b_00937,Yar Bala I sai kkace gindin akuya ne da ita 😏😏,2,2,0,0,0,0
hau_train_track_b_00938,What took her to Dubai for long time up-to 6Months Shegiya tajeee Adamawa a Bata na gargajiya mana 😏😏,3,0,0,0,0,0
hau_train_track_b_00939,"An kama ja'iri yana lalata da mata kanana a tare, N50-N50 kuwa ya basu shegen",1,3,0,0,0,0
hau_train_track_b_00940,Iran ta bayyana cewa ita ta harbo jirgin Ukraine da yayi sanadiyyar mutuwar mutane 176,0,0,0,0,2,2
hau_train_track_b_00941,Wai d'an farka sai gumi ya ke a cikin alkyabba 😂,0,0,0,0,0,0
hau_train_track_b_00942,"E munsan da haka, Amma kuji tsoron Allah ku fadawa gwamnati gaskiya, Kamar yadda kuka Yi mata kamfe.😠",1,0,0,0,1,0
hau_train_track_b_00943,Daman bata da aure 🤔,0,0,0,0,0,2
hau_train_track_b_00944,Bidiyo: Budurwa ta tumurmusa saurayinta a kasa bayan ta kama shi yana lalata da wata,2,0,0,0,0,1
hau_train_track_b_00945,haba wai mutane sun koma kamar dabbobi suma kamar gargin tumaki ne da za a re na ma na wayo wai sata ita gwannatin wai ita an fita wayo ne abin tambaya anfi gwannati wayo wlh Allah sai ya tambebaku domin mu amana ce mu a gareku wlh zaku amsa tambaya😭😭,3,0,0,0,2,0
hau_train_track_b_00946,baajin labari na alheri sede sharri awajenku tirr daku,2,2,0,0,0,0
hau_train_track_b_00947,Bama yi Ayy siyasar ba gado bacce...🙄🙄🙄,2,0,0,0,0,0
hau_train_track_b_00948,‘Gaskiya ita ce kashin bayan samun duk wani alheri’,0,0,0,0,0,0
hau_train_track_b_00949,"Asirin fasto ya tonu, bayan wani mutumi ya bayyana yadda ya kama shi yana kwanciya da matarshi da kuma 'yarshi",0,3,0,0,1,0
hau_train_track_b_00950,"Hmm, mu ba subsidy ne damuwar mu ba🤷, ya za'a yi a samu sauqin wahalar da talakawa suke ciki🤷",0,0,0,0,2,0
hau_train_track_b_00951,Muma munaji da satar mutane da fashi da makami😏suje chan su magancewa kansu matsalar su gwara ma su sunada tsaro kuma ba yunwa😏😏😏,1,0,0,0,2,0
hau_train_track_b_00952,woow gsky rahma wakar tayi dadi sosai nima nasha rawa sosai,0,0,0,3,0,0
hau_train_track_b_00953,"An kashe fararen hula sama da 300,000 a rikicin Siriya — Rahoto",0,0,0,0,3,0
hau_train_track_b_00954,kaji mahaukaci sai ka kawo hujjar ta nuna cewa murdiyar zabe khadimul islam yaje ai ganduje aikin jamiyyarsa yaje kamar yanda jamiyya ce ta zabeshi matsayin mai saka ido akan wannan daga bangarenta banda mahaukaci kwankwaso da yaje can din wani yace murdiyar zabe yaje,3,0,0,0,0,0
hau_train_track_b_00955,Yan bindiga sun tsere da bindigar soja bayan kashe shi,0,0,0,0,2,0
hau_train_track_b_00956,yana biya mana kallan jikin mai cin bashin kaga,0,0,0,0,0,0
hau_train_track_b_00957,"Innalillahi: Allah ya yiwa hamshakin attajiri a Kano, Tahir Fadlullah rasuwa",0,0,0,0,3,0
hau_train_track_b_00958,Kisan kwamandan Sojan Iran: Ayatollahi Khameini ya sanar da sabon babban kwamanda,0,0,0,0,2,0
hau_train_track_b_00959,Mahaukaci ya tara baki yana shan ruwan kwata.,0,3,0,0,0,0
hau_train_track_b_00960,Qarya uwayensu keyi yasin dakaga anyimin ita toh naga bana motsi ko sedde🤨,2,0,0,0,0,0
hau_train_track_b_00961,Hotuna: Yadda bikin karamar Sallah ya gudana a birnin Zazzau,0,0,0,2,0,0
hau_train_track_b_00962,baragurbin kwai ya fashe a cikin kasuwa mutane duk sun watse suna toshe hanci,0,3,0,0,0,0
hau_train_track_b_00963,Ana iya shege a lanjeriya😂😂,0,0,0,0,0,0
hau_train_track_b_00964,Allah sarki rahma kenan kuma haka dukiya matsayi da daukaka yake karewaba ya kuma barki da halinki mu'allima rahma akoma islamiya kafin azo a fara fadamana falsafa da tajwidi karya😼😼,1,0,0,0,1,0
hau_train_track_b_00965,"Da duminsa: An nemi fitaccen mai garkuwa da mutane, dillalin makamai an rasa a kurkukun Kuje",0,0,0,0,0,1
hau_train_track_b_00966,wallahi karyar banzaace,2,0,0,0,0,0
hau_train_track_b_00967,to a nawa za a sayar da dambunta,0,0,0,0,0,0
hau_train_track_b_00968,Da wuri haka?😯 Amma bata kyauta ba domin kuwa yin hakan zai karkatar da hankalin masu rike da madafin iko daga yin abinda ya kamata.,0,0,0,0,2,0
hau_train_track_b_00969,allah bai haramta ba sai wani kamfani,1,0,0,0,0,1
hau_train_track_b_00970,Rarara ya gwangwaje jaruman Kannywood da kyautar sabbin motocin alfarma,0,0,0,2,0,0
hau_train_track_b_00971,"Tashin Hankali Yayin da Yan Bindiga Suka Yi Wa Jami'an NDLEA Kwanton Bauna, Bidiyo Ya Bayyana",0,0,3,0,0,0
hau_train_track_b_00972,sai dai abinda mike xargi akan tun parkon na dashi daman siyasa kawai amma irin wannan ai cima masarauta hakki ne,1,0,0,0,1,0
hau_train_track_b_00973,Ta damalmale jikinta da kashi,0,3,0,0,0,0
hau_train_track_b_00974,Allah ya qara lfya Muma Muna taya kanmu murna cika shekara 14 muna Azumi 30 na Ramadan duk wata🏃🏃🏃,0,0,0,3,0,0
hau_train_track_b_00975,"Innalillahi wa'inna ilaihirraji'un, Allah Yamana maganin duk wani abunda ya gagaremu🙏",0,0,2,0,2,0
hau_train_track_b_00976,Ƙarya kike☹️ You miss abroad dai coz of coro🤣🙄 Zaman gida dole 🇳🇬😜😜,2,0,0,2,0,0
hau_train_track_b_00977,"👉Wani Sabon #MugunLabari Ga PDP, maqiya Buhari da Nigeria 👉&amp; zasu ce Buhari ya kaisu yawon bude Ido gurin yan Taadda 👉So kuwa &amp; zasu Yi koqarin alakanta abin da yan #BokoHaram 👉Mu masoya Muna Murna ba a Rasa Rai ba",1,0,0,2,0,0
hau_train_track_b_00978,dama nigeria nada ofishin jakadanci a iran,0,0,0,0,0,3
hau_train_track_b_00979,Zasu sa miki hawan jini kau😂😂😂,0,0,0,0,0,0
hau_train_track_b_00980,Yara su na wanka da ruwan kwata,0,3,0,0,0,0
hau_train_track_b_00981,Nageria da dadi mallam 😂 😂,0,0,0,3,0,0
hau_train_track_b_00982,Rana bata karya Aimaka rana kaiwa mutundare Damar save kubarshi U😋😋😋,0,0,0,0,0,0
hau_train_track_b_00983,Sulhu alheri ne: Abdulaziz Yari da Kabiru Mafara sun kama hanyar dinke barakar APC a Zamfara,0,0,0,1,0,0
hau_train_track_b_00984,Wanga diya bakida kirki aradu🤣🤣,0,0,0,0,1,0
hau_train_track_b_00985,Taliban ta murkushe gyauron masu yi mata tawaye,0,0,0,0,0,0
hau_train_track_b_00986,Innalillahi wa'inna ilaihi raju'un Allah ya kawo mana karshen wannan masifan🤲🤲,0,0,3,0,0,0
hau_train_track_b_00987,Tashin hankali: Wasu matasa sun rabawa yan gidan biki lemu lode da kwaya a Katsina,0,0,3,0,0,2
hau_train_track_b_00988,"Yan bindiga sun kashe matar likitan da suka sace a Kaduna, sun nemi a biya N20m a fanshi yaran ta",0,0,2,0,2,0
hau_train_track_b_00989,Farfajiyar gidansu tayi datti ciyayi suntaru shuri ya fito a gefe tururuwa sunata yawo akai,0,2,0,0,0,0
hau_train_track_b_00990,"Allah ya kiyaye, Saura kiris sabuwar rikici ya barke tsakanin Hausawa da Yarabawa a Ile-Ife",0,0,3,0,0,0
hau_train_track_b_00991,"Ribar N1000: Kamfanin BUA ya tona asirin 'yan kasuwa, ya ce sune silar tsadar siminti",0,0,0,0,0,2
hau_train_track_b_00992,Gidan ubanwa ta ciyo bashin?😄,2,0,0,0,0,0
hau_train_track_b_00993,"Mu ne muka kashe kasar nan, ya kamata yanzu ina gidan kurkuku inji Tsohon Ambasada",1,0,0,0,0,0
hau_train_track_b_00994,Ni na dauka ma ni kadai ne haka takr faruwa dani Ashe muna da yawa to am just silent🤔,0,0,0,0,1,1
hau_train_track_b_00995,Allah ya mana maganin dukan cututtukan dake damun mu🙏,0,0,2,0,2,0
hau_train_track_b_00996,Subhanallahi!!! Allah kamana maganin wannan musiba🙏,0,0,3,0,1,0
hau_train_track_b_00997,"Gwanda mu daina yaudarar kanmu, abubuwa sun tabarbare a kasar nan: Sarkin Musulmi",0,0,0,0,1,0
hau_train_track_b_00998,Rasuwar mahaifiyar Buratai: Kalaman da Zulum ya yi ga babban hafsin sojan,0,0,0,0,2,0
hau_train_track_b_00999,Manjo bbu mgn wlh 😂😂😂 ya qware wajan yin Allah wadae😂😂😂,0,0,0,0,0,0
hau_train_track_b_01000,Duniya idan baka mutu zaka ga abubuwa kala kala😂,0,0,0,0,0,3
hau_train_track_b_01001,tab lallai akwai ƙura 🤔 ya ɓata? sai kace wata kaza',0,0,0,0,0,1
hau_train_track_b_01002,"Allah ya yiwa mai kula da masallacin Manzon Allah, Agha Habeeb Muhammad al-Afari, rasuwa",0,0,0,0,3,0
hau_train_track_b_01003,"Yan kutumar uba., akwai guba a cikineh na yau din...😏",2,0,0,0,0,0
hau_train_track_b_01004,Duk wanda ya iya taka rawar fim din Rariya zai samu kyauta mai girma daga Rahama Sadau,0,0,0,2,0,0
hau_train_track_b_01005,ya allah ka yaye mana wannan masifa bijahi rasulullah saw,0,0,3,0,0,0
hau_train_track_b_01006,A tauna Tsakuwa domin Aya tayi nadama!👍🏿💪🏿👏,0,0,0,0,0,0
hau_train_track_b_01007,"Wa'iyazu billahi, ama dai wannan ba boko haram ne ba taadanci ne da rishin addini indai boko haram ne ya mutane suna cikin ibada kuma ana takura nusu, ya Allah ka kawoma bayunka dawki🤲 Amin",1,0,0,0,2,0
hau_train_track_b_01008,Yan sanda a Dubai za su yiwa karuwan Najeriya kwasar kaji bayan sun samu gawar wani Balarabe da ya mutu a yayin da yake lalata da wata karuwa,0,2,0,0,1,0
hau_train_track_b_01009,Japanawa na murnar samun daukar nauyin gasar Olamfik ta 2020,0,0,0,2,0,0
hau_train_track_b_01010,"Ramadan: Saudiyya Ta Tuna da Kano, Ta Yi Mata Goma Na Arziki, Abba Ya Yi Godiya",0,0,0,2,0,0
hau_train_track_b_01011,Wai dama haryanzu ana irga masu corona ne?? Ikon Allah🤔,0,0,0,0,0,3
hau_train_track_b_01012,Mamaki: Yawan Musulmi ya zarce na Kiristoci a Cocina ranar Kirsimeti - Fasto a Kaduna (Hotuna),0,0,0,0,0,3
hau_train_track_b_01013,COVID-19: Mai maganin gargajiya zai yi wa majinyata magani kyauta,0,0,0,1,0,0
hau_train_track_b_01014,Bikin murnar cika shekara 50 da fara zuwa duniyar wata (9),0,0,0,2,0,0
hau_train_track_b_01015,UNHCR: A taimakawa yan gudun hijra da iyalansu cikin wannan watan Ramadanan,0,0,0,0,0,0
hau_train_track_b_01016,Gaskiya wannan lamarin maiyi dadi bah wlh 🙄🙄🙄,0,0,0,0,3,0
hau_train_track_b_01017,"Wallahi zaku zubar da kimar dakuke da ita,yanzu wannan har yakai wani labari.😒😒",2,0,0,0,0,0
hau_train_track_b_01018,allah ya isa data ta‍️,3,0,0,0,0,0
hau_train_track_b_01019,amma amma ai kamar ba bacci suke ba,0,0,0,0,0,1
hau_train_track_b_01020,Ko da kuturu ne👌🥰,0,0,0,0,0,0
hau_train_track_b_01021,Da duminsa: Sabbin mutane 136 sun kamu cutar Coronavirus yau,0,0,2,0,1,0
hau_train_track_b_01022,"Yan bindiga sun yi barazanar kashe mu, su soya namar mu su cinye, Ɗalibar Jangebe",0,0,3,0,0,0
hau_train_track_b_01023,“Allah Ka Albarkaci Nemana”: Bidiyo Ya Hasko Kyakkyawar Budurwa Tana Tuwon Siyarwa,0,0,0,1,0,0
hau_train_track_b_01024,"🙆🙆 what!! Ba""""""""kin gida😜😜",0,0,0,0,0,2
hau_train_track_b_01025,BBC Hausa sunkoma tallan maganin ma aurata 😂,0,0,0,1,0,0
hau_train_track_b_01026,"Alheri ne ga 'yan Najeriya hana kasuwancin Bitcoin, in ji gwamnan CBN",0,0,0,1,0,0
hau_train_track_b_01027,Sai da na sake kashe wata mata bayan tserewar da na yi daga hannun ‘yan sanda – Kwararren makashi Shodipe,0,2,0,0,1,0
hau_train_track_b_01028,Shiyassa haryanxu bariki ke aurenkie😏,2,0,0,0,1,0
hau_train_track_b_01029,"An sace uwa da 'yar ta a Sokoto, an tsince su a Kaduna",0,0,2,0,1,2
hau_train_track_b_01030,Daga fadin gaskiya sai kora daga aiki🤔 toh Allah ya kyauta.,0,0,0,0,1,2
hau_train_track_b_01031,🤣🤣🤣 wanga mutum da son mulkin tsiya shi kuma mulki yayi tutsu,0,0,0,0,0,0
hau_train_track_b_01032,hamm koma meye wannan gmb shiya jawa kansa muna nuna masa so amma baya son mu sai yan kudi ‍️‍️,0,0,0,0,1,0
hau_train_track_b_01033,Mu dai a Kaduna ana Mulkin Hauka 😭😭,1,0,0,0,2,0
hau_train_track_b_01034,"Ya yi amai ya lashe...🐕 Chan da su gada, Allah ya raka taki gona....",2,1,0,0,0,0
hau_train_track_b_01035,wayyo allah ya allah ka kawo mana karshen abun nan allah ya kawo mana kwanciyan hankali ameen,0,0,3,0,0,0
hau_train_track_b_01036,Inna lillahi wa inna lillahi raji'un 😭😭😭 shugabanni kuji tsoron Allah,1,0,0,0,2,0
hau_train_track_b_01037,"Gaskiya shugaban kasa malam Yayi kokari Allah yasaka mai da alkhairi saura minimum wage, yanzu kuma yarage ga police 👮 na Nigeria suji tsoron Allah sudaina ansar chin hanchi.",0,0,0,2,0,0
hau_train_track_b_01038,Miyar da su ke ci kyankyaso ya fada ciki,0,3,0,0,0,0
hau_train_track_b_01039,Yadda da ya yi wa matar mahaifinsa ciki a Nasarawa,0,2,0,0,0,0
hau_train_track_b_01040,ya allahka hada kan dukkanin kasashen musulmin duniyah gabakih dayah sannan allah kakawoh karshen rashin zaman lafiyah akasashen musulmi damah duniyah gabaki dayah,0,0,1,0,2,0
hau_train_track_b_01041,"Ba ni ba siyasa – Jarumin Indiya, Salman Khan",0,0,0,0,0,0
hau_train_track_b_01042,allah kakawomana daukiya allah,0,0,2,0,0,0
hau_train_track_b_01043,Toooi wata sabuwa kuma 😂,0,0,0,0,0,2
hau_train_track_b_01044,Sae Mae Dan wahala🙄 ko ba komae kunena zae huta da jin sunan BUHARI🥰,2,0,0,0,0,0
hau_train_track_b_01045,Laaaaaaa🤔 Ashe shima Ganduje ya zaba😂,0,0,0,0,0,3
hau_train_track_b_01046,kunfi kowa iya hege ai a social media ai,0,0,0,0,0,0
hau_train_track_b_01047,"Yanzu-yanzu: An saki ASD, 'Dansa, Surukinsa, da Sheikh Murtala Al-Misry",0,0,0,2,0,0
hau_train_track_b_01048,"Matashin da ya yi wuf da wayoyin karuwai 2 bayan ya kai su otal yin lalata, an damkeshi",0,0,0,1,1,0
hau_train_track_b_01049,gsky hirar nan tae dadi Allah ya taemaka🙌🙌,0,0,0,2,0,0
hau_train_track_b_01050,Kana taka Allah na tashi: Ango ya mutu kwanaki kadan bayan ya auri kyakkyawar amaryar shi,0,0,0,0,3,0
hau_train_track_b_01051,Daga baya kenan karya yake yayi yanzu de kwaskwarewa yakeson yayi.....😏,1,0,0,0,1,0
hau_train_track_b_01052,’Yan bindiga sun kashe Basarake a Zamfara,0,0,0,0,3,0
hau_train_track_b_01053,"Mata mai sana'ar wankau ta gina gidan kanta, 'yan Najeriya sun taya ta murna",0,0,0,3,0,2
hau_train_track_b_01054,Kona coci da sansanin sojoji a Nigeria: Ƙungiyar ISWAP ta ɗauki alhakin kai hari,0,0,0,0,1,0
hau_train_track_b_01055,"A tunanina akuya na kashe, in ji mijin da ya kashe matarsa",0,2,0,0,0,0
hau_train_track_b_01056,Allah Ya yi wa dan fim Cinnaka rasuwa,0,0,0,0,3,0
hau_train_track_b_01057,"An gudanar sa Sallar jana'izar jarumin soja, Manjo MM Hassan",0,0,0,0,3,0
hau_train_track_b_01058,Allah ubangiji ya ji qansu gabadaya ya kuma yi musu rahma 😖😭😭 sun manta da za’a je lahira dukkan rai zai dan dani mutuwa 😭😭😭😭😭😭😭😭😭😭😭😭😭#ZabarmariMassacre #SackTheServiceChiefs @<username>,0,0,0,0,3,0
hau_train_track_b_01059,"Ko shakka sai kudin Hajji ya tashi, babu yadda muka iya - NAHCON",0,0,0,0,2,0
hau_train_track_b_01060,ai tun a karo na farko ya bamu mamakin ynx me ya rage,0,0,0,0,0,2
hau_train_track_b_01061,allah yajikansa da rahama yasa mutuwa hutuce agareshi,0,0,0,0,3,0
hau_train_track_b_01062,Mai gaskia yana tare da Allah 👌🏻,0,0,0,1,0,0
hau_train_track_b_01063,Iko-sai-Allah: Wata tsaleliyar budurwa ta auri kanta-da-kanta,0,0,0,0,0,3
hau_train_track_b_01064,Innalillahi wa inna ilaihi raji’un: Allah Ya yi ma yayar Gwamna Yahaya Bello rasuwa,0,0,0,0,3,0
hau_train_track_b_01065,Fusatattun 'yan fansho sun garkame SSG na Ogun kan rike N68bn na garatutinsu,3,0,0,0,0,0
hau_train_track_b_01066,"Yanzu-yanzu: Allah ya yiwa Tsohon GMD na NNPC, Maikanti Baru, rasuwa",0,0,0,0,3,0
hau_train_track_b_01067,Akwai yiwuwar a fara wahalar man fetur a gidajen man Jihohin Arewa saboda bashin N50bn,0,0,1,0,1,0
hau_train_track_b_01068,Inafatan majalisar dinkin duniya tana kallan irin yadda yansanda ke musgunawa masu zanga-zangar lumana a kasar America 🇺🇸,0,0,0,0,2,0
hau_train_track_b_01069,"Mahaukaciyar guguwa ta lalata gidaje 1,000 ta kashe mutane 3 a Sokoto",0,0,1,0,3,0
hau_train_track_b_01070,Abun mamaki har yanzun a 2021 akwai masu sauraran jawabin Buhari. 🤣,0,0,0,0,0,2
hau_train_track_b_01071,"Jarumin fina-finan India, Amitabh Bachchan ya kamu da korona",0,0,2,0,1,0
hau_train_track_b_01072,"Misplaced Priorities 😏 Ana nan ana kashe yan uwan ki, masoyan ki a Arewa baki ce komai ba. Kin je kina saka baki a kan harkar da bata shafi yankin ki na Arewa ba. Use this same energy and try to make a change on the problems facing the North.",2,0,0,0,1,0
hau_train_track_b_01073,Tashin Hankali Yayin da Wasu ’Yan Bindiga Suka Yi Kokarin Farmakar Sanatan Neja a Gidansa,0,0,3,0,0,0
hau_train_track_b_01074,Aikin banza karya kara jawabin har ya gama banje yayiwa wayan da suka rasu ta'aziyaba ko su ba mutane bane ko kuma bai koya a zaman sa a gida ba mutuwace Shima xai yita wlh sai munyi bikin mutuwar ma 😏😏😏😏😏,3,0,0,0,0,0
hau_train_track_b_01075,Matatar Mai ta Dangote zata kashe kasuwar matatun Turai da muke sayen mai,0,0,0,1,0,0
hau_train_track_b_01076,tayaya ta kwance ko da staye ️️️,0,0,0,0,0,2
hau_train_track_b_01077,"Bidiyo: An daura auren Suleiman da Ba-Amurkiyya, Jenine, a Kano cikin annashuwa",0,0,0,3,0,0
hau_train_track_b_01078,Gaskiya el rufai yafi buhari mugunta 😟,2,0,0,0,0,0
hau_train_track_b_01079,Yanzu-yanzu : Buhari ya gana da Shettima bayan an kaddamar da shi abokin takarar Tinubu,0,0,0,0,0,0
hau_train_track_b_01080,hhhh kuma wai dolene mazan sai sunayi suna dariya? 😂,0,0,0,0,0,2
hau_train_track_b_01081,allah yajikan so da raham allah yayafe muso amin somma amin,0,0,0,0,3,0
hau_train_track_b_01082,yanzu wai bacci zakiyi da girman ki,0,0,0,0,0,1
hau_train_track_b_01083,Allahu Akbar: Kasar Saudiyya ta shirya gasar kiran sallah da karatun Al’kur’ani,0,0,0,2,0,0
hau_train_track_b_01084,Audugar ta yi caba-caba da jini.,0,3,0,0,0,0
hau_train_track_b_01085,Wai nikam mene damuwan kuh da tafiye tafiyen tsohon nan neh kun ishe muh fah😏,2,0,0,0,0,0
hau_train_track_b_01086,Garin da ake saya wa birrai gonaki,0,0,0,0,0,1
hau_train_track_b_01087,Ran wa aka faranta mu da muke struggling a cikin rana da buda baki da kunu da qosai ae sai dai hamdallah🥺🥺,0,0,0,0,2,0
hau_train_track_b_01088,Yaron yazo yanata kwakular tasano yana tsotsewa,0,3,0,0,0,0
hau_train_track_b_01089,"Allah ya yi wa tsohon gwamnan Kaduna, Balarabe Musa rasuwa",0,0,0,0,3,0
hau_train_track_b_01090,"Kare ya mutu a gefen hanya,kudaje suna ta bin kanshi",0,3,0,0,0,0
hau_train_track_b_01091,Rai banza: Sama da yayan kungiyar matsafa 20 aka halaka a jahar Edo,0,0,0,0,3,0
hau_train_track_b_01092,Tabargaza: ‘Yan sanda sun rarumi wani likitan bogi bayan ya kashe mutum 2 da sunan tiyata,0,0,0,0,0,2
hau_train_track_b_01093,Yadda Mata ke kokarin mu'amalan ta da ni - Dangote,0,0,0,0,0,0
hau_train_track_b_01094,Kuma dukansu sun dade suna neman mulki kafin suka samu ..... Toh ko amerika ma zasu chi uban su ke Nan kaman yanda Nigeria suke chi 😂,0,0,0,0,0,0
hau_train_track_b_01095,EndSARS: Abdulsalami Abubakar ya bukaci matasa su rungumi zaman lafiya,0,0,0,0,0,0
hau_train_track_b_01096,"Na cika alkawarin da na dauka wa nakasassun yan Najeriya, shugaba Buhari",0,0,0,1,0,0
hau_train_track_b_01097,Yanzu-Yanzu: Allah Ya Yi Wa Sarkin Dutse Muhammadu Sanusi Rasuwa,0,0,0,0,3,0
hau_train_track_b_01098,allah dan girmanka allah dan darajiar ka allah ka yayiwa al umar ka wannam masifar aduniya allah,0,0,3,0,0,0
hau_train_track_b_01099,Wani yaro yanacin abinci a duhu yahada matattace kyankyaso yacinye,0,3,0,0,0,0
hau_train_track_b_01100,Can ta yanka musu 😂,1,0,0,0,0,0
hau_train_track_b_01101,Toh fa muna mu kallo 🤪🙄 Allah ya kyauta,0,0,0,0,0,2
